Hotel,Summary
usa_new york city_salisbury_hotel,"The Salisbury Hotel is described as an older hotel with charm, not contemporary or modern, but clean and comfortable with old-fashioned decor. There is no bar or restaurant but nearby dining options, with spacious and well-equipped rooms."
usa_new york city_san_carlos_hotel,"The San Carlos is a smaller, quiet boutique hotel with a serene atmosphere, recently renovated with elegant decor. Reviews mention a friendly and helpful staff, with some reviewers noting personal touches such as the owner greeting guests."
usa_new york city_seafarers_international_house,"Seafarers International House is a budget-friendly accommodation located near Union Square, offering basic, clean rooms with options for private or shared bathrooms. It provides amenities such as free internet access, coffee in the lobby, and laundry facilities, while maintaining a simple, no-frills atmosphere."
usa_new york city_sheraton_new_york_hotel_towers,"This Sheraton is well-situated in midtown with comfortable beds, a gym and a renovated lobby but is also a very busy, large hotel with many conferences and high traffic in the lobby. Some reviewers described the rooms as small and worn, the staff as unfriendly, and the hotel as not living up to 4-star expectations."
usa_new york city_skyline_hotel,"The Skyline Hotel is a reasonably priced, clean hotel in a central location with spacious rooms, a pool, and easy access to Times Square and subway stations. Select rooms have views of the Empire State Building and the hotel is near many restaurants and delis."
usa_new york city_smyth_hotel_a_thompson_hotel,"The Smyth Tribeca is a modern, stylish boutique hotel with a subdued lobby and cozy nooks that provide a sense of privacy. It is located in Tribeca, near many shops and restaurants and close to several subway lines."
usa_new york city_sofitel_new_york,"The Sofitel New York is described as luxurious, well-managed, and organized, with a French-inspired ambiance, and some reviewers note the hotel has a sophisticated but serene atmosphere. It is considered to be a quiet and comfortable hotel, with efficient and helpful staff, appealing to both business and leisure travelers."
usa_new york city_soho_grand_hotel,"Soho Grand Hotel is known for its stylish, modern decor with a hip atmosphere and a buzzing bar scene that attracts a trendy crowd. The hotel is well-located in SoHo, which provides convenient access to shops and restaurants."
usa_new york city_soho_house_new_york,"Soho House is a hotel and private club with a rooftop pool and bar, located in the Meatpacking District. Guests have access to Soho House events, and the hotel aims for a ""no attitude"" atmosphere with helpful staff."
usa_new york city_stay,"The Stay Hotel features a trendy and chic lobby with aquariums and a bar/lounge (Aspen Social Club) that has a lodge-like theme with a lighted mosaic wall and antler decorations. Some found the staff friendly and the location excellent, but noted that rooms can be small, elevators slow, and noise from the bar can be an issue on lower floors."
usa_new york city_the_alex_hotel,"The Alex Hotel is a modern, smaller boutique hotel with a generally friendly staff and comfortable, clean rooms, and suites that have kitchens and living areas. The hotel is located in midtown, close to Grand Central station and the UN, but is generally in a quiet area."
usa_new york city_the_belvedere,"The Belvedere Hotel has a stylish Art Deco lobby, newly renovated rooms on the higher floors, and a friendly staff. It is located on a quiet side street, offering a respite from the hustle and bustle of Times Square."
usa_new york city_the_benjamin,"The Benjamin is a smaller, Beaux Arts style boutique hotel in midtown with spacious, clean rooms, some with balconies. The hotel is known for its top-notch service, friendly staff, and a pillow menu."
usa_new york city_the_blakely_new_york,"The Blakely is a smaller, intimate boutique hotel with a cozy lobby that some reviewers described as having a European or English manor feel, with leather sofas and dark wood features, with attentive staff that provided personalized service. Some reviewers noted the hotel's quiet atmosphere, despite its central Midtown location."
usa_new york city_the_bowery_hotel,"The Bowery Hotel is described as having a boutique feeling with an elegant, old-world design, and a lobby that attracts a mix of locals, guests, and hipsters. Some reviewers noted the staff was friendly, helpful, and not snooty, contributing to a relaxed atmosphere."
usa_new york city_the_bryant_park,"The Bryant Park Hotel is a trendy and modern hotel with a small lobby, a gothic-style cellar bar, and a Japanese restaurant, Koi, and is known to be a fashion/celebrity hot spot. Some reviewers found the hotel luxurious, cosmopolitan, and charming, with friendly and accommodating staff."
usa_new york city_the_carlton,"The Carlton on Madison is a smaller, stylish hotel with a grand lobby and rooms featuring modern decor, comfortable beds, and luxurious bath products, located centrally with easy access to subway lines. While some found the staff distant, others experienced friendly and helpful service, concierge services, and surprise upgrades with amenities like wine."
usa_new york city_the_carlyle_a_rosewood_hotel,"The Carlyle is a traditional hotel known for personalized service, a classy atmosphere, and celebrity sightings, with staff described as respectful and unobtrusive. It offers white-gloved elevator operators and a discreet environment, though some find it dated and in need of refurbishment."
usa_new york city_the_franklin,"The Franklin Hotel is a small, boutique hotel on the Upper East Side with a European feel, offering complimentary breakfast and evening wine and cheese. The hotel has a friendly staff, old-world charm, and is located in a quiet, safe neighborhood near the subway, Central Park, and museums."
usa_new york city_the_french_quarters_guest_apartments,"The French Quarters Guest Apartments is a small, warm, and welcoming hotel with a New Orleans flavour, located in the heart of Manhattan on Restaurant Row. The staff is friendly and helpful, offering a personalized service."
usa_new york city_the_gem_hotel_chelsea,"The Gem Hotel Chelsea has a modern, boutique feel with clean, compact rooms and a location in the heart of Chelsea. The staff is friendly and the hotel incorporates local art."
usa_new york city_the_gem_hotel_midtown_west,"The Gem Hotel offers small, modern rooms with stylish, minimalist decor, catering to travelers seeking basic amenities without excessive extras. Some rooms include luxury touches like bathrobes and upgraded features like flat-screen TVs."
usa_new york city_the_gem_hotel_soho,"The Gem Soho is a small, clean, and well-maintained hotel with modern decor, located on the edge of the Lower East Side near multiple subway lines. Rooms feature amenities like free Wi-Fi, flat-screen TVs, and coffee percolators, with nearby access to local dining and attractions."
usa_new york city_the_grant_hotel,"The Grant Hotel is a budget-friendly option near the subway, with small, clean rooms, shared bathrooms, and basic amenities such as TV and air conditioning. Some rooms have been recently renovated and feature modern furnishings."
usa_new york city_the_hampton_inn_times_square_north,"The Hampton Inn offers a comfortable and clean stay with professional and friendly staff, free coffee, and rooms with white linens; the location is close to Broadway and a subway station. Though basic and not glitzy, some reviewers felt the hotel exceeded higher-end hotels in service, and some even compared the decor to more high-end options."
usa_new york city_the_helmsley_carlton_house,"The Helmsley Carlton House is located on the upper east side of Manhattan, one block from Central Park. Some rooms feature kitchenettes, sitting areas and balconies overlooking Central Park."
usa_new york city_the_helmsley_park_lane,"This hotel is in a prime location on Central Park South and has great views, with manageable size so it doesn't feel like Grand Central Station. The hotel decor is dated, with some rooms being recently renovated while others feature older furnishings."
usa_new york city_the_herald_square_hotel,"This hotel is a budget-friendly option in midtown Manhattan, with some renovated rooms featuring modern decor, comfortable beds, and amenities like flat-screen TVs. The hotel features a historic decor with art gallery on the walls that may be of interest to guests."
usa_new york city_the_hotel_91,"Hotel 91 is a clean, modern, minimalist hotel in the heart of Chinatown, offering comfortable beds and a 24/7 lounge with free tea and coffee. Rooms have flat-screen TVs and free high-speed ethernet, but lack certain amenities such as a fridge and may be small; some rooms face the Manhattan Bridge and experience train noise."
usa_new york city_the_hotel_at_times_square,"The Hotel at Times Square features a newly renovated, modern lobby with wooden walls and leather couches, as well as a small bar on the second floor. Rooms are decorated in green tones and include amenities such as flat-screen TVs and iPod docks."
usa_new york city_the_inn_at_irving_place,"The Inn at Irving Place is a hidden treasure with no signage, contributing to an exclusive feel, and is furnished with handsome antiques, offering a unique escape within the city. The Inn has a bar in the basement with an outdoor patio, and hosts events such as tea services and wedding receptions."
usa_new york city_the_iroquois,"The Iroquois is a smaller, boutique-style hotel with a sophisticated but not pretentious ambiance, offering personalized service and a cozy, intimate setting with amenities such as a library and elegant restaurant. The hotel has a warm and friendly staff."
usa_new york city_the_jane,"The Jane Hotel offers a unique, ""cabin-style"" accommodation with a vintage, ship-inspired aesthetic, including wood-paneled rooms and retro decor. It features a manually operated elevator, and a popular bar and ballroom, creating a lively atmosphere."
usa_new york city_the_kimberly_hotel,"The Kimberly Hotel is a smaller, boutique hotel with spacious suites, a full kitchen, and a location near Midtown attractions. The hotel is described as more traditional in style and offers access to a health club with a pool."
usa_new york city_the_lombardy,"The Lombardy is a small, quiet, boutique hotel with individually decorated, spacious rooms that are owned as co-ops, giving the feel of a high-end apartment. It is centrally located on 56th St, near restaurants, shops and the subway."
usa_new york city_the_london_nyc,"The London NYC offers spacious suites with modern decor and is located near Central Park and 5th Avenue. It has Gordon Ramsay restaurants and a lively bar, but lacks a luxurious private lobby."
usa_new york city_the_lucerne_hotel,"The Lucerne is described as a small, clean, and well-maintained hotel with a classy but not sleek or uber-modern feel and a warm, welcoming staff. It is located in a safe, relatively quiet Upper West Side neighborhood near Central Park and Lincoln Center."
usa_new york city_the_manhattan_club,"The Manhattan Club offers suites that are spacious for New York standards with amenities like kitchenettes and two bathrooms, and an owner's lounge on the 26th floor. Though some found the staff indifferent, others appreciated the location and well-kept rooms."
usa_new york city_the_mansfield,"The Mansfield Hotel is a small, stylish boutique hotel with a library-style bar, seating area with a fireplace, and a lobby offering free coffee and newspapers. It has a modern or European feel, a personable staff, and is favored for its central location near shops and transportation."
usa_new york city_the_marcel_at_gramercy,"The Marcel at Gramercy is a modern, stylish boutique hotel with funky decor and a rooftop terrace, but some rooms are small. The hotel's restaurant has a neighborhood feel and the Gramercy Park area is less touristy than other parts of Manhattan."
usa_new york city_the_maritime_hotel,"The Maritime Hotel is a hip, trendy, and unique boutique hotel known for its nautical theme, small but well-designed rooms, and a lively bar and restaurant scene that attracts a mix of glam and regular clientele. The hotel is located in a great area near Chelsea Market and the Meatpacking District."
usa_new york city_the_mark,"The Mark is located on the Upper East Side, close to museums, art galleries, Central Park, and upscale shopping. The hotel has been frequented by celebrities and is known for its excellent customer service."
usa_new york city_the_marmara_manhattan_luxury_hotel_residence,"The Marmara Manhattan is an extended stay hotel on the Upper East Side with spacious, apartment-style rooms featuring full kitchens and modern decor, offering a residential feel away from the tourist crowds. It is located in a quieter neighborhood near grocery stores and restaurants, though some reviewers mention subway construction and street noise."
usa_new york city_the_mave,"The hotel is described as a new, trendy, and stylish hotel with a vibrant feel and modern decor. The staff is attentive and provides a personal touch."
usa_new york city_the_mercer_hotel,"The Mercer is described as a chic, understated boutique hotel with a relaxed vibe, offering a comfortable lounge/lobby area exclusive to hotel guests. It is known for its friendly, helpful, and attentive staff, and attracts celebrities, providing a discreet and welcoming environment."
usa_new york city_the_michelangelo_hotel,"The Michelangelo Hotel is a smaller, luxury boutique hotel with spacious rooms, an Italian-style lobby featuring classical music, and an attentive staff. It provides a calm and serene atmosphere, and offers a free coffee service in the morning."
usa_new york city_the_milburn_hotel,"The Milburn is described as a smaller, quiet hotel with a renovated lobby, clean rooms, and friendly staff, located in a safe, residential Upper West Side neighborhood near Central Park and subway stations. It offers suites with kitchenettes and amenities like free internet, a gym, and access to a local swimming pool, providing a comfortable and convenient experience without being overly luxurious."
usa_new york city_the_muse_hotel_new_york_a_kimpton_hotel,"The Muse Hotel is a smaller, boutique hotel located a half block from Times Square, featuring modern rooms and a chic lobby. It aims for a creative and comfy atmosphere, with some reviewers noting that it felt like a home away from home."
usa_new york city_the_new_york_helmsley,"The hotel lobby has an old New York, swanky, and dimly lit feel. The staff is professional, warm, and friendly, and the bar had a wonderful bartender."
usa_new york city_the_new_yorker_hotel,"The New Yorker Hotel has Art Deco styling with a bustling lobby and a range of room sizes, some offering Empire State Building views. Some reviewers mentioned feeling safe due to security measures like key card checks at the elevators."
usa_new york city_the_pierre,"The Pierre is described as having an ""old-world charm"" with friendly staff, elevator operators, and architectural details like a functional mail chute and crown moldings. Some reviewers mention strict security and the doormen sometimes asking for reservations to maintain safety and exclusivity."
usa_new york city_the_plaza,"The Plaza is described as a luxurious and grand hotel with spacious rooms, butler service, and a central location near Central Park and 5th Avenue. Some reviewers noted exceptional service, while others mentioned issues with slow service and dress code concerns, suggesting a mixed experience in terms of exclusivity and pretentiousness."
usa_new york city_the_pod_hotel,"The Pod Hotel has a funky, modern decor and attracts a younger, hip crowd, but is also suitable for older travelers; it features a rooftop terrace for socializing and is conveniently located near many restaurants and attractions. The hotel offers clean and comfortable rooms, although they are small, with amenities such as iPod docks and free Wi-Fi."
usa_new york city_the_premier,"The Premier is described as a boutique hotel within the Millenium Broadway, offering a more upscale experience with concierge service, complimentary breakfast and evening reception. Some reviewers noted it felt exclusive due to its smaller size and quieter atmosphere, despite being in Times Square."
usa_new york city_the_ritz_carlton_new_york_central_park,"The Ritz Carlton Central Park has a smaller, more intimate lobby which gives the hotel a personal feel, setting it apart from other five-star hotels. The hotel also has friendly and helpful staff that aim to provide a warm and family-like atmosphere."
usa_new york city_the_roosevelt_hotel,"The Roosevelt Hotel has a grand lobby and offers a rooftop bar, with bartenders that are attentive. The hotel is described as elegant, grand, and classy."
usa_new york city_the_sherry_netherland_hotel,"The Sherry-Netherland is a small, intimate hotel with individually owned and decorated rooms, giving the feel of a luxury apartment. Known for its discreet atmosphere, it offers personalized service, and is located across from Central Park."
usa_new york city_the_shoreham,"The Shoreham is a modern, trendy boutique hotel with a hip atmosphere, featuring a stylish lobby and a bar that is popular with locals. The hotel offers a complimentary espresso bar, and is located close to luxury shopping on Fifth Avenue."
usa_new york city_the_st_regis_hotel_new_york,"The St. Regis has a hushed elegance, an intimate, small lobby that discourages tourists, and butler service, which some find personal and some find tiring. Staff are known for easy friendliness."
usa_new york city_the_standard_new_york,"The Standard Hotel in NYC has a cool, trendy vibe and innovative decor, but is not pretentious, according to reviews. The hotel has a reputation for attentive service and a friendly atmosphere, with a stylish and helpful staff."
usa_new york city_the_surrey,"The Surrey is described as elegant, classy, and modern hip with an unpretentious atmosphere and an intimate feel. The hotel is located in a quiet, safe neighborhood on the Upper East Side near Central Park, with doormen that are generally friendly without being obtrusive."
usa_new york city_the_sylvan_guest_house,"The Sylvan Guest House consists of a few rooms spread throughout a terrace owned by private owners. The rooms are located in a historical townhouse in Harlem, with uniquely designed interiors featuring African art."
usa_new york city_the_time,"The Time is a small, modern, and trendy boutique hotel with a location right off Times Square, near the theater district. Some rooms have a red, blue, or yellow color scheme, and some offer good amenities and comfortable beds."
usa_new york city_the_waldorf_astoria,"The Waldorf Astoria is described as a grand, historic hotel with opulent public areas and a mix of clientele, from business associates to families. Some reviewers note the hotel's service and elegance, while others mention the high prices and potential for crowds."
usa_new york city_the_westin_new_york_at_times_square,"The Westin New York Times Square is described as a clean, modern, and centrally located hotel with a sophisticated ambiance and a mature clientele. Some reviewers appreciated the high-floor rooms with city and river views, noting the quiet atmosphere despite the hotel's location near Times Square."
usa_new york city_thirty_thirty_hotel,"The Thirty Thirty Hotel has a trendy lobby and a bar/restaurant, but its reception staff can be businesslike. Some reviewers found upgraded rooms modern and stylish, while standard rooms are small."
usa_new york city_thompson_les,"The Thompson LES is a trendy and stylish hotel in the Lower East Side, with a rooftop bar that can be exclusive. Some reviewers mentioned meeting celebrities, and some found the staff to be friendly and welcoming."
usa_new york city_travel_inn_hotel_new_york,"This hotel is a clean, basic hotel with a pool and free parking. It is within walking distance of Times Square, and centrally located for transportation."
usa_new york city_tribeca_grand_hotel,"The Tribeca Grand is a trendy, modern hotel with a lively bar scene, but the noise can be an issue on lower floors; the staff are generally friendly and the location is convenient for exploring downtown neighborhoods. Some reviewers found the hotel pretentious and experienced poor service, while others praised the helpful staff and stylish atmosphere."
usa_new york city_trump_international_hotel_and_tower,"The Trump International Hotel is described as discreet and offering a residential feel, with a small, intimate lobby that contributes to a sense of privacy and security, and many reviewers mention the staff being professional, friendly and attentive. The hotel is located at Columbus Circle, near Central Park, and contains a fitness center, pool and spa."
usa_new york city_tudor_hotel_at_the_united_nations,"The Tudor Hotel is described as charming, cozy, and historic, with a quiet location near the UN and Grand Central Station. The hotel's architecture is noted, but some find the lobby and common areas plain and not luxurious."
usa_new york city_vincci_avalon,"The Vincci Avalon, located in midtown Manhattan, offers spacious suites with marble bathrooms and optional upgrades to executive suites, some with jacuzzi tubs. Though not luxurious, it has a strong European character and is favored for its large rooms and proximity to attractions like the Empire State Building."
usa_new york city_w_new_york_the_court,"The W The Court is a smaller, stylish boutique hotel with a trendy bar and attentive staff, but some found the dark, worn interiors and small rooms underwhelming for the price. Its location in the Murray Hill neighborhood offers a quieter, more residential feel while still being close to major attractions and transportation."
usa_new york city_w_new_york_the_tuscany,"The W Tuscany is a smaller, boutique-style hotel with a chic and modern decor, located on a quiet street near Grand Central Station. Guests describe it as offering personalized service and a relaxed atmosphere."
usa_new york city_w_new_york_times_square,"This trendy hotel in Times Square features a sleek lobby with a popular bar, modern minimalist decor, and attentive staff, but some found the dark hallways and the party atmosphere off-putting. Some suites offer views, comfortable beds, and iPod docking stations, but may come with extra costs and potential noise."
usa_new york city_w_new_york_union_square,"The W Union Square features a trendy bar/lounge that attracts a hip crowd and often hosts after-work gatherings for local professionals. Some reviewers note the hotel's style is a mix of modern and historic with good service, although the lobby can get crowded."
usa_new york city_waldorf_towers,"The Waldorf Towers offer a private entrance and a separate check-in desk from the main Waldorf Astoria, with spacious suites, some featuring kitchenettes and multiple rooms, and an exclusive lounge on the 26th floor. Some reviewers mention feeling like royalty and receiving VIP treatment."
usa_new york city_wall_street_inn,"The Wall Street Inn is a small, quaint, boutique-type hotel located on a quiet street in the financial district, with a charming mix of colonial and turn-of-the-(20th)century era design. It is known for being quiet, especially on weekends."
usa_new york city_warwick_new_york_hotel,"The Warwick is a historic, classy hotel with many rooms recently updated, and offers multiple suite options. It is centrally located in midtown Manhattan and near many attractions."
usa_new york city_washington_jefferson_hotel,"The Washington Jefferson Hotel is described as a boutique hotel with a marble lobby that is clean and nicely decorated. While the rooms are small, the staff is friendly, courteous, and accommodating."
usa_new york city_washington_square_hotel,"Washington Square Hotel is a small boutique hotel with art deco decor and a jazz vibe, located in Greenwich Village next to Washington Square Park. The hotel offers deluxe rooms with comfortable beds and good amenities, and is within walking distance of restaurants and shops."
usa_new york city_wellington_hotel,"The Wellington Hotel is an older, value-priced option with a vintage feel and a desirable location near Central Park and Times Square; Suites are available, although some rooms are small and in need of renovation. Reviews mention flat-screen TVs, Greek and American restaurants, nearby shopping, and subway access."
usa_new york city_west_57th_street_by_hilton_club,"The hotel is part of the Hilton Grand Vacation Club portfolio, offering an owner's lounge with continental breakfast and evening hors d'oeuvres; some reviewers mention feeling like a ""renter"" while others have access to exclusive spaces and amenities. The hotel is modern and contemporary, with technological enhancements in the rooms."
usa_new york city_wingate_by_wyndham_manhattan_midtown,"The Wingate is a smaller, recently renovated, and modern hotel with a location that is elegant yet unpretentious. It is described as a business hotel."
usa_new york city_wolcott_hotel,"The Wolcott Hotel is a centrally located, historic budget hotel with a grand lobby and spacious rooms. It is known for its proximity to attractions like the Empire State Building and Macy's, with amenities including free coffee and muffins, though some rooms may have limited views or be affected by noise."
