Hotel,Summary
usa_new york city_hilton_club_new_york,"The Hilton Club is a hotel-within-a-hotel, consisting of suites on the 37th and 38th floors with a private check-in desk, offering small hotel personal service in a large hotel. Some rooms have features such as rainfall shower heads, side jets, and Aveda amenities."
usa_new york city_hilton_garden_inn_chelsea,"This boutique-style hotel has about six rooms per floor, giving it a more intimate atmosphere; it is modern, clean, and well-maintained. The lobby is small but features a tranquil water feature."
usa_new york city_hilton_garden_inn_new_york_west_35th,"This Hilton Garden Inn is a newer, smaller hotel centrally located in Midtown Manhattan near the Empire State Building and Macy's, with clean, modern rooms. It is not a 5-star hotel but offers a functional, comfortable stay with amenities like free Wi-Fi and a business center."
usa_new york city_hilton_garden_inn_times_square,"The Hilton Garden Inn Times Square, while not overly fancy, is a clean, modern, and well-maintained hotel with a small, intimate feel, and is described by some as a ""boutique hotel for the rest of us"". Although the lobby is small, guests must show their key to access elevators at night, adding a sense of security."
usa_new york city_hilton_garden_inn_tribeca,"The Hilton Garden Inn Tribeca is a relatively new hotel in a location that is described as a nice, quiet neighborhood, away from the tourist spots, but still close to many bustling areas. The hotel has a small lobby and limited services, but offers comfortable rooms with amenities like free Wi-Fi and a business center."
usa_new york city_hilton_new_york,"This is a large, busy hotel with almost 2000 rooms and a lobby that can feel like an airport terminal, but there is a key-only access to the top floors and the bar has a good atmosphere and quick waiter service. The rooms have been updated, are clean and comfortable, and some rooms have a good view of Central Park."
usa_new york city_hilton_times_square,"Located in the heart of Times Square, the Hilton offers clean, spacious, and quiet rooms on higher floors, starting from the 21st floor, providing great views and a boutique hotel feel due to its smaller size compared to other brand-name hotels. The hotel features an intimate bar and a restaurant."
usa_new york city_holiday_inn_express_new_york_city_fifth_ave,"The Holiday Inn Express Fifth Avenue is a small, modern hotel with clean rooms that have premium touches such as in-room coffee makers with green tea, heavy wooden hangers, and comfortable beds with soft linens. The hotel offers premium toiletries, free computers, internet, and wifi."
usa_new york city_holiday_inn_express_new_york_city_times_square,"The Holiday Inn Express Times Square South is a new, tall, narrow hotel with 4 rooms per floor, located a few blocks from Times Square. It offers clean, compact rooms, free breakfast and internet, and is situated near other affiliated hotels."
usa_new york city_holiday_inn_express_nyc_madison_square_garden,"The hotel is clean, modern, and has a courteous staff, with some reviewers comparing it to a 5-star hotel. Though not luxurious, it is a well-equipped and comfortable hotel that provides good basic accommodations."
usa_new york city_holiday_inn_manhattan_downtown_soho,"The Holiday Inn is located in Chinatown, near Little Italy and Soho, with a subway station close by. Some reviewers mentioned club floor access, and large corner rooms."
usa_new york city_holiday_inn_midtown_57th_st,"The Holiday Inn Midtown offers a rooftop pool with city views and a gym, and is described as clean, quiet, and comfortable, with larger than average rooms for New York City. The hotel has friendly and helpful staff and is close to Central Park, with a regional manager visiting to address renovations."
usa_new york city_holiday_inn_nyc_manhattan_6th_avenue,"The hotel is new and modern with upscale features, but has small rooms and limited amenities. The hotel is in a central location, but away from tourist crowds, close to Chelsea and the Garment District."
usa_new york city_hotel_17,"Hotel 17 is a clean, European-style hotel with a dark wood trim, antique mirrors, and an old elevator, located in a quiet, residential neighborhood near Gramercy Park. Rooms are small and decorated in a sometimes quirky way."
usa_new york city_hotel_31,"Hotel 31 is a budget-friendly option in Manhattan, with small, clean rooms and shared bathrooms, located near the Empire State Building and subway. The hotel has an old-fashioned elevator and dated decor."
usa_new york city_hotel_373,"Hotel 373 is a small, modern, and clean boutique hotel with a Starbucks in the lobby and friendly staff. It is located on 5th Avenue, close to the Empire State Building, and offers amenities like free Wi-Fi and iPod docks."
usa_new york city_hotel_41_at_times_square,"Hotel 41 is a small, trendy, and cozy boutique hotel with modern decor, located steps from Times Square; the bar is popular, and the staff is friendly and attentive. The hotel offers complimentary Aveda bath products and free DVD rentals."
usa_new york city_hotel_99,Hotel 99 has modern-style rooms equipped with LCD TVs. Some rooms feature intricate stonework in the bathrooms.
usa_new york city_hotel_beacon,"The Beacon Hotel offers spacious rooms and suites with kitchenettes, located in the Upper West Side, near Central Park and a subway stop. It is described as having a boutique flavor, being clean, and appealing to those who want to experience real NYC life away from tourist crowds."
usa_new york city_hotel_chandler,"This hotel is a smaller boutique hotel with a modern, updated decor, that's located in Midtown Manhattan close to the Empire State Building, and several subway stations, and offers amenities such as Frette linens, Aveda bath products, and comfortable robes. The staff is attentive and helpful, without being over-eager, and there is a bar."
usa_new york city_hotel_deauville,"The Hotel Deauville has an ""Old World"" feel, reminiscent of small, inexpensive hotels in London or Paris. It features eclectic rooms, some with purple bathrooms, and a manual elevator operated by staff."
usa_new york city_hotel_east_houston,"The East Houston Hotel is described as a small, chic, and modern boutique hotel with a rooftop lounge offering city views. The hotel's decor features a minimalist Asian style with dark wood and cherry wood floors."
usa_new york city_hotel_elysee,"Hotel Elysee is a small, elegant, European-style boutique hotel with spacious rooms, free breakfast and afternoon wine/cheese, and a Monkey Bar, located in a quiet midtown location near 5th Avenue. It offers a personalized experience with a friendly staff and a comfortable, intimate atmosphere."
usa_new york city_hotel_gansevoort,"Hotel Gansevoort is in a trendy neighborhood with a rooftop bar and pool, access is regulated by door staff checking room keys to avoid lines. Some reviewers note feeling like they get VIP treatment as hotel guests."
usa_new york city_hotel_giraffe,"Hotel Giraffe is a smaller, European-style boutique hotel that is described as a haven of calm within the bustling city, with a focus on friendly service and a less frenzied atmosphere than larger hotels. It offers amenities like a lobby lounge, continental breakfast, and evening wine and cheese, aiming for a relaxed and welcoming environment."
usa_new york city_hotel_grand_union,"This budget-friendly hotel is known for its excellent location near attractions like the Empire State Building and subway lines. While basic, it offers clean rooms and a helpful staff."
usa_new york city_hotel_indigo_new_york_city_chelsea,"Hotel Indigo NYC features a modern minimalist design with spacious rooms relative to other NYC hotels, equipped with king-sized beds, large flat-screen TVs, and Aveda toiletries. The hotel also has a restaurant and bar, but lacks certain amenities like a coffee maker in the room and luggage racks."
usa_new york city_hotel_mela,"Hotel Mela is a small, modern boutique hotel with clean and stylish rooms, located just off Times Square. Many reviewers mention a friendly and helpful staff that provides excellent service."
usa_new york city_hotel_metro,"The Hotel Metro has an Art Deco style, a rooftop bar with Empire State Building views, and a lobby with a lounge that provides free tea and coffee. There is a gym and some suites available, but the rooms are generally small."
usa_new york city_hotel_newton,"Hotel Newton is a clean and well-maintained hotel with remodelled rooms, a helpful staff, and is located near the subway. Some reviewers compared the hotel to non-chain European hotels, and felt it provided good value without fancy lobbies or window dressings."
usa_new york city_hotel_on_rivington,"The Hotel on Rivington is a trendy, modern hotel with sleek design, offering comfortable and quiet bedrooms on the upper floors with killer views and a sexy vibe. Hotel guests get priority access past the velvet rope at the often crowded first-floor bar/restaurant, which may appeal to those seeking an exclusive experience."
usa_new york city_hotel_reserve,"Hotel Reserve is a small, modern hotel in the Financial District with a friendly staff. The hotel is newly opened and has a small lobby, but the rooms are clean and well-appointed, with comfortable beds and LCD TVs."
usa_new york city_hotel_st_james,"The St. James Hotel is centrally located near Times Square, has a concierge, and offers excursion planning. Some rooms are renovated, and staff are generally friendly and helpful."
usa_new york city_hotel_stanford,"The Stanford Hotel is described as a budget-friendly option with a convenient midtown location, close to attractions like the Empire State Building and Macy's, with some rooms recently renovated. The hotel is noted for its cleanliness and friendly staff, though it lacks luxury amenities and can have small rooms with limited views."
usa_new york city_hotel_wales,"Hotel Wales is a smaller, European-style hotel with dark wood accents, located in the Upper East Side, near Central Park and museums. Some suites feature sitting rooms with original woodwork and distant park views, and guests have access to a common room with complimentary breakfast and computers."
usa_new york city_hudson_hotel,"The Hudson Hotel is a trendy, modern hotel with a library bar, popular bars, and a rooftop terrace that offers great views. Note that hotel privilege cards are required to access some bars, and there may be dress codes."
usa_new york city_ink48_a_kimpton_hotel,"Ink48 is a new, modern, and stylish boutique hotel with spacious rooms, great city and river views, and well-appointed bathrooms. The staff is friendly, helpful, and attentive, offering a high level of service, and the hotel is located a short walk from Times Square in Hell's Kitchen."
usa_new york city_inn_new_york_city,"The Inn New York City is a small, four-suite inn located in a quiet residential neighborhood on the Upper West Side. It is described as feeling like a private home, with personalized service from the owners, and lacking the hustle and bustle of larger hotels."
usa_new york city_intercontinental_the_barclay_new_york,"This hotel has a grand lobby and traditionally furnished rooms, giving it an old-fashioned ambience and style; some reviewers mentioned that the staff are professional but not overly friendly. The location is good, within walking distance of mid-town attractions but a little distanced from the heaviest tourist traffic."
usa_new york city_jumeirah_essex_house,"The Jumeirah Essex House is described as luxurious but not over the top, with an art deco ambiance, and a smaller boutique hotel feel despite its size. It is located across from Central Park, convenient to many attractions, and offers amenities such as a lively bar and comfortable rooms."
usa_new york city_kitano_new_york,"The Kitano is a smaller, quiet hotel with a Japanese theme, a serene atmosphere, and a professional staff, located in a quiet, upscale neighborhood near Grand Central. Some reviewers found the hotel a bit stiff or dated, but appreciated the cleanliness, soundproof rooms, and extras like green tea, bathrobes, and umbrellas."
usa_new york city_la_quinta_manhattan,"This hotel has a rooftop bar with views of the Empire State Building, but the bar can get crowded. Some reviewers describe the lobby as lovely, while others say it is small, unattractive, and the hotel is old and grungy."
usa_new york city_lafayette_house,"Lafayette House is a 15-room townhouse-style hotel with individually furnished rooms featuring antiques, sitting areas with fireplaces, and some with kitchenettes. It offers a low-key, local NYC experience with locked doors and office hours, located in the East Village near various restaurants and amenities."
usa_new york city_le_parker_meridien,"Le Parker Meridien has a modern design with a happening lobby scene, featuring a gourmet coffee bar and a popular, inexpensive burger joint; the rooftop has a pool and sun deck with Central Park views. Some reviewers noted the staff wasn't always friendly, and the rooms aren't luxurious, but the hotel is well-located near Central Park and shopping."
usa_new york city_library_hotel,"The Library Hotel is a literary-themed, 60-room boutique hotel offering elegant decor, gracious service, and a rooftop bar; it has free wine and cheese, and pastries. Reviewers describe this hotel as a cozy boutique with a charming, intimate atmosphere."
usa_new york city_loews_regency_hotel,"The Loews Regency is a smaller, classic hotel with an intimate feel, located in a quiet, upscale neighborhood near Central Park and Madison Avenue. Some reviewers note the breakfast room is frequented by local power-brokers, and celebrity sightings are common, adding to the exclusive feel."
usa_new york city_lowell_hotel,"The Lowell is a small, intimate hotel on the Upper East Side that is described as charming and elegant. It offers spacious suites with kitchenettes and luxurious bathrooms and is located in a residential neighborhood away from tourist crowds."
usa_new york city_mandarin_oriental_new_york,"The Mandarin Oriental in New York is described as luxurious, modern, and clean, with a minimalist but warm decor, and located in a tower above Columbus Circle. The hotel is reported to have an exceptional staff, and the bar and lounge area is reserved for hotel guests only."
usa_new york city_milford_plaza_hotel,"The Milford Plaza is near Broadway shows and Times Square, has tight security, and offers Milford Club rooms with breakfast and lounge access. The hotel is older, so some rooms can be small and require upgrades."
usa_new york city_millenium_hilton,"The Millenium Hilton has a modern and sleek style, provides clean and comfortable rooms with larger-than-average space for NYC, and is geared toward the business traveler with polite and discrete service. Some reviewers found the hotel sterile and lacking a ""wow"" factor, but many enjoyed the quiet atmosphere away from midtown crowds."
usa_new york city_millennium_hotel_broadway,"The Millennium Broadway is located right off Times Square and near subway stations, with renovated, spacious rooms offering views of the Chrysler Building and Times Square. Concierge services are available, with bellhops offering taxi service."
usa_new york city_millennium_un_plaza_hotel,"This hotel offers large rooms with amazing city views from the upper floors, as well as a pool and fitness center, all in a quiet residential-like area near the UN, within walking distance of Grand Central. Some reviewers noted the hotel can feel stuffy and is showing wear, while others mention the friendly and helpful staff."
usa_new york city_moderne_hotel,"The Moderne is a small, 37-room boutique hotel with a retro style, located close to Central Park and Times Square. Some rooms are described as spacious suites with living room areas, flat screen TVs, and large bathrooms, while others are small with limited natural light."
usa_new york city_morgans_hotel,"Morgans Hotel is a boutique hotel with a modern black and white theme, offering a stylish and comfortable experience, with rooms providing views of the Empire State Building. The hotel features a ""Living Room"" on the 4th floor with complimentary tea and coffee, aiming for a relaxed atmosphere."
usa_new york city_murray_hill_east_suites,"The Murray Hill East Suites is described as a former apartment building, now offering large rooms with kitchens, and is located in a quiet, safe neighborhood near Grand Central Station. Reviews suggest a homey, comfortable atmosphere rather than a posh or elegant one, with friendly, helpful staff."
usa_new york city_murray_hill_inn,"The Murray Hill Inn is a smaller, European-style hotel with recently updated rooms and bathrooms, and a friendly staff. It is located in a quiet, safe neighborhood, within walking distance of major attractions, and is close to restaurants and cafes."
usa_new york city_new_york_marriott_downtown,"The hotel has a lobby with stained glass and often offers chocolate fondue, with a bar that has a cool vibe and expensive cocktails but attracts mostly tourists. Some guests describe the service as professional and friendly, and several mention the hotel is clean and well-maintained."
usa_new york city_new_york_marriott_east_side,"The Marriott East Side is described as an older, historic hotel with an elegant lobby, smallish rooms, and a great location in midtown Manhattan. Some reviewers note the hotel's proximity to other luxury hotels like the Waldorf Astoria and Intercontinental."
usa_new york city_new_york_marriott_marquis,"The Marriott Marquis has spacious rooms, and is in the middle of Time Square making it convenient for Broadway shows, but can be crowded and noisy. Reviews note the hotel is very large and modern but also impersonal."
usa_new york city_new_york_palace_hotel,"The New York Palace has a beautiful lobby and courtyard and is known for its excellent service with courteous, helpful, and friendly staff. The hotel has a relaxed and unpretentious atmosphere, attracting a mix of business people and tourists."
usa_new york city_night_hotel,"The Night Hotel is a small, trendy, and stylish boutique hotel with a noir-lounge aesthetic, a dark, intimate atmosphere, and a great location near Times Square. Some reviewers mentioned a feeling of exclusivity and that the hotel is geared towards a younger, hipper crowd, but that the staff is welcoming and helpful to guests of all ages."
usa_new york city_novotel_new_york_times_square,"The hotel has a nice lobby/bar area and many European guests, giving it a European atmosphere. Rooms are described as clean and spacious and many have excellent views of Times Square."
usa_new york city_off_soho_suites,"Off Soho Suites offers apartment-like suites with kitchenettes and multiple rooms, located within walking distance of several neighborhoods, and subway lines. Rooms are clean but basic with limited amenities and maid service, and the surrounding area has an industrial feel."
usa_new york city_omni_berkshire_place,"The Omni Berkshire Place is described as having a boutique feel with a wonderful location, with a friendly and helpful staff. It's described as stylish, elegant, and comfortable, but not overcrowded like larger hotels."
usa_new york city_on_the_ave_hotel,"On the Ave is a modern, stylish boutique hotel with a ""very urban boutique feel"" offering promotions and accommodating staff. The hotel is clean, and is located in the Upper West Side, near Central Park, with friendly & helpful staff, and panoramic views from deluxe rooms, though standard rooms are small."
usa_new york city_park_79_hotel,"Park 79 is a small, older building with hardwood floors, offering free coffee in the morning and complimentary internet; some rooms have small bathrooms and thin walls. The hotel is located in the Upper West Side, near Central Park and museums, with easy access to subway lines."
usa_new york city_park_central,"The Park Central Hotel is described as a large, older-style hotel with a trendy lobby and a bar, offering a concierge level with views; several reviewers noted feeling the hotel had a good ""vibe"". However, it's not portrayed as luxurious, with some rooms outdated and lacking amenities, and some reports of staff being rude or unhelpful."
usa_new york city_park_south_hotel,"The Park South is a smaller boutique hotel with a great atmosphere, nice lobby, and a bar/bistro offering jazz on weekends. It's located in a quiet area with an international vibe, offering a simple and apartment-like feel."
usa_new york city_peninsula_new_york,"The Peninsula New York is described as an elegant, old-school hotel that is opulent without being garish, and renovated with quietly sexy rooms, creating a place for grown-ups. The hotel has a small and intimate lobby that feels more like a private club than a hotel."
usa_new york city_phillips_club,"The Phillips Club offers studio, one, and two-bedroom suites with kitchens and modern amenities, appealing to both short-term and long-term guests including performers and those between homes. The hotel is connected to Balducci's gourmet market and is near Lincoln Center, with easy access to public transportation."
usa_new york city_plaza_athenee_hotel,"The Plaza Athenee is an intimate, European-style boutique hotel with a residential feel, located on a quiet, tree-lined street on the Upper East Side, near Central Park and Madison Avenue. Some reviewers describe it as luxurious without being pretentious, with attentive staff and a cozy bar, though some found the rooms and bathrooms small and dated."
usa_new york city_radisson_martinique_on_broadway,"This hotel is a renovated, older property with small rooms, a small fitness center, and an executive lounge; the business center has computers with free internet. The lobby is small and often crowded with flight crews."
usa_new york city_ramada_eastside,"The Ramada Eastside is a clean, recently remodeled hotel located in the Murray Hill neighborhood, close to the subway, Empire State Building, and various restaurants; it offers complimentary breakfast and internet. Some rooms are small and can be noisy, but overall it is considered a great value for the price in NYC."
usa_new york city_red_roof_inn_manhattan,"The Red Roof Inn in Manhattan has smaller, but clean rooms with modern decor, and some rooms offer views of the Empire State Building; concierge services and luggage storage are available. The hotel features a small lobby bar, but some found the breakfast room cramped and PC access expensive."
usa_new york city_renaissance_new_york_hotel_57,"Hotel 57 is a chic boutique hotel with a modern and sleek decor, and has a new lounge for hotel guests. The hotel has a small, intimate feel with friendly service, and some reviewers described it as a ""hidden gem."""
usa_new york city_renaissance_new_york_hotel_times_square,"The Renaissance New York Hotel Times Square is described as an intimate, understated ""boutique"" hotel, smaller and more private than surrounding hotels; it has a small lobby and a modern/futuristic but classy decor. The hotel has reserved New Years Eve seating and a reserved section inside to view the Ball drop."
usa_new york city_residence_inn_by_marriott_times_square_new_york,"The Residence Inn Times Square offers a quieter, central Manhattan location near Bryant Park, with rooms featuring kitchenettes and free breakfast, but note the small lobby and occasional elevator delays. While not particularly luxurious, the hotel provides comfortable and spacious rooms with attentive service."
usa_new york city_ritz_carlton_battery_park,"The Ritz-Carlton Battery Park offers a luxurious and modern experience with spacious rooms, high-end amenities, and harbor views; it's located in a quiet area away from the midtown crowds, with multiple reviewers praising the attentive, personalized service. The hotel is frequented by business travelers, and is close to downtown attractions, but requires taxi or subway rides to midtown."
usa_new york city_rockefeller_center_hotel,"The Rockefeller Center Hotel is a modern, clean hotel with a boutique feel, offering a Terrace Club on the 7th floor with a spacious sitting area and restaurant. The hotel has a discreet entrance and offers amenities such as free internet access and filtered water."
usa_new york city_roger_smith_hotel,"The Roger Smith Hotel is a midtown Manhattan boutique hotel known for its unique, individually decorated rooms with a homey feel, original art, and a friendly staff. It offers spacious rooms and suites, a restaurant, and a bar, Lily's, which is popular with locals."
usa_new york city_roger_williams_hotel,"The Roger Williams is a trendy boutique hotel with a stylish lobby, bar, and modern, colorful rooms; reviewers consistently praise the friendly and helpful staff. It is centrally located in Midtown, close to attractions like the Empire State Building, and offers a fitness center and free WiFi."
usa_new york city_room_mate_grace,"This boutique hotel has a stylish ambiance, draws a hip clientele, and has a trendy lobby with a pool that turns into a party scene at night. Some found it classy and relaxing, while others found it loud and populated by younger people."
usa_new york city_royalton_hotel_new_york_city,"The Royalton is described as a hip, trendy, and stylish boutique hotel with a moody, dark, and elegant feel, aiming to create an exclusive club atmosphere rather than a standard hotel. Reviews highlight the attentive service, well-designed rooms, and a popular lobby bar, though some note the dim lighting and high prices."
