Hotel,Summary
usa_new york city_3_west_club,"The 3 West Club is noted for its excellent location near Rockefeller Center and St. Patrick's Cathedral, offering clean, decent rooms with flat-panel TVs and digital cable. It may not be suitable for those seeking luxury amenities like room service."
usa_new york city_414_hotel,"Hotel 414 is a small hotel near Times Square and Restaurant Row, convenient to Penn Station and the subway. It offers amenities such as free WiFi, a computer for guests, and a basic continental breakfast."
usa_new york city_60_thompson,"60 Thompson offers free wireless internet, but some rooms lack a desk, except for suites. There is no business center; a small computer is available at the front desk."
usa_new york city_6_columbus,"6 Columbus is conveniently located near the subway and Time Warner Center. Some rooms have desks, but some business travelers have complained about the lack of space."
usa_new york city_70_park_avenue_hotel_a_kimpton_hotel,"This hotel is conveniently located near Grand Central Station and provides comfortable rooms with a desk, flat-screen TV, and iPod docking station. They offer free wifi, newspapers, and computers in the lobby, as well as business-related services such as printing boarding passes."
usa_new york city_ace_hotel_nyc,"The Ace Hotel provides free Wi-Fi, and is near Penn Station, a subway stop, and bus routes. Some rooms include a work desk and a radio with a laptop plugin."
usa_new york city_affinia_50,"The Affinia 50 offers business travelers office space in the rooms, ergonomic chairs, laptop connections, and spacious rooms. Free Internet access to airlines' websites and boarding pass printing is available, but wireless internet access is an extra charge."
usa_new york city_affinia_dumont,"The Affinia Dumont offers spacious rooms with a large desk and ergonomic chair and is located close to the subway, Grand Central Station, and Penn Station. It is also equipped with a gym, and reviewers report the staff are friendly and helpful."
usa_new york city_affinia_gardens,"The Affinia Gardens offers spacious rooms with kitchens, a quiet atmosphere, and a location convenient to major amenities. A desk is available in each room, and high-speed internet can be purchased."
usa_new york city_affinia_manhattan,"The hotel has a dedicated info area for business travelers during core hours, and some rooms offer an office nook. It has a business center with internet access in the lobby, but there's a fee to use it."
usa_new york city_affinia_shelburne,"The Affinia Shelburne is conveniently located near corporate Midtown and Grand Central Station, although not directly on subway lines, and offers spacious rooms with a kitchenette suitable for longer stays. It also provides internet access for a fee."
usa_new york city_aka_united_nations,"AKA United Nations offers spacious, modern apartments with full kitchens, separate lounge areas, and complimentary broadband internet access, and is conveniently located near the UN Headquarters and Grand Central Terminus. The hotel provides services like a light breakfast on weekdays, a 24-hour gym, and is close to a corner store and supermarket."
usa_new york city_algonquin_hotel,"The Algonquin Hotel is well-located, near Grand Central Station, has wireless internet, and a business center, though the business center has only one computer and one printer that's poorly maintained. Some found the staff friendly and helpful, and some rooms have a desk."
usa_new york city_americana_inn,"This budget-friendly inn is in Midtown Manhattan, within walking distance to Times Square, the Empire State Building, and transportation, and offers amenities such as internet access and a safe deposit box. Rooms are small and basic with shared bathrooms that are generally clean, and street-facing rooms may experience noise."
usa_new york city_amsterdam_court_hotel,"Amsterdam Court Hotel is centrally located near Times Square and subway lines, but rooms are small and may have limited amenities; note that WiFi is available for an additional fee. Some rooms may have limited natural light or street noise."
usa_new york city_astor_on_the_park,"The Astor on the Park is a budget-friendly hotel near the subway and Central Park, with small, clean rooms and friendly staff. Some guests have noted issues with noise, heating, and limited amenities."
usa_new york city_bedford_hotel,"The Hotel Bedford is located near Grand Central Station, providing easy access to transportation, and offers rooms with amenities such as free WiFi, kitchenettes, ironing boards, and trouser presses. Some rooms have a separate living room, workspace and digital safes."
usa_new york city_beekman_tower_hotel,"The Beekman Tower offers spacious suites with full kitchens, and a business center, but in-room internet access costs extra. It is located in midtown near the UN."
usa_new york city_belleclaire_hotel,"The Belleclaire Hotel on the Upper West Side has modern rooms with desks, flat-screen TVs, iPod docks, and free Wi-Fi, and is near subway lines making it convenient to reach other business locations. The Manhattan Diner across the street is available for room service."
usa_new york city_bentley_hotel,"The Bentley Hotel offers great value and spacious rooms, but it's a bit out of the way, about a 5-block walk to the subway; also, there is no business center and internet access costs extra. Some reviewers noted that it's conveniently located near the Animal Medical Center, making it suitable for those visiting."
usa_new york city_best_western_bowery_hanbee_hotel,"This hotel has free WiFi, a business center with 2 computers and a printer, and rooms with a desk and safe large enough for a laptop. It's located near the Financial District and has easy access to subways."
usa_new york city_best_western_convention_center_hotel,"This hotel is conveniently located near the Javits Convention Center. It offers free WiFi, a business center, and is close to public transportation."
usa_new york city_best_western_hospitality_house,"The hotel offers free internet in the lounge and workstations, and rooms feature a desk, dining table, and full-sized kitchen which may be useful for business travelers. It's centrally located near the UN, Grand Central Station, and the subway."
usa_new york city_best_western_seaport_inn_downtown,"The Seaport Inn is located near the Financial District and offers free wireless internet, making it convenient for business travelers. Some rooms have a desk area, and the hotel is quiet, which is suitable for those needing a calm environment."
usa_new york city_blue_moon_hotel,"The Blue Moon Hotel offers amenities such as free in-room WiFi, and some rooms have a desk and comfortable seating; the hotel is located near subway lines for convenient access around the city. Some reviewers mentioned the hotel is quiet, and rooms have climate control."
usa_new york city_broadway_plaza_hotel,Broadway Plaza Hotel is a clean and well-maintained hotel that offers amenities such as free Wi-Fi and a business center. It is conveniently located near public transportation.
usa_new york city_buckingham_hotel,"The Buckingham Hotel offers apartment-style rooms with a kitchen, desk, and CD player. There is free Wi-Fi in the lounge and an extra charge for in-room internet access."
usa_new york city_candlewood_suites_new_york_city_times_square,"Candlewood Suites Times Square provides free in-room wireless, a full-size refrigerator, a working desk and chairs, and is located a few blocks from the Javitz Centre. However, there is no business center on-site."
usa_new york city_carlton_arms,"The Carlton Arms is a budget-friendly hotel in midtown Manhattan, near a college and several subway stops. It has limited amenities like no TV or phone in the rooms, and internet access is available in the lobby for a fee."
usa_new york city_carvi_hotel_new_york,"The hotel has new facilities, a fridge, and a safety deposit box. Rooms have a coffee maker, free HBO, a flat-screen TV, and individual temperature controls."
usa_new york city_casablanca_hotel,"Casablanca Hotel offers free wifi, but reviewers note that the internet can be slow. It also includes access to a computer and printer in the cafe, and is centrally located near subway lines."
usa_new york city_chambers_hotel,"Chambers Hotel is a small, high-class boutique hotel located off 5th Avenue, making it convenient for shopping and dining. It provides amenities like in-room high-speed internet, and helpful staff for business needs."
usa_new york city_chelsea_lodge,"Chelsea Lodge is a budget-friendly hotel with small but clean rooms, shared bathrooms, and free WiFi, located near subway stations and restaurants. It's a quiet, secure location with a police precinct nearby."
usa_new york city_chelsea_pines_inn,"Chelsea Pines Inn is a moderately priced inn with wifi, breakfast included, and a business center; it is located a half block from the L train for easy transport uptown. Some rooms have a separate kitchen/seating area."
usa_new york city_chelsea_savoy_hotel,"The Chelsea Savoy is a no-frills hotel with wireless internet access and a convenient location near the metro, good restaurants, and a movie theater. Rooms are small and clean, making it a suitable place to sleep, and the front desk staff is friendly and recognizes returning guests."
usa_new york city_city_club_hotel,"The hotel has a good midtown location and offers free wireless internet, which is useful for business travelers. However, some rooms lack a desk and chair, and the lighting may not be suitable for desk work."
usa_new york city_clarion_collection_the_solita_soho_hotel,"Solita Soho offers free internet access and a convenient location near Little Italy, Chinatown, and Soho, making it easy to catch a cab. However, it lacks facilities such as a business center and rooms may be small with potential noise issues from a nightclub."
usa_new york city_club_quarters_downtown,"Club Quarters Downtown is a modern, clean hotel in NYC's Financial District, near Wall Street and subway lines, with amenities like free Wi-Fi, bottled water, a fitness room, and a business center. Rooms are small but functional, catering to business travelers."
usa_new york city_club_quarters_midtown,"Club Quarters Midtown is a business-oriented hotel with small rooms, free WiFi, a comfortable bed, and a good workspace. It has a lounge with free computers and is centrally located near Times Square and Grand Central."
usa_new york city_club_quarters_rockefeller_center,"Club Quarters Rockefeller Center is designed for business or solo travelers, with small but efficient rooms featuring a workspace, complimentary internet, and easy access to midtown locations. The hotel offers convenient business services and a 7th-floor lounge/restaurant, though some rooms may experience street noise."
usa_new york city_comfort_inn_chelsea,"The Comfort Inn Chelsea offers free wifi, hardwire internet cords, and a business center, but the computer and printer have a minimum charge of $3. Rooms have a desk and safe."
usa_new york city_comfort_inn_manhattan,"The Comfort Inn Manhattan is conveniently located near Penn Station and offers free internet access in the lobby. Some rooms include a safe and are equipped with a desk, while the hotel's location is convenient to subway stations."
usa_new york city_comfort_inn_manhattan_bridge,"The Comfort Inn Manhattan Bridge offers free WiFi, computers with free internet access in the lobby, and is located near multiple subway stops for easy access around the city. Some rooms have a desk with an office-type swivel chair."
usa_new york city_comfort_inn_midtown,"The Comfort Inn Midtown is centrally located near Times Square and offers free wireless internet, a business center with computers and printers, and a fitness center. Some rooms include a desk and free local and long-distance calls within the US."
usa_new york city_comfort_inn_midtown_manhattan,"The hotel offers free high-speed Wi-Fi in rooms and the lobby, and a computer with a printer is available for guests to use. Some rooms include a desk and multiple electrical sockets, and the hotel provides a free continental breakfast."
usa_new york city_comfort_inn_midtown_west_convention_center,"The hotel offers free high-speed internet, a free continental breakfast, and is located within walking distance of Penn Station. Some rooms have a coffee maker, and the hotel is close to the Javits Center."
usa_new york city_comfort_inn_times_square,"This hotel offers free Wi-Fi, a work desk in every room and is conveniently located near the Port Authority bus and subway stations. It's also within walking distance of Times Square, making it easy to access various business locations."
usa_new york city_cooper_square_hotel,"The hotel offers free Wi-Fi, and some rooms have floor-to-ceiling windows with city views. It is located close to subway lines and provides access to a fitness center."
usa_new york city_cosmopolitan_hotel_tribeca,"The Cosmopolitan Hotel is a basic, clean hotel in Tribeca with free Wi-Fi, and is conveniently located near subway lines for easy access to lower Manhattan attractions, with many coffee options nearby. It is suitable for business meetings in 7 WTC and perfect for low-key leisure travel."
usa_new york city_courtyard_by_marriott_new_york_manhattan_times_square_south,"This hotel is a standard business hotel with a great location, opposite a subway station and within walking distance of Midtown sights. There is free coffee, a business center, and free internet in the lobby, with some rooms having a desk."
usa_new york city_courtyard_by_marriott_new_york_manhattan_upper_east_side,"The hotel offers wired internet in rooms, a business center in the lobby with free internet and printing, and is close to a local hospital with preferred rates. Some found the location decent for business, although a bit far from the subway."
usa_new york city_courtyard_new_york_manhattan_fifth_avenue,"This Courtyard Marriott is in Midtown, close to public transportation and Grand Central station, and offers free internet and a business center. Some rooms have a desk, and there is a restaurant and deli, though some found the service slow."
usa_new york city_courtyard_new_york_manhattan_midtown_east,"This hotel has a business center with free internet and printing, and free Wi-Fi is available, but it may not work well in the guest rooms. Some rooms have a spacious layout with a king-size bed plus a sofa bed, with a work desk."
usa_new york city_crosby_street_hotel,"The Crosby Street Hotel is located in the heart of SoHo, close to subway, bus lines, and Broadway. It offers amenities such as a gym with up-to-date equipment, concierge service for car service and reservations, and spacious rooms, with suites available."
usa_new york city_crowne_plaza_times_square_manhattan,"This hotel is located near Times Square, offers amenities such as wireless internet, a business center, and rooms with work desks. It is close to public transportation for travel to meetings."
usa_new york city_da_vinci_hotel,"The Da Vinci Hotel offers free internet access in the lobby and is located close to subway lines. Some rooms have a desk, and there is a restaurant and bar on site."
usa_new york city_doubletree_guest_suites_times_square,"The Doubletree Guest Suites offers a centrally located suite hotel with large rooms, a well-equipped business center, and work space. It has wireless internet, though some reviewers note connectivity issues in certain rooms."
usa_new york city_doubletree_hotel_chelsea_new_york_city,"The Doubletree Chelsea is a newer hotel conveniently located near Penn Station, offering modern amenities such as a business center and comfortable beds; however, it suffers from slow elevators and small rooms, which may be problematic for business travelers needing quick and efficient service. Internet access is also not complimentary, which is unusual."
usa_new york city_doubletree_metropolitan_hotel,"The Doubletree Metropolitan is conveniently located near major bank headquarters and the 51st St subway, making it ideal for business travelers. The rooms are comfortable, tidy, spacious, and well-illuminated, and the staff is kind, efficient, and helpful."
usa_new york city_dream,"The hotel has wired internet access in rooms, but no business center or area to print boarding passes. The desk is placed very high, making it hard to work on with a laptop."
usa_new york city_duane_street_hotel,"The Duane Street Hotel is located in the Tribeca area, close to subway lines for easy access to other parts of the city. The hotel offers amenities such as free WiFi, laptop-sized safes, and access to a nearby gym."
usa_new york city_dylan_hotel,"The Dylan Hotel is conveniently located near Grand Central Terminal, making it ideal for business travelers needing easy access to transportation. The hotel offers amenities such as a business center, wireless internet, and comfortable rooms suitable for work."
usa_new york city_eastgate_tower,"The Eastgate Tower is conveniently located near Midtown and Grand Central Terminal and offers oversized suites, wireless internet, and a fitness center. Some rooms have a separate sitting area and a desk."
usa_new york city_econo_lodge_times_square,"This hotel offers free Wi-Fi, complimentary breakfast, and a business center, but rooms are very small. The location is central to Times Square, and within walking distance of the Port Authority."
usa_new york city_embassy_suites_hotel_new_york_city,"This hotel is a generic, mid-range business hotel with large rooms, a business center, and a good gym (New York Sports Club). Some rooms have a view of the Hudson River, and it is located near the World Financial Center."
usa_new york city_empire_hotel,"The Empire Hotel offers amenities for business travelers such as free Wi-Fi, a business center, and desks in some rooms. However, some rooms can be noisy and have small bathrooms, and some past guests reported issues with in-room internet access."
usa_new york city_envoy_club,"Envoy Club offers spacious studio and apartment-style rooms with fully equipped kitchens, decent work areas, and private phone/fax lines, but front desk hours are limited. Wireless internet is available, though service can be unreliable, and the location is near the NYU Medical Center."
usa_new york city_eurostars_wall_street,"The hotel is located in the Financial District near Wall Street and offers large rooms with a fridge and microwave. Some rooms have futon-style beds, and the hotel has a business center, but no exercise facility and spotty wireless service."
usa_new york city_excelsior_hotel,"The Excelsior Hotel has free wireless internet, and rooms have work desks. It is located in the Upper West Side close to a subway station for easy transport."
usa_new york city_fairfield_inn_new_york_manhattan_times_square_south,"The Fairfield Inn offers free internet, a business center, and is conveniently located near the subway, making it easy to get around. However, it lacks meeting rooms and has limited space."
usa_new york city_fitzpatrick_grand_central_hotel,"Fitzpatrick Grand Central is in an excellent location for business as it is within walking distance of midtown and accessible to subways and trains to Westchester and Connecticut, plus rooms include amenities such as an iron, hairdryer, a desk, and WiFi access for a fee. Some rooms are large, it has a pub downstairs that attracts a fun crowd, and room service is available."
usa_new york city_fitzpatrick_manhattan,"The Fitzpatrick Manhattan is a decent business option with large suites, a separate living area, and a tiny kitchenette that includes a fridge and coffee maker. It also provides free access to a mid-range sports club down the street."
usa_new york city_flatotel,"Flatotel is in a great midtown location, within walking distance to the east side, Rockefeller Center, Times Square, and Central Park, with subway access at 50th & Broadway or 6th & 57th. The hotel offers a free business center and WiFi."
usa_new york city_four_points_by_sheraton_manhattan_chelsea,"The hotel has comfortable beds and free internet. There is also a work desk with an ergonomic chair, along with multiple power outlets."
usa_new york city_four_points_by_sheraton_manhattan_soho_village,"The Four Points SoHo is a modern hotel with small, functional rooms that include a work desk, free WiFi, and wired internet. It's located near subway lines, making it convenient for business travel around the city."
usa_new york city_four_points_by_sheraton_midtown_times_square,"The hotel offers free wired and wireless internet, a business center with a printer, and rooms with a work area and plenty of outlets. Some rooms have an iPod docking station and a desk designed for laptop use with built-in USB connections."
usa_new york city_four_seasons_hotel_new_york,"The hotel caters mostly to corporate people, and is conveniently located near Lexington Avenue subway stations. Rooms have a large oval table which serves as a working desk, with internet connection, a printer/fax/scanner, and electrical devices."
usa_new york city_gild_hall,"Gild Hall is a conveniently located hotel in Manhattan's Financial District, with subway access, and offers amenities such as internet (for a fee), mini-bar, and toiletries. Some reviewers mention the availability of a business center and a mini-gym."
usa_new york city_gramercy_park_hotel,"The hotel offers free internet/wireless in the room, but power outlets are few and inconvenient, with only one at the desk and two in the bathroom; the business center is literally a small closet off the front desk with room for only one person at a time at a tiny desk. The rooms also have comfortable beds and quiet environments."
usa_new york city_grand_hyatt_new_york,"The Grand Hyatt is located in midtown Manhattan, connected to Grand Central Station, and provides easy access to the subway. It tries hard but is rather soul less and clearly designed for business travel, furnishings were above average and public areas seemed clean and well-maintained."
usa_new york city_greenwich_hotel,"The Greenwich Hotel offers free WiFi, though some reviewers found it slow. Some reviewers mentioned business meetings taking place in the lounge."
usa_new york city_hampton_inn_35th_st_empire_state_building,"The Hampton Inn is centrally located near Penn Station, Times Square, and the subway, and offers free WiFi, a business center, and a fitness room. Some rooms include a desk, and the hotel provides complimentary breakfast and 24/7 beverage service."
usa_new york city_hampton_inn_madison_square_garden,"The Hampton Inn Madison Square Garden provides free wireless internet in the rooms, free computers in the lobby, and a business center for travelers. The location is convenient to Penn Station, subways, and various business locations."
usa_new york city_hampton_inn_manhattan_chelsea,"The Hampton Inn Chelsea offers free high-speed internet, a business center, and a complimentary breakfast. It's conveniently located near transportation and mellow bars."
usa_new york city_hampton_inn_manhattan_soho,"Hampton Inn Soho provides free internet, a business center with computers, and is near public transport. Some reviewers mentioned that the hotel attracts a certain clientele, and can be noisy."
usa_new york city_hampton_inn_manhattan_times_square_south,"The hotel offers a business center with computer terminals and printers with high-speed internet, and free internet access in the rooms. It's conveniently located near Times Square and provides a free breakfast and menus from local restaurants that deliver."
usa_new york city_hampton_inn_new_york_seaport_financial_district,"The Hampton Inn Seaport/Financial District is conveniently located near Wall Street and the US Federal Courts, with free internet, a good desk, and included breakfast. It is also close to subway and bus stops for easy access to midtown."
usa_new york city_helmsley_middletowne_hotel,"The Helmsley Middletowne offers large rooms with ample closet space, a refrigerator, and a safe, and provides a newspaper on weekdays; however, there's no desk in the suite rooms and internet is provided through an antiquated modem. The hotel is centrally located near Grand Central Station and the Lexington subway line."
usa_new york city_hilton_club_new_york,"The Hilton Club offers a business center, wireless access, and is located near a train station and taxis. Some suites are spacious enough to accommodate up to 6 adults."
usa_new york city_hilton_garden_inn_chelsea,"The Hilton Garden Inn Chelsea is a modern, clean hotel with free Wi-Fi, wired internet, printer access, and a business center, and is conveniently located near Penn Station. Rooms include a desk, flat-screen TV, microwave, and refrigerator."
usa_new york city_hilton_garden_inn_new_york_west_35th,"This Hilton Garden Inn is strategically located in the heart of Midtown Manhattan, making it a perfect location for business purposes. The hotel has free Wifi, a free business center, and Herman Miller office chairs."
usa_new york city_hilton_garden_inn_times_square,"The Hilton Garden Inn Times Square offers free wireless internet, a free business center with printing, and ergonomic chairs, making it suitable for business travelers. Select rooms also include a microwave, refrigerator, and large desk."
usa_new york city_hilton_garden_inn_tribeca,"The Hilton Garden Inn Tribeca offers free Wi-Fi, a business center with free computer and printer access, and rooms with a desk, microwave, coffee maker, and refrigerator. It's located near subway lines for easy access to other parts of the city."
