Hotel,Summary
usa_new york city_3_west_club,"The 3 West Club is located across the street from Rockefeller Center and near St. Patrick's Cathedral, offering decent, clean rooms. It is not a typical chain hotel and does not offer amenities like room service."
usa_new york city_414_hotel,"Hotel 414 is a small, recently renovated boutique hotel with friendly staff, a courtyard, and a simple breakfast; some rooms have plasma TVs, mini-fridges, and safes. Guests have noted both positive and negative surprises, ranging from upgrades and welcome notes to cleanliness issues and unexpected room changes."
usa_new york city_60_thompson,"60 Thompson offers turndown service with Voss water and Fat Witch brownies, Fresh brand toiletries are included, and the hotel has a roof top bar. There's a wide variety of items for sale in the mini bar, including an Intimacy Kit and Tocca Candle."
usa_new york city_6_columbus,"6 Columbus offers upgrades to different suites, a rooftop terrace (though sometimes closed), and turndown service with Voss water and chocolate each night. Guests also receive a complimentary newspaper each morning and may find the staff remembers them by name."
usa_new york city_70_park_avenue_hotel_a_kimpton_hotel,"The hotel offers nice touches such as L'Occitane toiletries, a complimentary glass of wine each evening, an umbrella, and a $15 minibar credit for Kimpton In-Touch members. Guests can expect the New York Times delivered every morning, surprises for special occasions, and helpful staff ready to accommodate their needs."
usa_new york city_ace_hotel_nyc,"The Ace Hotel has a funky, garage-chic style with a lobby that is a cross between an old library and a room where bankers meet. The hotel rooms have unique decor, such as a guitar, a record player, or SMEG fridge; the hotel also has a sense of humor with its motto, ""Thank you for sleeping with us."""
usa_new york city_affinia_50,The Affinia 50 sometimes provides complimentary upgrades to larger rooms and has free wine and cheese in the Club Room during the week. Guests also mentioned the staff being attentive and providing services such as arranging transport or remembering guest names.
usa_new york city_affinia_dumont,"The Affinia Dumont offers amenities such as a pillow menu, fitness kits, in-room games for children, and a welcome treat to returning guests. Guests have reported room upgrades, personalized service, and high-floor rooms with a great view."
usa_new york city_affinia_gardens,Affinia Gardens has tea in the lobby and they leave tranquility tips each day in the room. Guests have also stated there have been minor issues that staff have readily and courteously resolved.
usa_new york city_affinia_manhattan,"The Affinia Manhattan has kitchenettes, is in a central location near Penn Station and Madison Square Garden, and has helpful staff to book tickets and offer recommendations. Guests can select pillows from a menu, and staff occasionally provide surprise upgrades or items such as teddy bears or free breakfasts."
usa_new york city_affinia_shelburne,"The Affinia Shelburne offers suites with pillow menus, ""My Affinia"" kits, and walking experience kits, and some guests have been upgraded to suites upon arrival or during their stay. Some rooms have views of the Empire State Building or Chrysler Building, and guests can access a rooftop bar, while others have noted kitchenettes with a microwave and fridge."
usa_new york city_aka_united_nations,"AKA United Nations offers modern, well-equipped apartments with kitchens, and provides complimentary breakfast on weekdays and access to a 24-hour gym. The hotel also provides daily snacks in the lobby, and some rooms have balconies."
usa_new york city_algonquin_hotel,"The Algonquin Hotel is a historic hotel with a lobby bar that features live music, cartoon wallpaper in the hallways, and a hotel cat named Matilda. Guests reported finding surprises such as a welcome card, fresh fruit, and coloring books, New Yorker cartoon wallpaper, quotes on the doors, and Matilda lounging around."
usa_new york city_americana_inn,"The Americana Inn is a budget-friendly hotel in a central location with small, clean rooms, shared bathrooms, and friendly staff. Some guests have been surprised to find features like LCD TVs, newly painted rooms, a sink in the room, or a kitchenette on each floor."
usa_new york city_amsterdam_court_hotel,"Amsterdam Court Hotel is known for its unbeatable location near Times Square and Broadway, but guest experiences vary widely; some find the rooms small, clean, and modern, while others describe them as tiny, dark, dirty, and in need of repair, and some guests report issues with broken amenities, rude staff, and mice. The hotel offers a mix of positive aspects like helpful staff (in some cases) and modern design alongside negatives like inconsistent room quality and noise issues, which could lead to a different surprise each day."
usa_new york city_astor_on_the_park,"The Astor on the Park appears to offer a mixed experience with some guests reporting cleanliness and friendliness, while others cite issues such as small rooms, noise, broken amenities, and inconsistent service. Some guests found unexpected perks like nice views, comfortable beds, and helpful staff, while others faced disappointments like non-functional TVs, plumbing problems, or dishonest staff."
usa_new york city_bedford_hotel,"The Bedford Hotel is an older hotel with some rooms having been upgraded, so guests may be surprised by the condition of their room; rooms are generally large with kitchenettes and safes. Guests also report varying experiences with the helpfulness of staff."
usa_new york city_beekman_tower_hotel,"The Beekman Tower is an apartment-style hotel with suites that include kitchens and separate living areas, and some rooms offer nice views. Some guests report getting surprise upgrades, and the hotel offers different types of pillows for comfort."
usa_new york city_belleclaire_hotel,"The Belleclaire is described as a quirky, European-style hotel with a unique charm, but also undergoing renovations, with potential for noise issues related to the old heating system, air conditioning, and street traffic. Guests often mention experiencing unexpected upgrades or changes in room quality, both positive and negative, and the hotel leaves small cards on the bed with the expected temperature for the next day."
usa_new york city_bentley_hotel,"The Bentley Hotel offers potential surprises, with some guests receiving automatic room upgrades to suites featuring great skyline views, while others have encountered issues such as loud A/C, noisy streets, broken amenities, and unexpected charges. The hotel's design may feel ""faux chic"" and is in need of improvements."
usa_new york city_best_western_bowery_hanbee_hotel,"The hotel is located in a vibrant area, in the heart of Little Italy and Chinatown. Guests can explore shops, restaurants and different cultures every day."
usa_new york city_best_western_convention_center_hotel,"Rooms are small, but clean and well-equipped, with some offering views of the Hudson. The hotel's location is a bit isolated in an industrial area, but close to the Javits Convention Center and within walking distance of Times Square."
usa_new york city_best_western_hospitality_house,"The Best Western Hospitality House is an apartment-style hotel where guests receive a daily restocked kitchen with breakfast items like muffins, juice, and cereal, and sometimes experience room upgrades. Some guests find pleasant surprises like helpful staff, convenient amenities, and a great location close to attractions and transportation."
usa_new york city_best_western_seaport_inn_downtown,"The Best Western Seaport Inn is located in the South Street Seaport area, near the Brooklyn Bridge, Financial District, and subway, with free breakfast and internet. Some rooms have views of the Brooklyn Bridge, and fresh cookies are offered in the afternoon."
usa_new york city_blue_moon_hotel,"The Blue Moon Hotel, a renovated tenement building in Manhattan's Lower East Side, features unique, spacious rooms decorated with vintage Americana, original artwork, and restored architectural details, creating a museum-like atmosphere. Staff are friendly and helpful, and guests can discover a glass of wine at check-in and a complimentary continental breakfast with fresh bagels and pastries."
usa_new york city_broadway_plaza_hotel,"Broadway Plaza Hotel is a small, clean hotel where rooms are renovated each day and the staff is helpful. Pastries, bagels, juice and tea/coffee are available 24/7."
usa_new york city_buckingham_hotel,"The Buckingham Hotel is a converted apartment building where each room is unique, with apartment-style rooms that vary in decor (some renovated, some dated) and amenities, so guests may find something new each day. Rooms may include kitchens and multiple entertainment systems with VCR's, CD players and wireless speakers."
usa_new york city_candlewood_suites_new_york_city_times_square,"Candlewood Suites Times Square offers suite-style rooms with full kitchens, which may include a full-size refrigerator, microwave, coffee machine, stove top, dishwasher, dishes, and utensils. As a long-stay hotel, rooms are only cleaned weekly, but amenities include free laundry and wireless internet."
usa_new york city_carlton_arms,"The Carlton Arms is an artsy, budget-friendly hotel where each room is uniquely decorated by different New York artists, offering a new visual experience with every stay; guests can even choose their room based on the available art. The hotel's distinctive, museum-like atmosphere and regularly changing artistic themes create a sense of adventure and discovery."
usa_new york city_carvi_hotel_new_york,"The Carvi Hotel is a recently opened boutique hotel with new facilities, including a fridge and safety deposit box, and has clean rooms with comfortable beds. The hotel was previously a school building once owned by Madonna, and the mini-bars were not yet stocked upon opening."
usa_new york city_casablanca_hotel,"The Casablanca Hotel offers complimentary wine and cheese every evening, plus 24/7 coffee, tea, and snacks in Rick's Cafe. Guests also report unexpected amenities like a bottle of champagne upon arrival for special occasions and turndown service with chocolates."
usa_new york city_chambers_hotel,"Chambers Hotel is a stylish, modern, and unique boutique hotel with industrial-chic decor, art pieces on the walls, and a roll of drawing paper with color pencils in the room. Guests can expect details such as industrial-style lighting, unique desk chairs, and french windows that open to let fresh air in."
usa_new york city_chelsea_lodge,"Chelsea Lodge is a charming, clean, and affordable hotel in the Chelsea area, with rooms that have unique decor and are serviced daily, sometimes including Hershey's kisses. Guests may find quirky surprises, such as themed wall art, sewing tables as desks, and sounds of birds chirping."
usa_new york city_chelsea_pines_inn,Chelsea Pines Inn is a movie-themed hotel where each room is decorated with different movie posters. Guests receive a daily newsletter with suggestions of things to do in the city.
usa_new york city_chelsea_savoy_hotel,"The Chelsea Savoy provides newspapers at the door every morning and pastries and coffee in the lobby, with some rooms also containing mini-fridges. Some guests have been surprised to find a fridge in their room upon leaving."
usa_new york city_city_club_hotel,"The City Club Hotel offers turn-down service with cookies, a complimentary DVD library, and a TV hidden behind a mirror. Some rooms include iPod docking stations, and newspapers are delivered in the morning."
usa_new york city_clarion_collection_the_solita_soho_hotel,"The Solita Soho offers modern, clean rooms with amenities like flat-screen TVs, comfortable beds, and unique double-headed showers, and delivers a copy of NYTimes in the AM. Some reviewers were pleasantly surprised by the hotel's location, nestled between Little Italy, Chinatown, and Soho, and found the staff friendly and helpful."
usa_new york city_club_quarters_downtown,"The Club Quarters Downtown is known for providing free bottled water, a ""guest request closet"" with extra amenities, and a lounge with free computers. Some guests also received unexpected room upgrades, wine, or chocolate upon arrival."
usa_new york city_club_quarters_midtown,"The rooms vary in size and quality, with some guests receiving upgrades to suites with multiple rooms, while others find standard rooms small and occasionally noisy. The hotel has automated check-in and check-out, but staff helpfulness varies."
usa_new york city_club_quarters_rockefeller_center,"Club Quarters Rockefeller Center offers free bottled water, computers, and sometimes unexpected room upgrades. The Terrace Club requires a special key card to access the 7th floor that expires every midnight, requiring guests to get a new one each morning."
usa_new york city_comfort_inn_chelsea,"The Comfort Inn Chelsea has varied room sizes and layouts, with some rooms offering unexpected views of the Empire State Building and surprise amenities like safes and refrigerators. Some reviewers were surprised by upgrades to suites or unexpected configurations with multiple twin beds, while others found the rooms small but clean and updated."
usa_new york city_comfort_inn_manhattan,"The Comfort Inn Manhattan is in a central location near the Empire State Building, Macy's, and Times Square, but some guests report the hotel is dated, with small rooms, thin walls and noisy pipes. Some guests mention free coffee in the lobby, and a free breakfast that includes bagels, toast, cereal, and fruit."
usa_new york city_comfort_inn_manhattan_bridge,"Comfort Inn Manhattan Bridge is located in Chinatown, near multiple subway stops and various points of interest. The hotel is new, clean, and offers complimentary breakfast and WiFi."
usa_new york city_comfort_inn_midtown,"The Comfort Inn Midtown offers comfortable beds, clean rooms, and friendly staff, with the same staff members often working there for years. Guests may be surprised by the free amenities including breakfast, internet, a fitness center, and modern room furnishings."
usa_new york city_comfort_inn_midtown_manhattan,"The Comfort Inn on 44th St. is a new hotel where some rooms have unexpected layouts, including basement rooms or rooms opening directly off the lobby, and room sizes can vary significantly. The hotel's breakfast offerings and amenities are also subject to change, with staff planning to add hard-boiled eggs and other items soon after opening."
usa_new york city_comfort_inn_midtown_west_convention_center,"The rooms are renovated, with fresh colors, clean bathrooms, and good mattresses, while some rooms are small; the hotel provides free breakfast, coffee, and juice. Some rooms are better maintained than others and it is a gamble, but if you get a well-maintained room it can be comfortable and have a fancy widescreen TV."
usa_new york city_comfort_inn_times_square,"The hotel provides complimentary bottled water and newspapers daily, and some rooms include iPod docks, microwaves, and refrigerators. Guests have also noted the staff's helpfulness and attentiveness, with some reporting unexpected acts of kindness like turning on the air conditioning in their room while they were out."
usa_new york city_cooper_square_hotel,"The Cooper Square Hotel is a modern, design-focused boutique hotel with unique touches like a library-style lobby, surprise amenities, curated book selections, and a ""living room"" check-in process. Guests have noted details like turndown service with fruit, a selection of robes, and occasional elevator rides shared with staff and laundry carts."
usa_new york city_cosmopolitan_hotel_tribeca,"The Cosmopolitan Hotel is frequently praised for being clean, comfortable, and having a great location near subway lines and attractions, but some guests note inconsistencies in room size, street noise, and occasional issues with the staff. The rooms have been renovated with new decor, LCD TVs, and come in loft-style options, with free internet and nearby access to a variety of food and drink options."
usa_new york city_courtyard_by_marriott_new_york_manhattan_times_square_south,"This hotel offers complimentary items that guests may find pleasant such as coffee/tea in the lobby, apples at the front desk in the morning, and candy in the afternoon; some guests report a view of the Empire State Building from their room. Room service was not offered but the hotel was close to many dining options."
usa_new york city_courtyard_by_marriott_new_york_manhattan_upper_east_side,"The hotel has a pool, gym, and coin-operated laundry; rooms include a safe, and wired internet access, with free computer and printer use in the lobby. Some rooms feature a kitchen and free breakfast is available, though limited."
usa_new york city_courtyard_new_york_manhattan_fifth_avenue,"The Courtyard Marriott Fifth Avenue garners mixed reviews regarding room size and noise levels, but many guests praise its central location near attractions like Times Square and Grand Central Station, as well as the helpful staff and clean accommodations. Some reviews mention a 24-hour deli next door and free internet access, while others describe small rooms, thin walls, and occasional issues with cleanliness or malfunctioning amenities."
usa_new york city_courtyard_new_york_manhattan_midtown_east,"The hotel has friendly and helpful staff, and offers complimentary coffee, tea, and internet on the 12th floor, with cookies in the lobby some days. Some guests received unexpected limousine rides to the airport at taxi rates."
usa_new york city_crosby_street_hotel,"The Crosby Street Hotel is known for its unique design with individually designed rooms, attention to detail in housekeeping, and staff that quickly learns guest preferences and anticipates needs such as preparing salsa daily for one guest. The hotel also features a bar with a wide selection of drinks and enthusiastic staff."
usa_new york city_crowne_plaza_times_square_manhattan,"The hotel offers a turn-down service, nightly weather forecasts, eye masks, lavender linen spray, and a soothing CD. Guests may experience room changes, surprise amenities, or unexpected service, but some promises like complimentary fruit baskets or gifts may not be fulfilled."
usa_new york city_da_vinci_hotel,"The Da Vinci Hotel is described as a small, European-style hotel with basic but clean rooms and a convenient location near Central Park and Times Square. Some reviewers noted that the hotel had some surprising amenities for the price such as free internet access and a refrigerator in the room."
usa_new york city_doubletree_guest_suites_times_square,"The Doubletree Guest Suites Times Square earns repeat customers with the potential for suite upgrades, warm cookies, and Diamond member benefits. The hotel is spacious and well-located, but experiences with service and cleanliness can vary."
usa_new york city_doubletree_hotel_chelsea_new_york_city,"The Doubletree Chelsea is a new, modern hotel with friendly staff that offers warm cookies upon arrival. The hotel is centrally located near Penn Station, Times Square, and other attractions."
usa_new york city_doubletree_metropolitan_hotel,"The hotel provides warm cookies upon arrival and Neutrogena bath products.
The hotel is known to offer suprises, some rooms include surprises like complimentary fruit baskets, chocolates, or extra cookies."
usa_new york city_dream,"The Dream Hotel is a trendy, modern hotel with eclectic decor and a large tropical fish tank in the lobby. The rooms feature plasma TVs and unique blue lighting, and turn-down service includes a weather report and fresh fruit."
usa_new york city_duane_street_hotel,"The Duane Street Hotel offers turndown service with sweet treats, complimentary newspapers, and unique room amenities that may vary daily. The hotel's design, while modern, has some quirks like hard-to-avoid bed corners and closet doors that don't close properly."
usa_new york city_dylan_hotel,"The Dylan Hotel features ""chemistry"" touches like beakers for glasses, and offers ""intimacy kits"" in the mini-bar. Guests have reported inconsistent experiences, with rooms and services varying greatly."
usa_new york city_eastgate_tower,"Eastgate Tower rooms are apartment-style with fully equipped kitchens, and while some guests found the decor dated, others were upgraded to larger rooms or suites during their stay. Some guests also noted the staff was helpful and accommodating."
usa_new york city_econo_lodge_times_square,"The Econo Lodge Times Square offers complimentary water, snacks and newspapers, along with a free breakfast which includes fresh bagels, pastries and fruit; guests also have access to 24/7 coffee and tea. The hotel rooms are cleaned daily and re-keyed every day for security purposes."
usa_new york city_embassy_suites_hotel_new_york_city,The hotel offers free drinks every evening from 5:30-7:30 and a free breakfast. Guests also reported being upgraded to waterfront suites and receiving bottles of wine and cheese.
usa_new york city_empire_hotel,"Here's a summary of the Empire Hotel based on the provided reviews:

The Empire Hotel is known for unexpected filming events (like Gossip Girl), a rooftop bar that may be closed for private events, surprise charges on the bill, and some rooms with construction or traffic noise. Some guests have had issues with room readiness, roaches, or lost luggage."
usa_new york city_envoy_club,"The Envoy Club offers spacious apartment-style rooms with fully equipped kitchens, and some reviewers were surprised by upgrades or the size of the rooms compared to typical Manhattan hotels. Some reviewers note a lack of consistent service, with varying experiences regarding housekeeping, front desk availability, and problem resolution."
usa_new york city_eurostars_wall_street,"The Eurostars Wall Street offers large rooms with modern bathrooms, plasma TVs, and amenities like fridges and microwaves, and some rooms have unexpected features like leather couches. The hotel's style approaches that of a boutique hotel with a friendly and attentive staff, and it is located near Wall Street with good subway connections."
usa_new york city_excelsior_hotel,"The Excelsior Hotel is known for its clean rooms and convenient location near Central Park and the Museum of Natural History; it offers amenities like sewing kits and luxury cosmetics, and the housekeeping staff sometimes arranges stuffed animals in the room. Rooms may include features such as a pants presser, surprises like an upgrade to a suite, or a balcony."
usa_new york city_fairfield_inn_new_york_manhattan_times_square_south,"The Fairfield Inn is a new property with small, clean, modern rooms and comfortable beds, offering free amenities like breakfast and internet. Some reviewers noted the staff was friendly and remembered them, while others mentioned managers baking cookies daily."
usa_new york city_fitzpatrick_grand_central_hotel,"The Fitzpatrick Grand Central offers rooms with unique amenities such as umbrellas, trouser presses, bathrobes, and bottled water and chocolates that appear bedside, and a front desk that may upgrade your room, all contributing to a stay full of pleasant surprises. The staff is known for being helpful and going above and beyond, making each day of the stay memorable and delightful."
usa_new york city_fitzpatrick_manhattan,"The Fitzpatrick Manhattan has friendly staff and a home-away-from-home atmosphere; some guests appreciated the staff's small touches and attentiveness, which made the stay memorable. Housekeeping sometimes arranged toys in creative ways, beds were turned down with water and chocolates, and staff offered help with directions and Broadway tickets."
usa_new york city_flatotel,"The Flatotel is known for its potential for room upgrades and varying experiences, with some guests finding unrenovated rooms and others receiving suites. Guests reported surprises regarding room size, amenities, and service consistency during their stays."
usa_new york city_four_points_by_sheraton_manhattan_chelsea,"The Four Points Sheraton Manhattan Chelsea offers free bottled water daily, complimentary newspapers, and a Starwood Preferred Guest floor. Some guests have also been surprised by upgrades, free breakfasts, or friendly staff."
usa_new york city_four_points_by_sheraton_manhattan_soho_village,"The Four Points Soho is a new, modern hotel with small but clean rooms, free Wi-Fi, and friendly staff. Some reviewers noted inconsistent housekeeping, noisy A/C, and slow elevators."
usa_new york city_four_points_by_sheraton_midtown_times_square,"I am sorry, I cannot fulfill the request. The hotel reviews lack information about unique aspects of the hotel that would ""surprise"" a guest on a daily basis."
usa_new york city_four_seasons_hotel_new_york,"The Four Seasons in New York offers special birthday favors, and staff anticipates guest needs such as providing extra towels, toiletries, and unexpected items like a larger bath rug. The hotel provides umbrellas for guests to take when it rains and has a ""beany baby"" tree in the lobby during the Christmas season."
usa_new york city_gild_hall,"Gild Hall is a stylish boutique hotel in the Financial District with modern rooms and comfortable beds, known for its friendly staff and occasional surprises such as welcome cookies or Fat Witch brownies at turndown. Some reviewers noted upgrades, small gifts, and well-stocked amenities, but others mentioned that the hotel is still undergoing renovations."
