Hotel,Summary
usa_new york city_the_french_quarters_guest_apartments,"The French Quarters Guest Apartments offer a convenient location near Times Square and subway lines, free WiFi, and rooms with kitchenettes, which may be suitable for business travelers. Some reviewers noted the availability of local event newsletters and proximity to various restaurants."
usa_new york city_the_gem_hotel_chelsea,"The Gem Hotel Chelsea offers free Wi-Fi and a business center with computer access, but some reviewers mention rooms are very small and may not be ideal for business travelers needing space to work or store luggage. One review notes a $1 a day ""charity"" charge was added to the bill, which may cause issues for business travelers submitting receipts."
usa_new york city_the_gem_hotel_midtown_west,"The Gem Hotel offers free wireless internet, a desk, and climate control. There is no room service or gym, but coffee-making facilities are available."
usa_new york city_the_gem_hotel_soho,"The Gem Hotel Soho offers free Wi-Fi, a desk in each room, and is conveniently located near subway lines and various restaurants. Some reviewers noted the rooms are small, but clean and well-maintained, with amenities like a mini-fridge and microwave available."
usa_new york city_the_grant_hotel,"I am sorry, but there is not enough information in the reviews to recommend this hotel for business travelers."
usa_new york city_the_hampton_inn_times_square_north,"This Hampton Inn offers free wired and wireless internet in the rooms and free coffee in the lobby, as well as a work desk and ergonomic chair. It is near the subway and Port Authority bus station."
usa_new york city_the_helmsley_carlton_house,"The hotel has spacious rooms, with some rooms including kitchenettes, sitting areas, and balconies. It is located close to subways and Central Park."
usa_new york city_the_helmsley_park_lane,"The hotel has responsive reception staff, desks and chairs that are not conducive to working for long periods, and a business center. Some rooms have no convenient outlet for plugging in a computer."
usa_new york city_the_herald_square_hotel,"The Herald Square Hotel is centrally located near transportation hubs like Penn Station and subway lines. It offers amenities such as free Wi-Fi, work desks, and guest laundry facilities, but has small rooms with limited services, and can be noisy due to construction."
usa_new york city_the_hotel_91,"Hotel 91 offers free wired internet (DSL or ethernet) and a small desk in the rooms. There is no wireless internet, and the desk space may be too small for extensive work."
usa_new york city_the_hotel_at_times_square,"The Hotel at Times Square offers a business center, free Wi-Fi, and a convenient location near Grand Central Station, making it a practical choice for business travelers. Rooms include a desk, comfortable beds, and in-room coffee makers."
usa_new york city_the_inn_at_irving_place,"This hotel may not be suitable for business travelers as some reviews mention noise issues and the lack of a desk in some rooms. The hotel is described as a getaway within NYC, and the staff is noted to be flakey on faxes and wake-up calls."
usa_new york city_the_iroquois,"The Iroquois is located in midtown Manhattan and has a library with computers, free Wi-Fi, and rooms with work desks. The hotel also offers fax services, meeting spaces, and shuttle services to airports."
usa_new york city_the_jane,"The Jane Hotel offers small, cabin-style rooms with amenities like high-speed internet, a flatscreen TV, and a dedicated workspace. It is located near subway stations and provides a safe, quiet neighborhood, suitable for travelers who primarily need a place to sleep and work."
usa_new york city_the_kimberly_hotel,"The Kimberly Hotel offers suites with amenities such as a desk with a fax machine, printer, copier, high-speed internet access, and a laptop-sized safe. It also has a new board room, and the staff is known for their efficiency."
usa_new york city_the_lombardy,"The Lombardy is a small boutique hotel with large rooms, some with kitchens, located on 56th St between Park and Lex. It is near restaurants, delis, bars, drug stores, and a subway station."
usa_new york city_the_london_nyc,"The London NYC is well-suited for business travelers with rooms equipped for comfort and technical needs, spacious suites, a good gym, and close proximity to local attractions. Some reviewers note that the hotel offers a complimentary car service within a 20-block radius, catering to business needs."
usa_new york city_the_lucerne_hotel,The Lucerne offers a desk in some rooms and free wifi. Some reviewers mention interet access only available through the business centre for a fee.
usa_new york city_the_manhattan_club,The Manhattan Club has a business center on the 26th floor with computers and printers available for guests. Wireless internet is free in the suites.
usa_new york city_the_mansfield,"The Mansfield Hotel is in Midtown, near Times Square and Grand Central, which allows for subway access to multiple locations, and offers free Wi-Fi, a business center, and a gym. Some rooms are small, dark, and noisy, and some have heating and AC issues."
usa_new york city_the_marcel_at_gramercy,"The Marcel Hotel is not great for business trips because the internet was often not working, but they still charged for it and the movie selection did not work and they still tried to charge for it. There are no hotel amenities and the rooms are smaller than usual."
usa_new york city_the_maritime_hotel,"The Maritime Hotel is conveniently located near subway stations, Chelsea Market, and the Meatpacking District. It offers free WiFi, a business center with free printing, and efficient room service, but rooms are small."
usa_new york city_the_mark,"The Mark is located on the Upper East Side, close to museums, art galleries, Central Park, and upscale shopping. Some rooms include kitchenettes, and wireless internet access is available."
usa_new york city_the_marmara_manhattan_luxury_hotel_residence,"The Marmara Manhattan offers apartment-style rooms with full kitchens, free WiFi, and amenities like a fax/printer/copier. Some suites include a dining area and workspace, and the hotel provides free newspapers and laundry tokens."
usa_new york city_the_mave,"The MAve Hotel is in a central location convenient for business, with subway access and walking distance to Times Square. It offers modern decor, helpful staff, and free WiFi."
usa_new york city_the_mercer_hotel,"The Mercer is located in SoHo near subway connections, and offers amenities such as free Wi-Fi, a business center, and room service. Some rooms include iPod docks, stereos, and large TVs, and guests have access to a nearby Equinox gym."
usa_new york city_the_michelangelo_hotel,"The Michelangelo Hotel offers a convenient midtown location for business trips, proximity to corporate towers, and a complimentary limo service to the financial district during the week. Some reviewers noted smaller rooms, worn furnishings, and noise from the air conditioning system."
usa_new york city_the_milburn_hotel,"I am sorry, but the provided reviews lack specific details catering to business travelers. The reviews mention free wifi and no business center; however, they also focus more on the hotel's value, location, and suitability for families or tourists rather than the specific needs of business travelers."
usa_new york city_the_muse_hotel_new_york_a_kimpton_hotel,"The Muse Hotel is a smaller, boutique-type hotel with creative yet comfy decor, rooms with work spaces, and free internet access for Kimpton InTouch members. It is centrally located near Times Square and subways, but some rooms can be noisy."
usa_new york city_the_new_york_helmsley,"The New York Helmsley is conveniently located near Grand Central Station, making it accessible to transportation, and offers free WiFi. Some rooms have a desk and the hotel has a business center, though some reviews mention it may have limited availability or incur a fee."
usa_new york city_the_new_yorker_hotel,"The New Yorker Hotel is conveniently located near Penn Station and major subway lines, with a business center, free WiFi, and rooms that include a work desk. Some rooms are small, and there is no bar or room service available."
usa_new york city_the_pierre,"The Pierre hotel offers amenities such as desks with free internet, printers, fax, and copiers for business needs, and is located close to transportation. Some rooms have a separate seating area suitable for conducting business."
usa_new york city_the_plaza,"The hotel has a conference center, offers modern amenities such as large flat screen TVs, and provides laptop ports in the rooms. Broadband internet access is available."
usa_new york city_the_pod_hotel,"The Pod Hotel is noted for its convenient location in midtown Manhattan and the availability of free WiFi, making it suitable for business travelers. The rooms have a desk and the hotel offers a business travel desk, but the small rooms and thin walls may not be ideal."
usa_new york city_the_premier,"The Premier is a boutique hotel connected to the Millennium Broadway, offering amenities like free cable internet, a large desk area, and breakfast. Rooms have a sofa, flat-screen TV, and are well-isolated from outside noise."
usa_new york city_the_ritz_carlton_new_york_central_park,"The Ritz Carlton Central Park is conveniently located near transportation and business districts. It offers meeting rooms, business services, and club-level access with concierge services."
usa_new york city_the_roosevelt_hotel,"This hotel is conveniently located in midtown near many banking and finance companies, and a car service is available to take you to the airport. Internet access is available in the rooms for a fee, and there is a business center available."
usa_new york city_the_sherry_netherland_hotel,"The Sherry-Netherland offers quick check-in/check-out, a gym with cardio equipment and weights, and is located conveniently for mid-town meetings with easy access to cabs. Some suites have kitchens and living rooms, and corporate discounts may be available."
usa_new york city_the_shoreham,"The Shoreham Hotel offers free WiFi, a 24-hour espresso machine, and a business center with computers and a printer. Some rooms have a desk area, but they are small, and the hotel is conveniently located for midtown businesses."
usa_new york city_the_st_regis_hotel_new_york,"The St. Regis is noted as a great place to hold a business meeting with large, classically decorated suites and butler service, including pressing business dress. It also offers high-speed internet, 24-hour services, and a convenient midtown location."
usa_new york city_the_standard_new_york,"This hotel offers free Wifi, but no business center. The rooms have comfortable beds and a work table, but some reviewers noted the lack of convenient electrical outlets."
usa_new york city_the_surrey,"The Surrey has ergonomic desks, wireless internet for a fee, and is located near subway options. Some suites have full kitchens and dining tables."
usa_new york city_the_sylvan_guest_house,"The Sylvan Guest House offers apartment-style accommodations with equipped kitchens, and some units have internet access, while others do not. It is located a 20-minute train ride from Times Square."
usa_new york city_the_time,"The Time Hotel is in an ideal location near Times Square and the Theater District, and offers amenities such as in-room internet, a gym, and a restaurant. Some rooms have a desk, and some suites have a separate sitting room."
usa_new york city_the_waldorf_astoria,"The hotel is centrally located with meeting facilities, offers a business center, and has rooms with a desk and high-speed internet access for a fee. Some rooms are spacious and the staff is helpful, but service can be slow, and staff reductions have occurred."
usa_new york city_the_westin_new_york_at_times_square,"The Westin Times Square is often noted as a business-friendly hotel with amenities including a large desk, and high-speed internet (though for an extra charge), and it is close to transportation options. Some rooms have iMac computers, and there is a business center for printing boarding passes."
usa_new york city_thirty_thirty_hotel,"Thirty Thirty Hotel offers basic amenities, clean rooms, and a convenient midtown location near Park and Madison Avenues, with hi-speed internet connection on LAN. The hotel also has an attached diner and is within walking distance of many restaurants and food joints."
usa_new york city_thompson_les,"Thompson LES offers spacious rooms with modern design and comfortable beds and is located near subway lines, making it easy to get to midtown. It also offers amenities such as a large flat-screen TV and a work desk in the room."
usa_new york city_travel_inn_hotel_new_york,"This hotel is conveniently located near the Javits Convention Center and offers wireless internet access for a fee. Rooms include microwaves, refrigerators, and irons/ironing boards."
usa_new york city_tribeca_grand_hotel,"The hotel has a work desk with an Aeron chair, a fax machine, and wireless internet in the rooms, as well as a 24-hour business center. It is conveniently located near multiple subway lines."
usa_new york city_trump_international_hotel_and_tower,"The Trump International Hotel offers amenities suitable for business travelers, such as chargers for mobile phones, computers, and fax machines, as well as personalized stationery. Meeting rooms are well-stocked and attended to, with services like immediate pressing of one garment upon arrival."
usa_new york city_tudor_hotel_at_the_united_nations,"The Tudor Hotel is near the UN, a short walk to Grand Central, and has amenities like in-room internet access, a business center, and comfortable beds. It's also described as a convenient location for business trips."
usa_new york city_vincci_avalon,"The Vincci Avalon offers free internet in the lobby, rooms with a work desk, and is near Penn Station and Grand Central Station. Some reviewers note frustrations with the internet connection being slow or unavailable."
usa_new york city_w_new_york_the_court,"W The Court is in a great midtown location, close to Grand Central Station with many restaurants nearby. The hotel offers good service, large rooms, and amenities like a fax machine, in-room broadband, and free car service in Acura SUVs."
usa_new york city_w_new_york_the_tuscany,"The W Tuscany is conveniently located near Grand Central Station and Midtown, making it accessible for business travelers. Rooms offer workspaces, comfortable beds, and internet access (though not always free), but some rooms can be noisy due to elevator proximity."
usa_new york city_w_new_york_times_square,"The W Times Square is a trendy, modern hotel with free wifi in the lobby, outlets in sensible places, and ample workspace. Some reviewers recommend it for business stays due to its great service and amenities."
usa_new york city_w_new_york_union_square,"The W Union Square offers amenities such as in-room WiFi for a fee, a gym, and a business center, but some found the gym and business center to be small. The hotel's location near Union Square provides convenient access to transportation and nearby businesses."
usa_new york city_waldorf_towers,"The hotel offers business facilities, though some reviewers found them overpriced. Some suites include an office area, and the hotel's location is convenient to uptown and downtown."
usa_new york city_wall_street_inn,"The Wall Street Inn is located near the financial district and Wall Street subway station, making it accessible to business engagements. It offers free Wi-Fi, a business center, and room service from local restaurants, but some reviewers have noted issues with staff knowledge and service for business travelers."
usa_new york city_warwick_new_york_hotel,"The Warwick Hotel is noted for its central Midtown location, offering proximity to Central Park, shops, and theaters, and has a gym with newer equipment. The hotel also has business services such as free internet and a business center."
usa_new york city_washington_jefferson_hotel,"The Washington Jefferson Hotel is a budget-friendly option with comfortable beds, a desk, and free wireless internet; however, the rooms are small, there is no coffee in the room or lobby, and the free wifi can be unreliable. Some rooms have iPod docking stations and work spaces, and free printing is available at the front desk."
usa_new york city_washington_square_hotel,"Washington Square Hotel is located near NYU and has a subway stop at the corner that links to JFK airport and easy access to taxis. There is also free, quick internet via cable supplied by the hotel."
usa_new york city_wellington_hotel,"This hotel is in a convenient central location and has a helpful staff and business center. It offers wireless internet, and some rooms have work desks."
usa_new york city_west_57th_street_by_hilton_club,"The hotel offers free high-speed internet, a desk area in the rooms, and is located near public transportation. Some rooms have technological enhancements, and there is a business center."
usa_new york city_wingate_by_wyndham_manhattan_midtown,"The hotel is well-equipped for business travelers, offering free high-speed internet, comfortable desks and chairs, and a business center. Free US phone calls are available, as mobile phone reception can be unreliable throughout the building."
usa_new york city_wolcott_hotel,"The Wolcott Hotel is centrally located near the Empire State Building and offers amenities like a business center and in-room safes. Some rooms include multiple TVs, desks, and internet access for a fee."
usa_new york city_woogo_central_park,"This apartment-style lodging provides amenities such as kitchenettes, refrigerators, and internet access, but lacks daily maid service. The location is near the subway, but the front desk hours are limited."
usa_new york city_wyndham_garden_hotel_times_square_south,"Wyndham Garden Hotel is suitable for business travel due to its proximity to Penn Station and the Convention Center, free Wi-Fi, a business center, and well-equipped rooms with workspaces. It also offers amenities such as a gym, and a bar."
