Hotel,Summary
usa_new york city_3_west_club,"The 3 West Club is located across the street from Rockefeller Center, near St. Patrick's Cathedral and Radio City Music Hall. It offers clean, basic rooms and a complimentary breakfast, but lacks the amenities of a typical chain hotel."
usa_new york city_414_hotel,"414 Hotel is a small, intimate haven near Restaurant Row with a charming leafy patio, mosaic tables, and bedrooms featuring photographic cityscapes, white down comforters, and natural fiber sheets. The hotel has a European vibe, and guests can have breakfast together at a long, attractively stained table brightened by flowers."
usa_new york city_60_thompson,"60 Thompson is a modern, stylish boutique hotel located in SoHo with a cool lobby bar and rooftop bar. The hotel is known for its friendly staff and convenient location near shops and restaurants."
usa_new york city_6_columbus,"6 Columbus is a modern, chic boutique hotel with a trendy atmosphere and a Japanese-inspired restaurant, located near Central Park and the Columbus Circle subway stop. The hotel features stylish rooms with contemporary minimalist design, flat-screen TVs, iPod docks, and Kiehl's or Fresh bath products."
usa_new york city_70_park_avenue_hotel_a_kimpton_hotel,"This boutique hotel has a modern and stylish decor, a small lobby, and offers a wine reception in the evenings. The rooms are cozy with warm lighting and comfortable beds."
usa_new york city_ace_hotel_nyc,"The Ace Hotel has a hipster vibe with a lively lobby scene, library table, and bar; some rooms include features like guitars and record players. The hotel has funky decor with reclaimed furniture and accessories, and a masculine style with dark lighting."
usa_new york city_affinia_50,"The Affinia 50 is a smaller, modern hotel with a lounge area on the second floor, pod coffee machines, and orchids in the lobby; it offers free wine and cheese on some evenings. The rooms are executive suites, with options for a lounge, bedroom, kitchen, and bathroom."
usa_new york city_affinia_dumont,"The Affinia Dumont is a stylish hotel with modern decor, large rooms, and a good location in the Murray Hill neighborhood. Although a smaller hotel, the staff was very friendly and helpful."
usa_new york city_affinia_gardens,"Affinia Gardens, located on the Upper East Side, offers spacious rooms with kitchens and a ""tranquility"" theme, including a tea bar. The hotel is described as having a zen-like philosophy and spa-esque atmosphere, appealing to those seeking a relaxing environment."
usa_new york city_affinia_manhattan,"The Affinia Manhattan is located across from Penn Station and Madison Square Garden with a grand lobby and bar. The rooms feature kitchens and are clean, with pillow menus and updated bedding."
usa_new york city_affinia_shelburne,"The Affinia Shelburne is a recently renovated hotel with modern decor, a chic lobby, and a groovy bar/restaurant with a popular local following. It also features a rooftop bar with great city views."
usa_new york city_aka_united_nations,"AKA United Nations offers modern, well-equipped apartments with kitchens and comfortable living spaces, featuring modern decor and a generally quiet atmosphere, with complimentary breakfast on weekdays."
usa_new york city_algonquin_hotel,"The Algonquin Hotel has an old New York feel with a classic boutique style, art deco character, and a lively lobby, but doesn't have a hip scene. The hotel is historic and elegant, with art deco character, New Yorker cartoon wallpaper, and a resident cat."
usa_new york city_americana_inn,"The Americana Inn is a basic, clean budget hotel in midtown Manhattan, offering small rooms with shared bathrooms, TV, and a sink. Some rooms have been recently painted and include LCD TVs, and the hotel is secured with a buzzer entry system."
usa_new york city_amsterdam_court_hotel,"Amsterdam Court Hotel is a small, modern, and clean hotel with a snappy little lobby and a trendy cocktail bar. Rooms feature a contemporary brown and beige color scheme and modern design."
usa_new york city_astor_on_the_park,"The Astor on the Park is a basic, clean, and European-style hotel with small rooms, friendly multilingual staff, and is located across from Central Park and near the subway. It is a great base for exploring the city and is frequented mainly by European guests."
usa_new york city_bedford_hotel,"The Bedford Hotel is described as a comfy-style boutique hotel with a relaxed atmosphere and accommodating staff. The lobby is nicely decorated, and some rooms are spacious suites with sitting rooms and kitchenettes."
usa_new york city_beekman_tower_hotel,"The Beekman Tower has an Art Deco design with spacious rooms that include kitchenettes and living areas, but some guests have noted that the decor is outdated. The hotel has a restaurant/bar on the top floor that provides great city views."
usa_new york city_belleclaire_hotel,"The Hotel Belleclaire is a stylish, modern hotel with sleek rooms in a renovated historic building on the Upper West Side, near Central Park, with hardwood floors, flat-screen TVs, iPod docks, and optional shared bathrooms. Some rooms have views of Broadway, and the hotel is close to shops, restaurants, and subway stations."
usa_new york city_bentley_hotel,"The Bentley Hotel has a modern, clean, and boutique-like design, with a rooftop bar that has great views of the city, but some found the hallways and elevators to be dark. It is located on the upper east side, a bit off the beaten path, in a quiet area near the East River."
usa_new york city_best_western_bowery_hanbee_hotel,"The Best Western Bowery Hanbee is a new, modern hotel with clean rooms, hardwood floors, and flat-screen TVs, located in Chinatown and close to Little Italy, SoHo, and the subway. Some rooms have heated bathroom floors and large windows, and the hotel provides free Wi-Fi and continental breakfast."
usa_new york city_best_western_convention_center_hotel,"The Best Western Convention Center Hotel is described as a basic but clean hotel with new furnishings, and modern bathrooms. Some reviewers mention a ""boutique"" feeling and that the hotel is filled with European travelers."
usa_new york city_best_western_hospitality_house,"The Best Western Hospitality House is an apartment-style hotel with spacious rooms, full kitchens, and a location in midtown Manhattan, near the Waldorf Astoria. Some rooms feature hardwood floors and are described as tastefully decorated and having a contemporary/retro feel."
usa_new york city_best_western_seaport_inn_downtown,"The Seaport Inn is a small, charming hotel with tasteful decor, offering a cozy and quiet atmosphere in the South Street Seaport area. Some rooms have views of the Brooklyn Bridge and terraces, and the hotel features prints of historic etchings of the neighborhood."
usa_new york city_blue_moon_hotel,"The Blue Moon Hotel is a renovated tenement building with artistic decor, offering uniquely decorated, spacious rooms with a vintage Americana flavor and a cozy atmosphere. Select rooms include balconies and views of the city."
usa_new york city_broadway_plaza_hotel,"Broadway Plaza Hotel is described as recently renovated with a boutique style, though some found it basic and office-like with a small lobby. The rooms are large for NYC, clean, and have marble tile floors instead of carpet."
usa_new york city_buckingham_hotel,"The Buckingham Hotel has a small, artsy lobby with a music theme. Rooms are apartment-style with kitchens and hardwood floors, some renovated with modern bathrooms."
usa_new york city_candlewood_suites_new_york_city_times_square,"The Candlewood Suites Times Square offers small studio suites with mini-kitchens and cozy decor, featuring amenities like full-sized refrigerators, free laundry, and a workout room. The hotel is new, clean, and located within walking distance of Times Square."
usa_new york city_carlton_arms,"The Carlton Arms is an artsy, budget-friendly hotel where each room is uniquely decorated by different New York artists, offering a funky and adventurous experience. It's located in a safe midtown area near subways, restaurants, and bars, with a lobby featuring a resident cat."
usa_new york city_carvi_hotel_new_york,"The Carvi Hotel is a new, small, and comfortable hotel with clean rooms, marble bathrooms, and flat-screen TVs. It is located conveniently near subway lines, with a Starbucks and CVS nearby, and the building was previously owned by Madonna and renovated from a school."
usa_new york city_casablanca_hotel,"The Casablanca is a small boutique hotel with a North African-inspired decor and a relaxed lounge with complimentary drinks and snacks, reminiscent of a B&B. The atmosphere is cozy, with a haven to relax in after a busy day."
usa_new york city_chambers_hotel,"Chambers Hotel is a modern, stylish boutique hotel with industrial-chic decor, art pieces, and unique design details like drawing paper and color pencils. Rooms have french windows and the hotel offers a relaxed but sophisticated atmosphere."
usa_new york city_chelsea_lodge,"Chelsea Lodge is a budget-friendly hotel with a charming, eclectic decor, a cozy, home-like atmosphere, and a location in the quiet, safe Chelsea neighborhood near the subway and various shops and restaurants. Rooms are small, but very clean, with some offering garden views and New England-style decor."
usa_new york city_chelsea_pines_inn,"Chelsea Pines Inn has movie-themed decor, including vintage posters, and offers a relaxed atmosphere with a courtyard. It is located in Chelsea, near the Meatpacking District and Greenwich Village."
usa_new york city_chelsea_savoy_hotel,"The Chelsea Savoy is a basic, no-frills budget hotel with small but clean rooms, and is located in the Chelsea neighborhood close to subway lines and restaurants. Some rooms have been updated with new carpets and marble vanities, and the hotel offers complimentary coffee and pastries in the lobby."
usa_new york city_city_club_hotel,"City Club Hotel is a small, intimate, and stylish boutique hotel with a modern decor, frequented for its central Midtown location and DB Moderne restaurant. Rooms feature dark, masculine decor, Hermes bath products, and technology such as TV's hidden behind mirrors."
usa_new york city_clarion_collection_the_solita_soho_hotel,"The Solita Soho is a small, modern, and clean boutique hotel in lower Manhattan, situated at the edge of Soho and close to Little Italy and Chinatown. Some rooms have flat-screen TVs and views of the Empire State Building."
usa_new york city_club_quarters_downtown,"The hotel has modern, clean rooms and a small, stylish lobby lounge with free computers. Rooms feature IKEA-like modern furnishings, flat-screen TVs, and are described as professional."
usa_new york city_club_quarters_midtown,"Club Quarters Midtown is a clean, modern, and efficient hotel with small rooms, catering to business travelers with amenities like free WiFi, work desks, and community computers. The hotel has a relaxed but stylish lounge area and a no-frills, self-service approach."
usa_new york city_club_quarters_rockefeller_center,"Club Quarters Rockefeller Center has a sleek, European modern style and a clean, crisp atmosphere appealing to those seeking a discreet and private experience. The Terrace Club on the 7th floor offers a relaxing space with comfortable seating, a fireplace, and a terrace with views, along with free internet access."
usa_new york city_comfort_inn_chelsea,"The Comfort Inn Chelsea has a recently renovated, safe, and friendly environment, with marble in the lobby and a beautifully-restored, tin ceiling. There is also a bar owned by Nick and his partner along with Patricia."
usa_new york city_comfort_inn_manhattan,"The hotel features a classic-looking restaurant, stain-glass windows in the reception/bar area, and a spiraling staircase. Reviewers describe it as older, a bit dated, but with character."
usa_new york city_comfort_inn_manhattan_bridge,"The Comfort Inn Manhattan Bridge is a new and clean hotel with nicely appointed rooms, comfortable beds, and modern bathrooms. The rooms are decorated in a modern style with a divine shower head."
usa_new york city_comfort_inn_midtown,"This hotel has been recently remodeled with a classy old-world feel downstairs and comfortable, contemporary rooms. The hotel offers a fitness center, free internet, and a free continental breakfast."
usa_new york city_comfort_inn_midtown_manhattan,"The hotel has modern decor, new rooms, and a lobby with a flatscreen TV and free computer/printer. Rooms include flatscreen TVs, coffee makers, ironing boards, and individually controlled AC/heat; bathrooms have granite sink tops and showerheads with multiple spray settings."
usa_new york city_comfort_inn_midtown_west_convention_center,"The Comfort Inn offers clean, newly renovated, and modern rooms, some with city views from higher floors. It provides a simple, adequate stay with free high-speed internet and flat-screen TVs, appealing to those seeking value over luxury."
usa_new york city_comfort_inn_times_square,"The Comfort Inn Times Square has modern and new rooms with flat-screen TVs and iPod docks. The rooms are small, but decorated in a mod style with marble and tile baths."
usa_new york city_cooper_square_hotel,"The Cooper Square Hotel is a modern, design-focused hotel with a library-like lobby and a hip vibe. The hotel has a bar area and is located in the East Village, close to restaurants, bars, and subway lines."
usa_new york city_cosmopolitan_hotel_tribeca,"The Cosmopolitan Hotel is a clean and comfortable budget hotel in the Tribeca area, next to a subway station, with small, recently remodeled rooms. It has unpretentious decor, free internet, and is near restaurants, cafes, and shops."
usa_new york city_courtyard_by_marriott_new_york_manhattan_times_square_south,"This hotel offers a clean and modern experience, and is described as a business hotel without much character. Its rooms feature flat-screen TVs, and there is complimentary coffee in the lobby."
usa_new york city_courtyard_by_marriott_new_york_manhattan_upper_east_side,"The Courtyard Upper East Side has a clean, modern lobby with plasma TVs, stylish decor, and a glass wall overlooking the indoor pool. Rooms are furnished in a spare, modern style."
usa_new york city_courtyard_new_york_manhattan_fifth_avenue,"The Courtyard Marriott Fifth Avenue offers modern and clean rooms, some with recent renovations, though they tend to be small. The hotel is described as having a boutique-style atmosphere without the glitter."
usa_new york city_courtyard_new_york_manhattan_midtown_east,"The Courtyard Midtown East has clean, spacious rooms and a convenient location, with the subway close by, making it easy to get around the city. Some rooms have great views, and nearby restaurants and shops provide convenient options for dining and necessities."
usa_new york city_crosby_street_hotel,"The Crosby Street Hotel is located in the heart of SoHo and features individually designed rooms, art-filled public spaces, and a bar with a wide selection of wines. The hotel attracts a wonderful crowd and offers a relaxed atmosphere."
usa_new york city_crowne_plaza_times_square_manhattan,The Crowne Plaza Times Square has a stylish lobby with a trendy bar. The rooms are modern and have comfortable beds.
usa_new york city_da_vinci_hotel,"The Da Vinci is a small, European-style hotel with marble and cherry wood decor in the lobby, offering a cozy atmosphere with a gas fireplace and a restaurant/bar downstairs. Rooms have flat-screen TVs and some offer street views."
usa_new york city_doubletree_guest_suites_times_square,"The Doubletree Guest Suites in Times Square offers spacious suites with amenities like a wet bar, microwave, and refrigerator, with some rooms offering impressive city views. While not particularly hip or trendy, the hotel is clean, well-appointed, and conveniently located."
usa_new york city_doubletree_hotel_chelsea_new_york_city,The Doubletree Chelsea is a modern hotel with new amenities. It is known for its friendly and helpful staff and is located within walking distance of many attractions.
usa_new york city_doubletree_metropolitan_hotel,"The Doubletree Metropolitan has a retro, modern, and funky decor with a lively bar, and a newly remodeled lobby. Some reviewers found the rooms to be stylish, clean and with a decent size for NYC, with comfortable beds and a large HDTV."
usa_new york city_dream,"This modern and stylish hotel has a trendy, hip atmosphere with a cool lobby bar and roof bar and blue lighting. Rooms have a minimalist design, Bose radios, and flat-screen TVs."
usa_new york city_duane_street_hotel,"The Duane Street Hotel is a small, modern, and stylish boutique hotel located in the Tribeca area of NYC, with clean and well-designed rooms. It has a cozy lobby and restaurant area, and offers services like evening turndown with sweet treats."
usa_new york city_dylan_hotel,"The Dylan Hotel is a small, modern boutique hotel with a convenient midtown location near Grand Central Terminal. It features stylish decor with chemistry-themed touches and a comfortable, quiet atmosphere."
usa_new york city_eastgate_tower,"The Eastgate Tower is known for its spacious, apartment-style suites with kitchens, offering a quiet and convenient location in midtown Manhattan near Grand Central Station. Though the decor is often described as dated, the hotel is praised for its cleanliness and friendly staff."
usa_new york city_econo_lodge_times_square,"I am sorry, but I cannot fulfill this request. I cannot determine if the hotel has a ""laid-back but stylish atmosphere"" based on the reviews provided. The reviews focus primarily on the hotel's location, cleanliness, size of rooms, and value."
usa_new york city_embassy_suites_hotel_new_york_city,"The Embassy Suites offers spacious suites with modern decor, free breakfast, and evening drinks in a location removed from the Times Square crowds. It's situated in Battery Park, next to the Hudson River, with views of the water and New Jersey."
usa_new york city_empire_hotel,"The Empire Hotel features a trendy and hip decor, a comfortable lounge area with comfy seating, and a rooftop bar that is fun and lively. It is located in the Upper West Side, near Central Park and Lincoln Center."
usa_new york city_envoy_club,"The Envoy Club offers spacious apartment-style rooms with full kitchens, with decor described as stylish, though some find it dated. Guests can enjoy a rooftop deck with city views."
usa_new york city_eurostars_wall_street,"The hotel has a stylish, boutique feel with modern, large rooms and furniture and is located in the Financial District. The lobby lounge has a laid-back atmosphere with rap music."
usa_new york city_excelsior_hotel,"The Excelsior Hotel is an older, European-style hotel with mahogany and marble decor in the lobby, a library-style breakfast room, and clean rooms. The hotel's location on the Upper West Side is residential and near Central Park, museums, restaurants, and transportation."
usa_new york city_fairfield_inn_new_york_manhattan_times_square_south,The Fairfield Inn has a modern decor with warm burgundy and beige colors and cool-looking bathrooms with glass shower doors. The breakfast room is uniquely decorated.
usa_new york city_fitzpatrick_grand_central_hotel,"The Fitzpatrick Grand Central is a smaller, European-style hotel with stylishly decorated rooms, a library, and an Irish pub and courtyard. Many reviewers describe the hotel as a warm, intimate, and quiet respite from the city."
usa_new york city_fitzpatrick_manhattan,"The Fitzpatrick Manhattan is a smaller, intimate hotel with an Irish touch, offering comfortable and updated rooms. Its bar and restaurant are described as warm and friendly, providing a relaxed atmosphere."
usa_new york city_flatotel,"The Flatotel has a sleek and modern lobby with a bar, and offers spacious rooms with minimalist decor. Some rooms have kitchens and jacuzzis."
usa_new york city_four_points_by_sheraton_manhattan_chelsea,"The Four Points by Sheraton Manhattan Chelsea offers a modern, stylish decor with a hip atmosphere, and some rooms have views of the Empire State Building. The lobby sometimes plays techno music and has a bar, though some found the music to be loud."
usa_new york city_four_points_by_sheraton_manhattan_soho_village,"The Four Points Soho is a new, modern hotel with clean, functional rooms and wood and steel accents. It has a small, cozy bar and is located in an up-and-coming area near restaurants and shops in Soho and the West Village."
usa_new york city_four_points_by_sheraton_midtown_times_square,"The Four Points Times Square is a new and clean hotel with modern, minimalist decor, and comfortable beds. Rooms include amenities like a flat-screen TV, iPod docking station, and free internet, but are small, as is typical for NYC."
usa_new york city_four_seasons_hotel_new_york,"The hotel has a sleek, modern design with a lobby that feels like a calm, cozy coffee shop, and features a swanky bar. The crowd is mostly corporate, and the hotel is centrally located near shopping and Central Park."
usa_new york city_gild_hall,"Gild Hall has a modern, cozy style with a British club meets Zen simplicity decor, quirky touches like rhino footrests, and antler chandeliers. The hotel features leather sofas, plaid throws, and rooms with comfortable beds and Kiehl's toiletries."
usa_new york city_gramercy_park_hotel,"The Gramercy Park Hotel features eclectic, dark, bohemian decor and artwork with a hip bar and a rooftop bar that has a relaxed atmosphere. It is located in a quiet residential neighborhood and has access to Gramercy Park."
usa_new york city_grand_hyatt_new_york,The Grand Hyatt has a grand lobby with plants and a large water feature and has some tastefully and stylishly refurbished rooms. The Commodore Lounge is a comfortable and sophisticated place to hang out.
usa_new york city_greenwich_hotel,"The Greenwich Hotel features a European-style decor, a cozy courtyard, and a drawing room. Rooms include complimentary snacks and non-alcoholic beverages, with a warm and comfortable feel."
usa_new york city_hampton_inn_35th_st_empire_state_building,"The Hampton Inn is a new, clean, and modern hotel with flat-screen TVs and comfortable beds; it is located near the subway, Macy's, and the Empire State Building. Some reviewers note stylish or modern decor and furnishings."
usa_new york city_hampton_inn_madison_square_garden,"The Hampton Inn Madison Square Garden has a modern, clean, and sleek style, with flat-screen TVs and minimalist chic lobbies. The hotel provides complimentary tea, coffee, and cookies in the lobby, creating a relaxed atmosphere."
usa_new york city_hampton_inn_manhattan_chelsea,"The Hampton Inn Chelsea is described as a modern, clean, and well-maintained hotel with stylish decor, and good service; it's located in the Chelsea area, a quieter part of Manhattan that offers a more humanly-scaled ambiance. Reviews suggest it provides a comfortable and convenient base for exploring New York City, with easy access to subway lines and various attractions."
usa_new york city_hampton_inn_manhattan_soho,"The Hampton Inn Soho features modern decor with art-photography, a greenhouse, and exposed beams in the lobby, aiming for an industrial-chic feel. It is located on the edge of SoHo, near trendy shops and art galleries, with subway access nearby."
usa_new york city_hampton_inn_manhattan_times_square_south,"The hotel is described as small and modern, with clean rooms and bathrooms, but lacking a bathtub in some rooms. It is a narrow, tall building with only six rooms per floor."
usa_new york city_hampton_inn_new_york_seaport_financial_district,"The Hampton Inn Seaport is described as a small, modern hotel with stylishly decorated, immaculately clean rooms and comfortable beds, offering a boutique look with deep-blue walls in some rooms. Some rooms feature balconies with views of the Brooklyn Bridge and South Street Seaport, and flat-screen TVs are included."
usa_new york city_helmsley_middletowne_hotel,"The Helmsley Middletowne is an older hotel with large rooms that include amenities like a refrigerator, TV, and a safe. It is centrally located in midtown Manhattan, within walking distance of major attractions."
usa_new york city_hilton_club_new_york,"The Hilton Club is located within the Hilton on the 37th and 38th floors and offers a smaller, more personal hotel experience in a central Manhattan location near Rockefeller Center and Times Square. Rooms are newly decorated with a ""ship-like"" design that makes good use of space."
usa_new york city_hilton_garden_inn_chelsea,"The Hilton Garden Inn Chelsea is described as a modern, clean, and stylish ""boutique"" hotel with well-maintained rooms and a small, tranquil lobby. It has contemporary room decor, ergonomic chairs, and offers city views from higher floors."
usa_new york city_hilton_garden_inn_new_york_west_35th,"The Hilton Garden Inn is a new, clean, and modern hotel with HD TVs, free Wi-Fi, and ergonomic chairs in the rooms. The hotel has a small bar and lounge area and is located next to a subway station."
usa_new york city_hilton_garden_inn_times_square,"The Hilton Garden Inn Times Square has modern, well-equipped rooms featuring black and white photos of NYC. It is described as clean, nicely sized for NYC, and more 4-star than 3-star."
usa_new york city_hilton_garden_inn_tribeca,"The Hilton Garden Inn Tribeca is described as a new and clean hotel with a contemporary feel and a laid-back atmosphere, situated in a less touristy area convenient to Soho, Tribeca, and the subway. Rooms feature comfortable beds, microwaves, refrigerators, and free internet, with additional amenities like a gym and business center."
