Hotel,Summary
usa_new york city_hilton_new_york,"The Hilton New York is a large hotel with conference facilities and business center, though internet access is an added fee. Some reviewers mention comfortable rooms with desks and ergonomic workstations."
usa_new york city_hilton_times_square,"The Hilton Times Square is noted as a good business hotel, with amenities for business travelers such as a writing desk and writing chairs in some rooms. Select rooms offer writing desks, and the hotel's location is convenient to public transportation."
usa_new york city_holiday_inn_express_new_york_city_fifth_ave,"This hotel offers free Wi-Fi, a business center with computers and a printer, and is conveniently located near Grand Central Station. The hotel is clean and functional, designed for travelers who won't spend much time inside."
usa_new york city_holiday_inn_express_new_york_city_times_square,"The Holiday Inn Express Times Square is a new hotel with clean rooms, free internet, and a business center. It's located close to Penn Station and Times Square."
usa_new york city_holiday_inn_express_nyc_madison_square_garden,"The Holiday Inn Express Chelsea is a good option for business travelers due to its convenient location near Penn Station and the subway, free high-speed internet, a business center with computers and printers, and a decent complimentary breakfast. Some rooms have a desk, and the hotel offers free local calls."
usa_new york city_holiday_inn_manhattan_downtown_soho,"The Holiday Inn is a good option for business travelers, with wireless internet access and a location convenient to downtown and multiple subway lines. It also offers a business center, car service, and is within walking distance to Wall Street and the financial district."
usa_new york city_holiday_inn_midtown_57th_st,"The Holiday Inn Midtown offers free in-room WiFi, a basement gym, and is near public transportation. The property has meeting areas and a business center that costs $1 per 4 minutes of use."
usa_new york city_holiday_inn_nyc_manhattan_6th_avenue,"This Holiday Inn offers free internet (both wired and wireless), a business center, and a desk in each room. The hotel is conveniently located near Penn Station and subway lines."
usa_new york city_hotel_17,"Hotel 17 is not a good fit for business travelers, as it is a budget hotel with small rooms and shared bathrooms. It's better suited for budget travelers, students, or tourists looking for a clean, quiet, and centrally-located place to stay."
usa_new york city_hotel_31,"Hotel 31 offers a budget-friendly option in midtown Manhattan, close to the subway, Grand Central Station, and the Empire State Building. Some rooms include a desk, and there is no CNBC available on the televisions."
usa_new york city_hotel_373,"Hotel 373 is a clean and modern hotel with free Wi-Fi, a desk and chair in every room, and is located close to Penn Station and the subway. There is no lobby, but there is a Starbucks attached to the hotel, and the staff can print boarding passes."
usa_new york city_hotel_41_at_times_square,"Hotel 41 is a small, clean, and modern hotel in an excellent location near Times Square and subways, with free wi-fi, a desk in the superior rooms, and a popular bar. Rooms can be small, but include amenities like a plasma TV, ironing board, and free reliable wi-fi."
usa_new york city_hotel_99,"Hotel 99 offers rooms equipped with a writing desk, flat screen TV, and free internet access. The hotel is located on the Upper West Side near a subway station, providing easy access to other parts of the city."
usa_new york city_hotel_beacon,The hotel offers wireless internet for a daily fee and a business center with free computer access and printing. Rooms include a desk and ergonomic chair.
usa_new york city_hotel_chandler,"Hotel Chandler is praised for its central midtown location, proximity to subway lines, free Wi-Fi, comfortable beds, and a gym. Some rooms include a work desk and easily accessible electrical outlets."
usa_new york city_hotel_deauville,"Hotel Deauville is a budget-friendly hotel with a central location, close to subway lines and Grand Central Station, with free and fast WiFi available. Some rooms have kitchenettes and views of the Empire State Building."
usa_new york city_hotel_east_houston,"The hotel offers free WiFi, a basement area with computers for guest use, and is located near subway lines for easy access to different parts of the city. Some rooms have a built-in desk and the hotel has a rooftop lounge."
usa_new york city_hotel_elysee,Hotel Elysee is in an excellent midtown location and provides free WiFi. The hotel has a business center and board room.
usa_new york city_hotel_gansevoort,"Rooms include a workspace, CD player, free wireless internet, and easy access to public transportation. The hotel also offers meeting rooms and a business center."
usa_new york city_hotel_giraffe,"Hotel Giraffe offers comfortable and well-appointed rooms with amenities like free WiFi, a business center, and complimentary breakfast, making it suitable for business travelers. The hotel's location is convenient for access to various parts of Manhattan, with easy access to subway lines and cabs."
usa_new york city_hotel_grand_union,"The Hotel Grand Union offers a desk but it is small, has no light, and no electrical source to plug in a computer, and there is no WiFi or wired internet in the rooms, but it is available for a fee in the lobby. It may be good for a short stay and is located near Penn Station."
usa_new york city_hotel_indigo_new_york_city_chelsea,"Hotel Indigo offers spacious rooms for NYC, comfortable beds, a desk with an ergo-looking chair, and free hi-speed internet; it is close to the Javits Center, Times Square, Herald Square, and three subway lines. Some rooms lack a luggage rack and coffee maker, and the front desk service may be inattentive."
usa_new york city_hotel_mela,"Hotel Mela has free wifi and desk space making it convenient for business travelers, and an executive room is available. The hotel is near Times Square, and the fitness center includes treadmills, mats, free weights, and a TV."
usa_new york city_hotel_metro,"This hotel offers free internet and printing, a gym, and is centrally located near Penn Station. The Metro Grill provides a convenient dining option."
usa_new york city_hotel_newton,"Hotel Newton is near the subway, allowing for quick transport to Times Square and Penn Station and offers amenities like Wi-Fi, safety deposit boxes, and luggage lockers. Some rooms include a microwave and refrigerator, useful for business travelers."
usa_new york city_hotel_on_rivington,"This hotel lacks desks or workspaces in the rooms, and the gym is small, dark, and has minimal equipment. There is free Wi-Fi, but the hotel is not conveniently located to traditional New York attractions."
usa_new york city_hotel_reserve,"Hotel Reserve is located in the Financial District, close to Wall Street and subway stations, making it convenient for business travelers. It offers free Wi-Fi, a business center, and rooms with a desk and flat-screen TV, but the business center has limited hours."
usa_new york city_hotel_st_james,"The St. James Hotel is located a block from Times Square with free wifi, and offers a printer."
usa_new york city_hotel_stanford,The Hotel Stanford is conveniently located near Penn Station and offers amenities such as free internet in the business center. Some rooms include a desk and chair.
usa_new york city_hotel_wales,The Hotel Wales offers wireless internet access for a daily fee and some rooms have a separate sitting area suitable for work. The hotel also provides a business center and is located near public transportation.
usa_new york city_hudson_hotel,"The Hudson Hotel has a small desk in some rooms, but no comfortable chair, and several reviewers mention the lack of space for laptops, while other reviewers mention there is a business center. The location is close to subway lines."
usa_new york city_ink48_a_kimpton_hotel,"Ink48 offers amenities like free Wi-Fi, a business center (though still being set up during the review period), and is a short walk or cab ride to business areas, with staff offering helpful recommendations. Some reviewers noted convenient access to the Javits Convention Center and plentiful taxis."
usa_new york city_inn_new_york_city,"I am sorry, but there isn't enough information in the reviews to determine if this hotel is a good fit for business travelers. The reviews focus on amenities for couples, families, and tourists."
usa_new york city_intercontinental_the_barclay_new_york,"The Barclay InterContinental is conveniently located in midtown Manhattan near Grand Central Station, making it accessible to many corporate offices. Rooms include spacious desks, and the hotel provides business center and room service."
usa_new york city_jumeirah_essex_house,"This hotel offers comfortable work spaces, good beds and bedding, and the ability to plug an iPod into the TV speakers. There is also a gym, and the Wall Street Journal and New York Times are available."
usa_new york city_kitano_new_york,"The Kitano is near Grand Central Station with easy access to subway lines, and offers comfortable beds, a good workspace, and upgraded sewing kits. The hotel provides quiet, clean rooms, and efficient service, appealing to business travelers seeking a peaceful environment."
usa_new york city_la_quinta_manhattan,"La Quinta Manhattan offers free WiFi, wired internet, and a business center, but the WiFi signal can be weak in some rooms. Some rooms have a desk and phone in the bathroom."
usa_new york city_lafayette_house,"Lafayette House offers free Wi-Fi and suite-sized rooms, some with a sitting area, fireplace, and kitchenette; the hotel is located near several restaurants, but lacks room service and has limited office hours. Some rooms have a terrace and courtyard access."
usa_new york city_le_parker_meridien,"Le Parker Meridien is well-located for business, with a large desk area in rooms and internet access for a fee. The hotel also offers meeting spaces and a business center."
usa_new york city_library_hotel,"The Library Hotel offers free WiFi, a business center, and a location near Grand Central Terminal, with access to six subway lines. Some reviewers found it convenient for business trips, while others cited IT infrastructure problems."
usa_new york city_loews_regency_hotel,"The Loews Regency is noted as a top-notch business hotel with an excellent location near midtown and the Upper East Side. It features a superior fitness center often used by locals, and some rooms include a workspace and comfortable desk."
usa_new york city_lowell_hotel,"The Lowell offers amenities such as a gym, free computer and printer usage, and in-room kitchenettes. The hotel is located on the Upper East Side, near shopping on Madison Avenue and close to the F and 6 subway lines."
usa_new york city_mandarin_oriental_new_york,"Located in the Time Warner building with access to shops, it has a business center open all night and rooms with a desk and ample outlets. The hotel has meeting rooms, multi-line phones, and internet on the flat-screen TV."
usa_new york city_milford_plaza_hotel,"The Milford Plaza has wired internet access, but no desk in the rooms, making it difficult to complete work. The hotel is located near Times Square and the A-C-E subway station, providing convenient access to midtown."
usa_new york city_millenium_hilton,"The Millenium Hilton is a modern, sleek hotel located in the Financial District, with spacious rooms, large flat-screen TVs, and is conveniently located near multiple subway lines. It offers a business center, though internet access is available at an additional cost."
usa_new york city_millennium_hotel_broadway,"The Millennium Broadway is conveniently located and offers amenities such as in-room safes, a business center, and internet access, though for an additional fee. Some rooms are equipped with work desks and power strips."
usa_new york city_millennium_un_plaza_hotel,"The Millennium UN Plaza offers large rooms with comfortable beds, multiple desks, and useful location for access to the highway and airports. It is located near the UN, making it useful for business, and has workout facilities, though the fitness center is small."
usa_new york city_moderne_hotel,The Moderne Hotel has a library and internet cafe and is located close to subway stops. Some rooms have a desk and strong wifi.
usa_new york city_morgans_hotel,"Morgans Hotel offers a business center, and a living room with Apple computers and free tea/coffee; it's located near Grand Central Station. Some rooms have a desk/dressing table area with electrical sockets, and the hotel provides gym access."
usa_new york city_murray_hill_east_suites,"The rooms have no in-room internet access, though the lobby has free WiFi; there is also no room service. Some rooms have a desk and chair; Kinko's is nearby for paid internet access."
usa_new york city_murray_hill_inn,"This hotel is located in midtown Manhattan, close to the subway and major attractions like the Empire State Building and Grand Central Station. It offers clean, basic rooms at an affordable price, but lacks an elevator and in-room amenities like a safe box and hair dryer, with wireless internet access available for a fee."
usa_new york city_new_york_marriott_downtown,"This Marriott is in a great location for business travelers given it is located in the Financial District and near Wall Street. The hotel has better than average rooms, flat screen TVs, and a gym; Starbucks is also located in the building."
usa_new york city_new_york_marriott_east_side,"The Marriott East Side is a good option for business travelers due to its proximity to meetings and Grand Central Station, though internet access is an additional charge; rooms include a work desk and comfortable chair. The hotel also has meeting facilities and a business center, although some found the rooms to be small for the price."
usa_new york city_new_york_marriott_marquis,"The Marriott Marquis is centrally located in Times Square and has helpful staff and a business center, and offers meeting rooms. It has wired internet for $16.95 a night, but some reviewers found the service slow and unreliable."
usa_new york city_new_york_palace_hotel,"The New York Palace has big, clean rooms, comfortable beds, and a great gym with complimentary kit, and it's conveniently located for midtown business. The hotel has amenities for business travelers, such as internet access, and is convenient to transportation."
usa_new york city_night_hotel,"The Night Hotel has small rooms and a tiny desk, but also inexpensive wireless internet (for a fee) and is close to a gym. The hotel's location is convenient for midtown meetings and has a Starbucks nearby for quick access."
usa_new york city_novotel_new_york_times_square,"This hotel has a business center with free internet access and a printer, and there are multiple reports of the staff being helpful and polite. Some guests stayed here on business trips."
usa_new york city_off_soho_suites,"I am sorry, but the reviews do not mention any business-specific amenities. The hotel is described as having suites with kitchenettes, friendly staff, and a location near several neighborhoods and subway lines."
usa_new york city_omni_berkshire_place,"The Omni Berkshire Place is located in midtown Manhattan, providing excellent access to the business district and is near Park Avenue offices. Select Guest members have access to a business office equipped with a conference room, desk, chair, fax, and a computer with free internet access."
usa_new york city_on_the_ave_hotel,"The hotel offers well-equipped rooms with comfortable beds and workspaces, but internet access is an extra charge. Some reviewers note that business travelers may find the indifferent staff and lack of local TV channels a drawback."
usa_new york city_park_79_hotel,"The hotel rooms are small and offer amenities such as free WiFi, a desk, and an iron with an ironing board. The hotel is located in the Upper West Side, close to the subway."
usa_new york city_park_central,"Points of Concern include no desk in the room and poor design for business travelers, but points of interest include in-room Ethernet (but fee-based) and a good location very close to Carnegie Hall. There is also a business center available for printing and faxing."
usa_new york city_park_south_hotel,"The Park South Hotel offers free wired internet, a business center with computers and printers, and is conveniently located near a subway line, making it accessible to various parts of Manhattan. Some reviewers noted the rooms are small, but clean, and include amenities like a desk and comfortable bedding."
usa_new york city_peninsula_new_york,"The Peninsula New York offers bedside control panels, free WiFi, and a business center. Some rooms have desks and easily accessible electrical outlets."
usa_new york city_phillips_club,The Phillips Club offers suites with kitchens and is located near Lincoln Center and public transportation. It has conference facilities and caters to business travelers.
usa_new york city_plaza_athenee_hotel,"The Plaza Athenee is located on the Upper East Side, near shopping on Madison Avenue and Central Park. Some rooms have desks, and the hotel offers concierge service and meeting facilities."
usa_new york city_radisson_martinique_on_broadway,"The Radisson Martinique is located close to Penn Station, making it convenient for travelers. Some rooms have a workspace with a desk, and a business center is available, but the wireless internet service can be unreliable."
usa_new york city_ramada_eastside,"The hotel offers free wireless internet, a business center, and free local calls. Some rooms have a desk suitable for working, and the hotel is located in the Murray Hill neighborhood."
usa_new york city_red_roof_inn_manhattan,"The Red Roof Inn Manhattan offers clean rooms with work spaces, free internet, and is conveniently located near Penn Station and various subway lines. It also includes complimentary breakfast and phone service."
usa_new york city_renaissance_new_york_hotel_57,"The hotel has a business center, in-room coffee service, Aveda products, and iHome. Some found the service and restaurant to be inadequate and inconsistent for business travelers."
usa_new york city_renaissance_new_york_hotel_times_square,"The Renaissance Times Square is a modern, clean hotel with good facilities, a gym, and a business center in a central location close to subway stops. It also has work desks and internet access in the rooms, with valet parking available."
usa_new york city_residence_inn_by_marriott_times_square_new_york,"This hotel has spacious rooms with countertop space that doubles as a desk area, free internet access, and is conveniently located near Grand Central Terminal. It also has a lounge on the 3rd floor, which is a great place to have a drink and work."
usa_new york city_ritz_carlton_battery_park,"The Ritz-Carlton Battery Park is a good business hotel with spacious rooms, large bathrooms, and comfortable beds, situated in a quiet downtown location convenient to the financial district and offering pleasant staff. The hotel has quality furnishings, excellent cleanliness, town car service, and a nice fitness center, but some found it lacking a ""wow"" factor and personal touches."
usa_new york city_rockefeller_center_hotel,"The Rockefeller Center Hotel offers free internet access, a business center, and rooms with office space, making it suitable for business travelers. Some rooms include a desk, microwave, and mini-fridge."
usa_new york city_roger_smith_hotel,"The Roger Smith Hotel is conveniently located near Grand Central Terminal, making it easily accessible, offers free Wi-Fi, provides comfortable rooms, and has a restaurant and bar on-site"
usa_new york city_roger_williams_hotel,"The Roger Williams Hotel is often used by business travelers because it is clean, centrally located, and offers free internet access. It has a gym and comfortable rooms that are conducive for working."
usa_new york city_room_mate_grace,"Room Mate Grace is near Times Square, offers free Wi-Fi, and has spotty internet connection. The hotel also has small rooms and limited space to work."
usa_new york city_royalton_hotel_new_york_city,"The Royalton Hotel is conveniently located in midtown Manhattan, close to transportation hubs, and has a business center. Some rooms include a desk and wifi access is available for a fee."
usa_new york city_salisbury_hotel,"The Salisbury Hotel is recommended for business travelers due to its good-sized rooms, a comfortable business chair, and a desk. Rooms also include a microwave and refrigerator."
usa_new york city_san_carlos_hotel,"The San Carlos Hotel has spacious rooms, a gym with cardio equipment, and a business lounge with free computers and internet access. Rooms include a microwave, refrigerator, coffee maker, and free high-speed broadband."
usa_new york city_seafarers_international_house,"Seafarers International House is located near Union Square, close to the subway, and offers free internet access, and printer. Some rooms have a desk, and the hotel provides a fax service."
usa_new york city_sheraton_new_york_hotel_towers,"This hotel is conveniently located for meetings in midtown and offers quick room service, a gym, and internet access in the rooms and lobby. It has a large lobby and is often busy, so it may not be ideal for business travelers seeking a quiet environment."
usa_new york city_skyline_hotel,"The Skyline Hotel offers a business center, concierge service, and is within walking distance of Times Square and many restaurants. Rooms feature a desk and chair."
usa_new york city_smyth_hotel_a_thompson_hotel,"The Smyth Tribeca offers amenities such as a writing desk, iPod docking station, and a fitness room, but it charges extra for Wi-Fi. Some reviewers noted that the hotel's business center was delayed in opening."
usa_new york city_sofitel_new_york,"The Sofitel New York is frequently mentioned as a great place for business travelers, due to its convenient midtown location, easy check-in/check-out, free computer services in the lobby, and good exercise room. Rooms include a desk and are generally quiet, allowing for a relaxing stay."
usa_new york city_soho_grand_hotel,"Soho Grand Hotel has a business center and wireless internet, but the internet can be slow. Some rooms have comfortable beds and city views."
usa_new york city_soho_house_new_york,"Soho House offers free internet service and is located in the Meatpacking District, which is convenient to shops, restaurants, and transportation. Some reviewers mentioned using the hotel for business trips and private parties, and some rooms include sound systems."
usa_new york city_stay,The hotel has a business center with free internet and a digital touchscreen phone system that allows you to set your own wakeup calls. There are limited staff and some past guests thought the service unprofessional and the internet did not work properly in the rooms.
usa_new york city_the_alex_hotel,"The Alex Hotel is centrally located near Grand Central Station, has kitchenettes in some rooms, and offers a business center with free internet and printers. There is no wireless internet in the rooms, and desk space may be limited depending on the room."
usa_new york city_the_belvedere,"The Belvedere Hotel offers wireless internet access for a fee, but reviewers note that the connection can be unreliable. Some rooms have a desk, and there is a business center, but the chair in some rooms does not fit in front of the desk."
usa_new york city_the_benjamin,"The Benjamin is located in midtown Manhattan and offers business amenities such as a fax machine, flat screen LCD screen, and wired and wireless internet. The rooms include a work station/desk, and are located close to major office buildings and transportation."
usa_new york city_the_blakely_new_york,"The Blakely Hotel offers a convenient midtown location near transportation, a lobby computer with free internet and printer, and in-room amenities such as kitchenettes, microwaves, and coffee makers. Some rooms have a separate sitting area which can be useful when traveling with others."
usa_new york city_the_bowery_hotel,"The hotel offers free wifi, laptop rentals, and high-speed internet access. There are desks in each room and generally quiet rooms available."
usa_new york city_the_bryant_park,"The hotel offers rooms with hardwood floors, a cordless phone on the desk, and easy access to locations all over the city. Some rooms have iPod docking stations, and some suites can be rented out for events."
usa_new york city_the_carlton,"Carlton Hotel is praised for its clean, spacious rooms equipped with wireless internet, a safe, and a comfortable bed, with in-room dining available. It is centrally located in Midtown, close to public transportation and major attractions, but some found the service lacking."
usa_new york city_the_carlyle_a_rosewood_hotel,"The Carlyle offers prompt service and a quiet atmosphere, with staff described as career hotel professionals. Some rooms have desks and well-lit seating areas, and the hotel is capable of handling various requests."
usa_new york city_the_franklin,"The Franklin Hotel offers free wireless internet, a complimentary computer in the lobby, and is located on the Upper East Side, near the subway for convenient access to other parts of the city. Some rooms have a desk and newspaper delivery is offered."
