Hotel,Summary
usa_new york city_hotel_chandler,"Hotel Chandler has rooms with views of the Empire State Building from the front of the hotel, but rooms at the back of the hotel have less desirable views, with some looking out onto a well between buildings or a brick wall. Some rooms on higher floors may have city views."
usa_new york city_hotel_deauville,"Some rooms have views of the Empire State Building, while others have views of a brick wall. Rooms at the front of the hotel are described as best and large."
usa_new york city_hotel_east_houston,"The hotel has a rooftop terrace with views of the Empire State Building and the Chrysler building. Some rooms, like corner rooms, also have views of the Empire State Building and the Chrysler building."
usa_new york city_hotel_elysee,"Rooms facing the street can be noisy, but some upper-level rooms have balconies and views. Some rooms in the back face air vents and hotel motors."
usa_new york city_hotel_gansevoort,"Hotel Gansevoort has great views from the high floor rooms, especially those facing the Hudson River. The rooftop bar also provides amazing views."
usa_new york city_hotel_giraffe,"Some rooms have small balconies overlooking Park Avenue, offering views of the city, with the higher floors minimizing street noise. The rooftop terrace provides another vantage point, though its views may not be spectacular."
usa_new york city_hotel_grand_union,"Some rooms offer views of the Empire State Building, while others face a brick wall or inner courtyard with no natural daylight. Rooms at the front of the hotel may experience some street noise."
usa_new york city_hotel_indigo_new_york_city_chelsea,"The hotel's Roof Top Terrace was under construction during the time of the reviews, which would have offered views over the city. Some rooms may suffer from noise due to deliveries of flowers, so a high-level floor is preferable."
usa_new york city_hotel_mela,"Some rooms have a view of a brick wall, the Belasco Theater, or construction sites, while higher floors offer better views, but might have elevator noise. An executive room on the 12th floor had views across other buildings but almost no noise."
usa_new york city_hotel_metro,The hotel has a roof top terrace and some rooms have a view of the Empire State Building. There are penthouse suites available with large windows.
usa_new york city_hotel_newton,"The hotel does not have many good views, but room 702 has a nice view of Broadway Blvd. Views from other rooms include interior courtyards, the back of the hotel, or the top of another building."
usa_new york city_hotel_on_rivington,"The Hotel on Rivington offers amazing city views from rooms with floor-to-ceiling windows, with high floor corner rooms and balconies providing the best views of the Empire State Building, Chrysler Building, and downtown Manhattan. Some bathrooms also feature floor-to-ceiling windows, allowing for unique views while showering."
usa_new york city_hotel_reserve,"The hotel is located in the Financial District, with some rooms offering views of the Federal Reserve Bank. The hotel is generally located in a quiet area."
usa_new york city_hotel_st_james,"The St. James Hotel is a budget-friendly option located near Times Square, but several reviewers mention a lack of impressive views from the rooms. Some rooms overlook offices, alleys, or have windows with botched repairs causing street noise."
usa_new york city_hotel_stanford,Some rooms at the Stanford Hotel offer views of the Empire State Building. Rooms at the back of the hotel overlook other windows but are quieter than street-side rooms; rooms may also overlook a giant black pipe or a brick wall.
usa_new york city_hotel_wales,The hotel has a roof deck with views across the park to the reservoir and a roof terrace with views over Central Park. Some suites offer a distant view of Central Park.
usa_new york city_hudson_hotel,"The hotel offers a rooftop bar with great views. Some rooms on the higher floors have city, courtyard, or river views."
usa_new york city_ink48_a_kimpton_hotel,"Ink48 offers city and Hudson River views, with some rooms featuring floor-to-ceiling windows. City View rooms offer views of Times Square, while upper-floor Hudson River suites provide quiet rooms with walls of windows."
usa_new york city_inn_new_york_city,"I'm sorry, but there is no mention of amazing views in these reviews."
usa_new york city_intercontinental_the_barclay_new_york,"The 8th floor rooms did not have sky views and were dark and gloomy, but higher floors may have better views. You can see the Chrysler building from the hotel and some rooms offer views of Lexington Avenue and the Waldorf Astoria."
usa_new york city_jumeirah_essex_house,"Many reviewers highlight the hotel's great location, directly across from Central Park, and some rooms have amazing views of the park and city from higher floors (14th floor and up). Some reviewers also mention rooms with Manhattan views or partial park views."
usa_new york city_kitano_new_york,"Many rooms at the Kitano offer views of the Empire State Building, Chrysler Building, or Park Avenue. Some higher-floor corner rooms have views of both the Empire State Building and Chrysler Building."
usa_new york city_la_quinta_manhattan,The La Quinta Inn Manhattan has a rooftop bar that provides a magnificent view of The Empire State Building. Some rooms on higher floors may also offer views of the Empire State Building.
usa_new york city_lafayette_house,"I am sorry, the reviews do not mention anything about views."
usa_new york city_le_parker_meridien,"Le Parker Meridien offers rooftop views of Central Park from the pool and sundeck, and some park view rooms on higher floors also have good views. Many reviewers also mention rooms with city views."
usa_new york city_library_hotel,"The Library Hotel has a rooftop garden and bar with views of the Empire State Building, the New York Public Library, and down Madison Avenue to Central Park. Rooms with bay windows offer views of Madison Avenue."
usa_new york city_loews_regency_hotel,"Rooms may have views of Park Avenue or of the school or church on either side. Some rooms are corner locations, with views down Park Ave and 61st St."
usa_new york city_lowell_hotel,"The Lowell is a small, intimate hotel on the Upper East Side. The rooms are newly renovated, tastefully decorated, and spacious, with kitchens and luxurious bathrooms; however, some rooms have no view, looking straight into surrounding apartments."
usa_new york city_mandarin_oriental_new_york,"The Mandarin Oriental in New York is located on the 35th floor and up, offering amazing views of Central Park, the Hudson River, and the city, especially from higher floors and corner rooms. Some rooms have views partially obstructed by the Trump building."
usa_new york city_milford_plaza_hotel,"Some club rooms are located on the 23rd floor with excellent views of Time Square, and some rooms have views of 8th ave and the Hudson River. Some rooms are corner rooms with dual aspect windows overlooking the city streets."
usa_new york city_millenium_hilton,"The Millenium Hilton offers rooms on high floors with spectacular views of the Hudson River, the Brooklyn Bridge, and the WTC site. Many rooms have floor-to-ceiling windows and offer city views."
usa_new york city_millennium_hotel_broadway,"The hotel offers great views from its rooms, especially the corner rooms on higher floors, with some rooms overlooking Times Square, the Chrysler Building, and the Empire State Building. Some rooms have floor-to-ceiling windows."
usa_new york city_millennium_un_plaza_hotel,"The Millennium UN Plaza Hotel offers great views from the rooms, with some rooms having outstanding views of the Empire State Building, Chrysler Building, and East River; many rooms start on the 28th floor or higher to provide a good vantage point. Some reviewers suggest requesting a room in the East or West Tower to optimize the panorama."
usa_new york city_moderne_hotel,Many rooms have no view or windows facing brick walls. Some rooms facing 55th street or upper floors may offer better views.
usa_new york city_morgans_hotel,Morgans Hotel offers rooms with a side view of the Empire State Building and a roof terrace with lovely views of the Empire State Building. Some rooms have a view of the Empire State Building.
usa_new york city_murray_hill_east_suites,Rooms have views of the Empire State Building. Some rooms on higher floors have views of the water and the Empire State Building.
usa_new york city_murray_hill_inn,"The hotel does not have notable views, with some rooms facing brick walls or neighboring apartments. Some front-facing rooms may have street views."
usa_new york city_new_york_marriott_downtown,"Many reviewers highlight the hotel's great views, especially from higher floors, with some rooms offering views of the Statue of Liberty, Ellis Island, and the Hudson River. Corner rooms and harbor-view rooms are specifically mentioned for their expansive vistas."
usa_new york city_new_york_marriott_east_side,"The hotel has a fitness center on the 35th floor with nice views over midtown Manhattan and new exercise machines. Some rooms, especially corner rooms, offer great city views including the Chrysler building; high floor rooms are recommended."
usa_new york city_new_york_marriott_marquis,"Many rooms at the Marriott Marquis offer views of Times Square, and upper floor rooms also offer Hudson River views. The hotel features a rotating restaurant on the top floor called The View that offers 360-degree views of the city."
usa_new york city_new_york_palace_hotel,Many reviewers rave about the hotel's location with executive rooms on higher floors offering spectacular views of St. Patrick's Cathedral and the Manhattan skyline. Some rooms also offer views of the Hudson River and Rockefeller Center.
usa_new york city_night_hotel,"The rooms are small and have no windows, or windows facing an airshaft or brick wall, which provide little to no natural light. One reviewer did have a corner king room that overlooked the street."
usa_new york city_novotel_new_york_times_square,"The Novotel Times Square offers amazing views of Times Square from its lobby, outdoor terrace, and many of its rooms, especially those on higher floors. Some rooms also offer views of Broadway, the Hudson River, and the surrounding cityscape."
usa_new york city_off_soho_suites,There is no mention of views from this hotel in the reviews.
usa_new york city_omni_berkshire_place,"Some rooms at the Omni Berkshire Place offer city views, with upper floors potentially providing better vantage points. One reviewer mentioned a corner room with a nice view of the city day/night."
usa_new york city_on_the_ave_hotel,"On The Ave Hotel offers panoramic rooms with Hudson river views from the balcony, and higher rooms have views of Central Park and the Upper West Side; the 16th-floor terrace provides great city views. Some rooms have balconies with views and the rooms feature floor-to-ceiling windows."
usa_new york city_park_79_hotel,"*   Rooms on the fourth floor overlook 79th Street.
*   Some rooms have views of the alley or street traffic."
usa_new york city_park_central,"Some rooms on higher floors offer views of Times Square. A corner room on the 11th floor had views towards Times Square, Central Park, and Carnegie Hall, and a room on the 25th floor stared right at Times Square."
usa_new york city_park_south_hotel,"Some rooms have a partial view of the Chrysler Building, though many rooms face a brick wall. Upper floors may be quieter, with lower floors facing the street experiencing noise from traffic and pedestrians."
usa_new york city_peninsula_new_york,"The hotel has a pool with amazing views, and a rooftop bar (Salon de Ning) with incredible views of the city. Some rooms on the 18th floor have views on 5th Ave and into the Moma Sculpture garden."
usa_new york city_phillips_club,The junior suites boast highly impressive bathroom facilities and views that are out of the ordinary. The hotel is located close to Lincoln Center.
usa_new york city_plaza_athenee_hotel,"One reviewer mentioned receiving a room with a wonderful view north, and after a room change, an even better view to the south. A top-floor room was described as having magnificent views of the upper east side and the city beyond."
usa_new york city_radisson_martinique_on_broadway,"Some rooms have views of the Empire State Building, and some higher floor rooms have city views. Interior rooms face a brick wall or an interior courtyard, which provides quiet."
usa_new york city_ramada_eastside,"Rooms on the 7th floor and higher had nice views, with some rooms offering views of the Chrysler Building, Empire State Building, or the Manhattan skyline. Some rooms, especially those on higher floors, had good views overlooking the city."
usa_new york city_red_roof_inn_manhattan,"The Red Roof Inn Manhattan offers rooms with views of the Empire State Building, with some reviewers specifically mentioning rooms on the 15th floor or higher for optimal viewing. Some rooms have views of neighboring office buildings which may block direct sunlight."
usa_new york city_renaissance_new_york_hotel_57,Rooms offer great views of 57th and Lexington. Sky Loft suites have a huge private terrace with amazing views of surrounding buildings.
usa_new york city_renaissance_new_york_hotel_times_square,"The Renaissance New York Hotel Times Square is in a great location and offers incredible views from rooms on higher floors and from the restaurant, Foley's Fishhouse. Views include Times Square, Broadway, and the Hershey's store."
usa_new york city_residence_inn_by_marriott_times_square_new_york,"Many rooms offer spectacular views, with some having direct views of the Empire State Building. The higher the floor, the better the view."
usa_new york city_ritz_carlton_battery_park,"Many rooms have harbor views and telescopes, providing great views of the Statue of Liberty and Ellis Island. The Rise bar on the top floor has outdoor seating and spectacular views of the Statue of Liberty."
usa_new york city_rockefeller_center_hotel,"Rooms on the 17th floor have views of St. Patrick's Cathedral, and rooms on the 16th floor overlook Radio City Music Hall. The 7th floor has a terrace club with views of Rockefeller Plaza and St. Patrick's Cathedral."
usa_new york city_roger_smith_hotel,Some rooms on higher floors offer nice views of the Chrysler Building. Rooms have big windows.
usa_new york city_roger_williams_hotel,"Some rooms on the 15th floor offer views of the Empire State Building, and rooms with terraces are available. Rooms facing the building next door do not have good views, and rooms with windows facing the street may experience street noise."
usa_new york city_room_mate_grace,"Some rooms at Room Mate Grace offer city views and overlook Times Square. A ""Petite"" corner non smoking room had a view of city."
usa_new york city_royalton_hotel_new_york_city,"Some rooms at the Royalton have balconies where guests can sit and view the New York skyline, and the hotel's location on West 44th Street provides views of nearby buildings from some rooms. Higher-level rooms may have better views."
usa_new york city_salisbury_hotel,"Rooms on the 17th floor facing 57th street have views, and higher rooms are better to avoid noise. One reviewer recommends requesting a higher room for the view."
usa_new york city_san_carlos_hotel,"Rooms at the San Carlos Hotel do not offer amazing views; some rooms face a back alley and another building. The hotel is in a good location, near the subway, Rockefeller Center, 5th Avenue, and Central Park."
usa_new york city_seafarers_international_house,There is no information about views in the hotel reviews.
usa_new york city_sheraton_new_york_hotel_towers,"Guests reported great views from higher floors, with some rooms offering views of Times Square, Central Park, and the Hudson River. Many reviewers on upper floors found the views to be phenomenal, breathtaking, and amazing."
usa_new york city_skyline_hotel,"The Skyline Hotel has a rooftop pool with amazing views of the Manhattan skyline, including the Empire State Building. Some rooms in the front of the hotel also offer views of the Empire State Building."
usa_new york city_smyth_hotel_a_thompson_hotel,Some rooms offer views of the Empire State Building and West Broadway. One reviewer enjoyed the view from the roof terrace.
usa_new york city_sofitel_new_york,"Rooms on the 15th floor and higher offer views of the Chrysler Building, Rockefeller Center, and the Empire State Building. Certain suites on the 27th floor also provide views of the Manhattan skyline."
usa_new york city_soho_grand_hotel,"The Soho Grand Hotel offers rooms with city views, especially from north-facing rooms on higher floors, with some rooms overlooking the Empire State Building and the Chrysler Building. Some rooms have views of building sites or parking lots."
usa_new york city_soho_house_new_york,"The hotel has a rooftop pool and bar with great views of the river and skyline. Some rooms have great views, with large windows."
usa_new york city_stay,"Many reviewers mention that there are no views or that they are bad, some rooms face brick walls, and the hotel does not have very high floors, with some reviewers suggesting requesting a high floor to avoid noise. The higher floors do not guarantee a good view, with one reviewer on the 8th floor facing a brick wall."
usa_new york city_the_alex_hotel,"The Alex Hotel offers spectacular views of the Chrysler building and other skyscrapers from its corner rooms, with higher floors providing quieter accommodations. Some rooms also have views of the East River."
usa_new york city_the_belvedere,"The Belvedere Hotel has rooms on the 17th floor with good views, and executive rooms have views to the south; corner rooms have skyline views. Some rooms have great views of the city."
usa_new york city_the_benjamin,"The Benjamin offers suites on upper floors with terraces, some with city views, though lower floors may have views obstructed by a cooling tower. Room 2601 is on the top floor and has a large terrace overlooking Lexington Avenue with a view of the RCA Building and Waldorf Astoria."
usa_new york city_the_blakely_new_york,Rooms on higher floors at the front of the hotel offer views of the street and surrounding buildings. Some rooms overlook a parking lot or face a brick wall and air conditioning units.
usa_new york city_the_bowery_hotel,"The Bowery Hotel offers rooms with floor-to-ceiling windows providing great views of the city, including the Empire State Building and Chrysler Building from higher floors, and some rooms have soaking tubs with views. Corner rooms on higher floors are recommended for the best views."
usa_new york city_the_bryant_park,"The Bryant Park Hotel offers rooms with great views of Bryant Park, the New York Public Library, and the Empire State Building. Some rooms have balconies and huge windows."
usa_new york city_the_carlton,"Some rooms offer views of the Empire State Building, the Chrysler Building, or Madison Avenue, but some rooms face an inner light shaft or the rooms opposite. A corner room may offer views up and down the avenues."
usa_new york city_the_carlyle_a_rosewood_hotel,"The Carlyle hotel offers gorgeous views over the park from rooms, and some rooms have a spectacular view of Madison Avenue or the entire span of Central Park. Some high floor rooms and suites have views of the park or the city."
usa_new york city_the_franklin,"Many rooms have no views, with some facing brick walls, while others offer street views; the end room on the top floor has a great view. Some rooms have windows facing 87th Street."
usa_new york city_the_french_quarters_guest_apartments,One review mentions a room on the 3rd floor with a sunny balcony overlooking Restaurant Row and skyscrapers. Another review mentions a 10-minute walk to Top of the Rock for views of the city.
usa_new york city_the_gem_hotel_chelsea,"The penthouse has a huge private deck, but smoking is not allowed there. Some rooms face a narrow airshaft."
usa_new york city_the_gem_hotel_midtown_west,"I am sorry, but none of the reviews mention amazing views from the hotel. Some rooms have no view."
usa_new york city_the_gem_hotel_soho,"The hotel is located on the corner of East Houston and Forsyth, with rooms facing the Sarah Roosevelt Park. Some rooms on the upper floors have a view over E. Houston St."
usa_new york city_the_grant_hotel,"Some rooms have windows facing brick walls at close range, resulting in a dark room. There are mentions of views of an alley."
usa_new york city_the_hampton_inn_times_square_north,"Some rooms are on the upper floors facing 8th Avenue, offering a view of the city, while others have partial views toward the Hudson River. Rooms on the 9th floor facing 8th Avenue are reported to be very quiet."
usa_new york city_the_helmsley_carlton_house,"One junior suite had a balcony overlooking Central Park, although the door didn't open fully. The hotel is located one block from Central Park."
usa_new york city_the_helmsley_park_lane,"The Helmsley Park Lane is located on Central Park South and many rooms offer amazing views of Central Park, with higher floors providing more spectacular views. The hotel is located close to many attractions like the subway, 5th Avenue, Times Square, and museums."
usa_new york city_the_herald_square_hotel,"The Herald Square Hotel's ninth-floor rooms offer views of the Empire State Building, and some rooms have tiny outdoor courtyards. Some rooms have an airshaft view, while others overlook brown brick buildings with offices."
usa_new york city_the_hotel_91,"Some rooms on the side of the hotel face the Manhattan Bridge, offering views of the traffic and train, though noise may be a concern. A few rooms have skylights, but some have been covered over."
usa_new york city_the_hotel_at_times_square,"The Hotel at Times Square is in an excellent location, but some rooms have minimal views that overlook a fire escape or neighboring buildings. Rooms on the east side should be avoided due to construction noise."
usa_new york city_the_inn_at_irving_place,"I am sorry, none of the reviews mention any views."
usa_new york city_the_iroquois,"Some rooms have a beautiful view of the Chrysler building, and rooms on 44th street have views, though some rooms have views of brick walls or fire escapes. Lower floors in the back may have noise from air conditioning units."
usa_new york city_the_jane,Some rooms overlook a courtyard with trees and some have views with the noise of the west side highway. One reviewer enjoyed gazing at the Statue of Liberty each morning as they brushed their teeth.
usa_new york city_the_kimberly_hotel,"The Kimberly Hotel offers suites with balconies that provide nice views, including those from the 19th and 27th floors. Some rooms offer great views of the city, including the Chrysler Building and the East River."
usa_new york city_the_lombardy,"I am sorry, none of the reviews mention if there are amazing views at this hotel. The Lombardy is a small boutique hotel with spacious rooms, each individually owned and decorated, some with kitchenettes. It's located in midtown Manhattan, close to shopping, restaurants, and transportation."
usa_new york city_the_london_nyc,"The London NYC offers Vista Suites on higher floors with views of Central Park, the Hudson River, and the Manhattan skyline; corner rooms on 7th Avenue also provide Hudson River views. Some rooms have bay windows and views up Central Park, and both rivers if on a high enough floor."
usa_new york city_the_lucerne_hotel,"Rooms on higher floors offer views of the Hudson River and Amsterdam Avenue, with corner rooms potentially providing views in two directions. Some rooms face brick walls or air shafts, while others offer views of uptown."
usa_new york city_the_manhattan_club,The Manhattan Club has rooms with views of Central Park from higher floors. Some rooms face inward and get barely any light.
usa_new york city_the_mansfield,"Many reviewers note the hotel's excellent location, but some rooms have views of brick walls or noisy streets, while others overlook light wells. A parlor king room on a high floor may offer a less noisy experience."
usa_new york city_the_marcel_at_gramercy,Some rooms at The Marcel offer views of the Empire State Building and Chrysler Building and the rooftop terrace also provides views of the Empire State Building. Some reviewers suggest requesting a higher floor or a corner room for better views.
usa_new york city_the_maritime_hotel,"The Maritime Hotel has rooms with porthole-shaped windows offering views, especially from higher floors, with some rooms facing west towards the Hudson River for sunset views. Some penthouse suites have shower with big round window with views of the Empire State Building."
usa_new york city_the_mark,"I am sorry, none of the reviews mention anything about views from the hotel."
usa_new york city_the_marmara_manhattan_luxury_hotel_residence,"The Marmara Manhattan offers great city views from higher floors, with some suites featuring views of the East River, Empire State Building, and New Jersey. The penthouse suite on the 32nd floor is particularly noted for its breathtaking views and large terrace."
usa_new york city_the_mave,"I am sorry, but I cannot provide a summary, because the text does not mention amazing views."
usa_new york city_the_mercer_hotel,No mention of views.
usa_new york city_the_michelangelo_hotel,"Some rooms at the Michelangelo Hotel have city views, but some face interior walls. Top of the Rock (Rockefeller Center) is within walking distance."
