Hotel,Summary
usa_new york city_3_west_club,The 3 West Club offers views of St. Patrick's Cathedral and Radio City Music Hall from some rooms. The hotel is located across the street from Rockefeller Center.
usa_new york city_414_hotel,"I apologize, but none of the provided hotel reviews mention anything about the hotel having amazing views."
usa_new york city_60_thompson,"60 Thompson features a rooftop bar with spectacular views of Wall Street and the Empire State Building; some rooms on the 11th floor also afford great views over SoHo. However, note that the rooftop terrace is sometimes closed for private events or depending on the season."
usa_new york city_6_columbus,"Some rooms, especially upgraded suites, offer great views of Time Warner and glimpses of Central Park, with higher floors providing better perspectives. However, many rooms have views of air shafts or adjacent buildings."
usa_new york city_70_park_avenue_hotel_a_kimpton_hotel,"Many reviewers mention rooms with views of the Empire State Building and Park Avenue. Some rooms on higher floors offer better views, but can also be noisy."
usa_new york city_ace_hotel_nyc,"Some rooms have views of the Empire State Building. An ""Empire States building room view"" is available."
usa_new york city_affinia_50,"Some rooms, especially corner junior suites, have great views from the 21st floor, with large balconies offering views over 3rd Avenue, the Hudson River, and Roosevelt Island. Rooms on higher floors have nice city views and those facing the street may experience noise."
usa_new york city_affinia_dumont,"The Affinia Dumont offers rooms on the 37th floor with views of the Chrysler Building, downtown Manhattan, and the East River. Some rooms have dual aspect views, including views of the Chrysler building and the Hudson River."
usa_new york city_affinia_gardens,The Affinia Gardens has suites with balconies on the 11th and 13th floors with views of the surrounding area. Rooms on the back side of the hotel overlook a park.
usa_new york city_affinia_manhattan,Rooms on higher floors at the Affinia Manhattan offer city views and some rooms have balconies with Empire State Building views. Some rooms overlook Madison Square Garden.
usa_new york city_affinia_shelburne,"The hotel offers great views of the Empire State and Chrysler Buildings from the rooftop bar or rooms on higher floors, with some rooms having balconies. Guests can request rooms with a view of the Empire State Building when booking."
usa_new york city_aka_united_nations,"Some rooms face away from the main road, but may face an office building, while others may hear traffic noise, even late at night. Some rooms have a balcony."
usa_new york city_algonquin_hotel,"Rooms at The Algonquin Hotel do not offer noteworthy views, with some rooms facing air shafts or construction sites; views of the street are available, but earplugs may be needed due to noise. Rooms on higher floors away from the lifts and at the back of the hotel are recommended for quieter stays."
usa_new york city_americana_inn,"Some rooms have street views, but also have a lot of street noise; some rooms overlook other parts of the building. Some reviewers recommend Rockefeller Center as well as/instead of Empire State for better views of Central Park and the Empire State Building."
usa_new york city_amsterdam_court_hotel,"The hotel has some rooms overlooking the main street, Broadway, and the Gershwin Theatre. Some rooms face a brick wall or lightwell and have little to no natural light."
usa_new york city_astor_on_the_park,"The Astor on the Park offers rooms with views of Central Park and the Manhattan skyline. Some rooms offer views of the park, while others overlook a courtyard or other buildings."
usa_new york city_bedford_hotel,"Many rooms offer views of the Empire State Building, and some upper-floor rooms have balconies with views of the Chrysler Building. Some rooms on the top floor also offer views of the East River."
usa_new york city_beekman_tower_hotel,The Beekman Tower has a restaurant on the 26th floor with terraces that offer fabulous views. Many rooms on higher floors have great views of the East River and the New York skyline.
usa_new york city_belleclaire_hotel,"Rooms facing Broadway offer excellent views; rooms on the top floor, particularly in the turrets, provide amazing views up and down Broadway. Deluxe king rooms on the 8th floor offer fantastic views."
usa_new york city_bentley_hotel,"The Bentley Hotel offers great views of the East River, the 59th Street Bridge, and the Manhattan skyline, especially from the rooftop bar and upper floors. Some rooms have views of the Roosevelt Island cable car and offer floor-to-ceiling windows."
usa_new york city_best_western_bowery_hanbee_hotel,Room 915 has a view to the east with no need for drawing the curtains. The fitness room has a view of the NYC skyline while working out.
usa_new york city_best_western_convention_center_hotel,"Some rooms have great views, including views of the Hudson River from the 11th floor and a view of the river through the small window. One reviewer's room faced a dirty tar roof and train tracks."
usa_new york city_best_western_hospitality_house,This hotel is located in midtown Manhattan and some rooms on higher floors may have views of fire escapes. It is located near the Waldorf Astoria and close to Rockefeller Center.
usa_new york city_best_western_seaport_inn_downtown,"The Seaport Inn has rooms with views of the Brooklyn Bridge, some with large terraces. Top floor rooms with balconies offer fantastic views of the Brooklyn Bridge at night."
usa_new york city_blue_moon_hotel,"The Blue Moon Hotel has rooms on higher floors that offer sweeping views of New York City, including the Empire State Building, Williamsburg Bridge, and East River. The Penthouse (8th Floor) offers the best views from a 750 sq ft space."
usa_new york city_broadway_plaza_hotel,"Rooms on the 10th floor have views of the Empire State Building and the Chrysler Building, and rooms facing the Empire State Building are available. From some rooms, the Empire State Building looks very close."
usa_new york city_buckingham_hotel,"The Buckingham Hotel offers spectacular views up 6th Avenue and 57th Street from some suites, especially those on higher floors. Some rooms face the street and have city views, though noise may be a factor."
usa_new york city_candlewood_suites_new_york_city_times_square,"The hotel is 32 stories high, and some rooms on the 31st floor have great views of the Empire State Building and the Hudson River. Some rooms offer views of a building under construction."
usa_new york city_carlton_arms,"The Carlton Arms is an affordable, centrally-located hotel near subway stations with uniquely-decorated rooms by local artists. Some rooms have street views that can be noisy, while others face the courtyard and are quieter."
usa_new york city_carvi_hotel_new_york,"Some rooms at this hotel have glass walls with views of the space between buildings, including building air conditioning units. These rooms are at the back of the hotel."
usa_new york city_casablanca_hotel,"The hotel is known for its central location near Times Square, but views from the rooms are not a primary feature; many rooms face the back or an inner courtyard, and reviews mention a lack of view or noise issues for rooms facing the street. Views from the rooms were not considered a strong point overall."
usa_new york city_chambers_hotel,Some rooms have views of the office building behind the hotel. The view isn't great.
usa_new york city_chelsea_lodge,"I'm sorry, but none of the reviews mention hotels with amazing views. Most reviews focus on the cleanliness, size, and location of the hotel."
usa_new york city_chelsea_pines_inn,Some rooms have pleasant views of a courtyard. It is located near the High Line park overlooking the Hudson.
usa_new york city_chelsea_savoy_hotel,Some rooms on the third floor have great views; some rooms have views overlooking 7th Avenue. Some rooms have views of residential roof patios.
usa_new york city_city_club_hotel,"Some rooms have balconies with decent views, particularly those on higher floors overlooking 44th Street. However, many rooms have poor or obstructed views, such as facing a brick wall."
usa_new york city_clarion_collection_the_solita_soho_hotel,"The hotel is located in the Soho, Little Italy, and Chinatown area and rooms on higher floors have views of the Empire State Building. Rooms on the 12th floor offer good views, while rooms on the 10th floor have views of the old Police Headquarters building."
usa_new york city_club_quarters_downtown,"Some rooms offer views of a church or a courtyard sculpture, while higher floors may provide daylight; however, some rooms have views of brick walls or rooftop A/C units. It is located in a financial district which may not be ideal for tourists."
usa_new york city_club_quarters_midtown,"Some rooms have views of an air shaft or cooling equipment, while others, particularly on higher floors, may offer street views. The penthouse level is on the top floor, but is not necessarily special in terms of views."
usa_new york city_club_quarters_rockefeller_center,"Many rooms offer views of St. Patrick's Cathedral, Rockefeller Center, or Radio City Music Hall, with some corner suites on higher floors providing especially nice views. The Terrace Club on the 7th floor also has an outdoor area with views."
usa_new york city_comfort_inn_chelsea,"Some rooms at the Comfort Inn Chelsea have a view of the Empire State Building. Room 604 has a view of the Empire State Building, and the 9th floor has a 2 room suite overlooking the ESB."
usa_new york city_comfort_inn_manhattan,"Many reviewers mention having a view of the Empire State Building from their rooms, particularly on higher floors and rooms at the back of the hotel. Some rooms also offer views of the Chrysler Building."
usa_new york city_comfort_inn_manhattan_bridge,"Rooms on higher floors (8th and up) may have good views, particularly those overlooking the Manhattan Bridge and financial district from the 10th floor. Some rooms overlook Chrystie Street and an area park."
usa_new york city_comfort_inn_midtown,"Rooms on upper floors offer great city views, and some back-facing rooms have views of a church. The higher rooms that face the street may experience noise issues."
usa_new york city_comfort_inn_midtown_manhattan,"Some rooms on the sixth floor have views of skyscrapers and a window that actually opens, however, rooms with two beds do not have a view of the street and the window is high. Some rooms are located in the basement with potentially poor views."
usa_new york city_comfort_inn_midtown_west_convention_center,"Rooms on the higher floors (12th, 13th, 14th, 15th) have amazing views of the city, including the Empire State Building. Some rooms have a view of a brick wall."
usa_new york city_comfort_inn_times_square,Rooms on the 16th floor offer awesome views of the New York Times building. Some rooms have a view of the Empire State Building.
usa_new york city_cooper_square_hotel,"The Cooper Square Hotel offers unbelievable views of most of the city from its rooms with floor-to-ceiling windows, with corner rooms on floors 12+ providing excellent views. Guests have enjoyed views of the Empire State Building and the Brooklyn Bridge."
usa_new york city_cosmopolitan_hotel_tribeca,"Some rooms at The Cosmopolitan Hotel face the street and offer views of the Empire State Building. Rooms on the higher floors facing West Broadway have better views, though some rooms have no external outlook."
usa_new york city_courtyard_by_marriott_new_york_manhattan_times_square_south,"Some rooms offer views of the Empire State Building, especially those on higher floors with room numbers ending in ""01"". However, many rooms have views of alleys, junk courtyards, or adjacent office buildings."
usa_new york city_courtyard_by_marriott_new_york_manhattan_upper_east_side,"Some rooms, especially end rooms and suites, offer views of the East River, with corner rooms having two large windows. The hotel is surrounded by high-rise apartments, but upper floors have nice views of the street and city lights at night."
usa_new york city_courtyard_new_york_manhattan_fifth_avenue,"Some rooms have views of the NY Public Library, and rooms on higher floors may offer city views. Some rooms on lower floors, however, have views of brick walls."
usa_new york city_courtyard_new_york_manhattan_midtown_east,"Many reviewers mention having great views from their rooms, including views of the Chrysler Building, the East River, and the United Nations building, particularly from higher floors. Some rooms have walls of windows and corner views."
usa_new york city_crosby_street_hotel,The Crosby Street Hotel has tall warehouse-style windows. It is centrally located in SoHo.
usa_new york city_crowne_plaza_times_square_manhattan,"The Crowne Plaza Times Square offers rooms with great views of Times Square, the Hudson River, and Central Park from higher floors (ranging from the 16th to the 46th). Corner rooms and executive level rooms are also mentioned as having particularly stunning views."
usa_new york city_da_vinci_hotel,"- Rooms do not have views, but look into the bricks of the next building or into a smelly alley. Street-facing rooms can be noisy."
usa_new york city_doubletree_guest_suites_times_square,"The Doubletree Guest Suites Times Square offers rooms with amazing views of Times Square, with corner King Suites (01 rooms) having direct views of the ball drop. Cityscape views are available from higher floors with cityscape views."
usa_new york city_doubletree_hotel_chelsea_new_york_city,Rooms on higher floors offer views of the Empire State Building. Some rooms also have views facing 29th street.
usa_new york city_doubletree_metropolitan_hotel,"Rooms on higher floors facing Lexington Avenue, or the 17th floor and above, may offer views, though some rooms faced adjacent buildings with limited views. One room on the 19th floor had a partial view of the Chrysler Building."
usa_new york city_dream,"The hotel has a rooftop bar with great views of Broadway, Times Square, and the city. Some rooms on the 10th floor have views of 55th street."
usa_new york city_duane_street_hotel,"I'm sorry, but none of the reviews mention anything about amazing views."
usa_new york city_dylan_hotel,"Many rooms at the Dylan Hotel do not have a view, with some facing brick walls or other office buildings, potentially requiring guests to keep curtains drawn. Some rooms offer views of the sky, and a partial view of the New York Public Library can be seen from some rooms facing 41st Street."
usa_new york city_eastgate_tower,"Some rooms at the Eastgate Tower have great views of Manhattan, including the UN building and reflections of the Chrysler building, particularly from higher floors (24th and 25th). Some west-facing rooms offer spectacular views."
usa_new york city_econo_lodge_times_square,"I am sorry, but none of the reviews mention amazing views. Some reviews mention noise due to the proximity to Times Square and a fire station."
usa_new york city_embassy_suites_hotel_new_york_city,"Many suites offer views of the Hudson River, the New Jersey shore, and the Statue of Liberty, especially from the higher floors and corner rooms; however, some views are obstructed by new construction. The hotel is located near the waterfront, Battery Park, and the World Financial Center."
usa_new york city_empire_hotel,"The Empire Hotel's rooftop bar has great city views and a small pool, but some rooms facing Lincoln Center may experience construction noise. Some rooms have views of the upper west side and of Lincoln Center with the fountain."
usa_new york city_envoy_club,The Envoy Club has a rooftop deck on the 22nd or 24th floor with views of the Manhattan skyline and the East River. Some rooms on the corners of the building have glass going right the way around the living area for expansive views.
usa_new york city_eurostars_wall_street,"I'm sorry, none of the reviews mention anything about hotels with amazing views."
usa_new york city_excelsior_hotel,"The Excelsior Hotel has rooms with great views of the park, the Museum of Natural History, and the NYC skyline. Some rooms on upper floors have park views and balconies."
usa_new york city_fairfield_inn_new_york_manhattan_times_square_south,"The hotel has rooms on higher floors that offer views of the cityscape, Times Square buildings, the Hudson River, and the Empire State Building. The top floor has wonderful views, but the windows were rather small."
usa_new york city_fitzpatrick_grand_central_hotel,"Some rooms overlook 44th St, while others offer oblique views of Lexington; rooms at the back of the hotel have no view. The Liam Neeson Penthouse Suite on the rooftop has nice views."
usa_new york city_fitzpatrick_manhattan,"Several reviewers mention rooms facing Lexington Avenue on higher floors (e.g., 16th floor) but also note street noise. Rooms on the rear of the hotel are described as fairly quiet, but with no view."
usa_new york city_flatotel,"The Flatotel is a high-rise with rooms on up to the 46th floor, and some reviewers mention having great city views, especially from corner rooms and higher floors. The gym is also located on the top floor and has panoramic views."
usa_new york city_four_points_by_sheraton_manhattan_chelsea,"Rooms on the 17th floor offer excellent views of the Empire State Building and south-facing rooms have views of downtown. Some rooms on higher floors offer views of the NYC skyline and water towers, and there are rooms on the 20th floor facing the Empire State Building."
usa_new york city_four_points_by_sheraton_manhattan_soho_village,"Rooms on the 15th floor and above have views of the Empire State Building or downtown Manhattan, with south-facing rooms offering more interesting views. Lower floors, especially those facing the alley, may have limited or no views."
usa_new york city_four_points_by_sheraton_midtown_times_square,"Some rooms are on higher floors (up to the 34th floor) with nice views, including Jersey, Times Square, and the Empire State Building. Some rooms face the back of the hotel with a view of the Westin at 51st and 8th."
usa_new york city_four_seasons_hotel_new_york,"The Four Seasons New York offers rooms with views of Central Park and the city from high floors, some suites have balconies with east and west views. The hotel is a 52-story building located on 57th Street between Park and Madison Avenue."
usa_new york city_gild_hall,"I'm sorry, but I am unable to respond to your request, as there is no mention of views in the provided hotel reviews."
usa_new york city_gramercy_park_hotel,"The Gramercy Park Hotel has a rooftop bar open only to hotel guests, which provides an uninterrupted view of New York City. Some rooms also have park views."
usa_new york city_grand_hyatt_new_york,"The Grand Hyatt New York offers views of the Chrysler Building from some rooms and overlooks 42nd street, with some rooms on higher floors having better views. Rooms facing the street have views of yellow taxis, while Regency Club rooms on the 31st floor have excellent city views."
usa_new york city_greenwich_hotel,"The Greenwich Hotel has suites with 30-foot windows overlooking the city, and corner rooms with views of Greenwich and N. Moore. Some rooms also have doors that open to overlook the courtyard."
usa_new york city_hampton_inn_35th_st_empire_state_building,"Some rooms offer views of the Empire State Building and Macy's, especially those on higher floors. Rooms at the back of the hotel face office buildings, but are quiet."
usa_new york city_hampton_inn_madison_square_garden,"I am sorry, but the reviews do not contain information about amazing views."
usa_new york city_hampton_inn_manhattan_chelsea,"The hotel offers great city skyline views from the higher 19th floors, with some rooms even having views of the Empire State Building. Rooms on high floors offer views over the roof and onto the next street."
usa_new york city_hampton_inn_manhattan_soho,The Hampton Inn SoHo offers rooms on higher floors with views of the Empire State Building and Chrysler building; rooms on the north side and odd-numbered rooms at the back of the hotel have the best views. The hotel also has a top-floor terrace with city views.
usa_new york city_hampton_inn_manhattan_times_square_south,"The hotel has rooms on high floors (26th floor mentioned) that may have a nice view depending on the room, though some rooms have views of a brick wall. If you get a high enough room, you get a bit of a view."
usa_new york city_hampton_inn_new_york_seaport_financial_district,Some rooms on the higher floors (7-9) offer views of the Brooklyn Bridge and the Seaport; top floor rooms may have small terraces with great views. Some rooms not on Pearl Street and on the first six floors face the back of a building.
usa_new york city_helmsley_middletowne_hotel,Some rooms offer a view of the Chrysler Building. Rooms on higher floors may have better views.
usa_new york city_hilton_club_new_york,"The Hilton Club is located on the 37th and 38th floors, offering a central Manhattan location. Some rooms have views and executive floor rooms are available."
usa_new york city_hilton_garden_inn_chelsea,"The Hilton Garden Inn Chelsea has rooms on the upper floors that offer city views, and some rooms have a view of the Empire State Building. The hotel has 24 floors, and is tall and narrow with only about 6 rooms per floor."
usa_new york city_hilton_garden_inn_new_york_west_35th,"Rooms on higher floors offer great views of the Empire State Building and the city skyline, with some rooms facing Macy's. City View rooms guarantee a higher floor."
usa_new york city_hilton_garden_inn_times_square,"Some higher floor rooms at Hilton Garden Inn Times Square offer views towards the Hudson River and the street, although some views overlook air conditioning units or other buildings. A ""secret"" rooftop bar, accessible through a separate entrance, offers amazing views and attracts celebrities."
usa_new york city_hilton_garden_inn_tribeca,"Some rooms have views of the neighbor building's airshafts, while others have long views down two streets. Rooms with inner courtyard views are quiet."
usa_new york city_hilton_new_york,"Many reviewers mention the great location, with rooms on higher floors having good views of Central Park and the city. Some rooms on the 40th and 42nd floors, especially Executive Level rooms, offer expansive city views."
usa_new york city_hilton_times_square,"Located between 41st and 42nd streets, the Hilton offers rooms on the 23rd floor and above with high-floor views of the Empire State Building, Hudson River, and Times Square. Some rooms offer downtown views, including the Statue of Liberty."
usa_new york city_holiday_inn_express_new_york_city_fifth_ave,"Some rooms on the 25th floor have views, but rooms on the backside of the hotel only offer views of other buildings. Higher floors offer quiet rooms with little street noise."
usa_new york city_holiday_inn_express_new_york_city_times_square,"The Holiday Inn Express Times Square South has rooms on high floors (up to 35th) that offer amazing views. One reviewer specifically mentioned a room on the 35th floor with a great view at no extra cost, while another mentioned a partial view of the Hudson River from their room."
usa_new york city_holiday_inn_express_nyc_madison_square_garden,"The hotel generally does not have good views, although the top floor may have a view. Some rooms offer views of the Empire State Building."
usa_new york city_holiday_inn_manhattan_downtown_soho,Rooms on the 14th floor offer great views of the Empire State Building and Brooklyn Bridge. Some rooms have a view of Canal Street.
usa_new york city_holiday_inn_midtown_57th_st,"Some rooms at this hotel offer excellent views of the bay, NYC skyline, and the pool from the upper floors (e.g. 17th floor). Some reviewers also mention pool views from the 14th floor and amazing city views from the top floor."
usa_new york city_holiday_inn_nyc_manhattan_6th_avenue,"Many reviewers mention great views from the higher floors, including views of the Empire State Building and the Manhattan skyline. Some rooms have views of the Empire State Building from the bedroom window, and south-facing rooms have views toward Lower Manhattan."
usa_new york city_hotel_17,"Some rooms have a decent view facing 17th Street, and Room 612 is described as a double room that is very sunny. Some rooms also offer views of the Empire State Building."
usa_new york city_hotel_31,"Hotel 31 offers views of the Empire State Building from some rooms, with rooms on the 6th and 8th floor having particularly good views. Some rooms also overlook a typical NY backyard, and the Chrysler building."
usa_new york city_hotel_373,"Hotel 373 offers rooms with views of the Empire State Building, especially from higher floors. Some rooms on the 9th floor also provide quiet, with some street noise, despite being on 5th Avenue."
usa_new york city_hotel_41_at_times_square,Hotel 41 is near Times Square and some rooms face the street. Some penthouse suites include terraces that provide good views of the surrounding area.
usa_new york city_hotel_99,"I am sorry, the provided hotel reviews do not contain information about hotel views. Therefore, I cannot fulfill this request."
usa_new york city_hotel_beacon,"The Beacon Hotel offers rooms on higher floors with views of Central Park, the Hudson River, and the Ansonia Building. Some rooms have corner views or face Broadway."
