Hotel,Summary
usa_new york city_the_milburn_hotel,"Some rooms on the upper floors offer views, with room 13 having a balcony and a view of the Hudson River. Room 1500 is a high corner room with small river and city views, while other rooms face other buildings and have no views."
usa_new york city_the_muse_hotel_new_york_a_kimpton_hotel,The Muse Hotel offers upper floor rooms and balcony suites with views of midtown Manhattan and the Times Square billboards. Note that some rooms have limited views of a brick wall or mechanical equipment.
usa_new york city_the_new_york_helmsley,"The Helmsley offers rooms with great views, including the Chrysler Building and Empire State Building, and is located close to Grand Central Station. Some rooms are on high floors, up to the 41st floor, providing skyline views."
usa_new york city_the_new_yorker_hotel,"Many reviewers mention having great views of the city, including the Empire State Building, Chrysler building, Hudson River, and Madison Square Garden. Some rooms are located on higher floors (up to the 37th) with city views, and tower rooms offer views down to the financial district and the Statue of Liberty."
usa_new york city_the_pierre,"The Pierre is located across from Central Park, offering splendid views. Some rooms, particularly those on higher floors, provide park views."
usa_new york city_the_plaza,"One reviewer was told that the Edwardian Suite (1740) would be the best choice with it's &quot;sweeping views&quot; of Central Park, but the room had obstructed views. Rooms on the 12th floor overlooked the internal courtyard so did not suffer from the street noise."
usa_new york city_the_pod_hotel,The hotel has a roof terrace that provides great views of the Manhattan skyline and views of the city lights at night. Some rooms on the upper floors have decent views.
usa_new york city_the_premier,Rooms on the 20th floor have views of the Chrysler Building from the side window and the Paramount Clock and Times Square lights from the front window. Some rooms offer great views.
usa_new york city_the_ritz_carlton_new_york_central_park,"The Ritz Carlton Central Park offers park view rooms with great views of Central Park, some of which include telescopes, and upper-floor rooms provide stunning views at dawn. Deluxe Park View Suites offer exceptional views, and Park View rooms on lower floors provide a tree-level view."
usa_new york city_the_roosevelt_hotel,"Some rooms at the Roosevelt have nice views of the city, including the Chrysler Building, and the hotel has a rooftop bar with panoramic views. However, other rooms have less desirable views of ventilation systems or inner courtyards."
usa_new york city_the_sherry_netherland_hotel,"The Sherry-Netherland offers Park View Suites on high floors with views of Central Park, the Empire State Building, and up to 96th street. Some rooms/suites overlook 59th, and City View Suites are available."
usa_new york city_the_shoreham,I wasn't able to identify any reviews that mention the hotel views.
usa_new york city_the_st_regis_hotel_new_york,"The St. Regis offers views of Central Park from some rooms, particularly from the living room of the Presidential Suite and the round windows of the Imperial Suite. However, some rooms have views of brick walls or limited natural light."
usa_new york city_the_standard_new_york,"The Standard Hotel in NYC has floor-to-ceiling windows offering amazing views of the Hudson River, Empire State Building, Statue of Liberty, and the High Line. Rooms on higher floors and south-facing rooms are recommended for the best views."
usa_new york city_the_surrey,The Surrey's rooms offer views overlooking Central Park or onto Madison Avenue and the Upper East Side. Some rooms on high floors have views of the Whitney Museum.
usa_new york city_the_sylvan_guest_house,"The Sylvan Guest House is located in Harlem, near the Jumel Mansion. Some apartments have a terrace."
usa_new york city_the_time,"Some rooms offer views of the ship, the back of other buildings, or a dirty brick wall a few feet away from the window. Some rooms overlook rooftops, so the curtains were kept down."
usa_new york city_the_waldorf_astoria,"Many reviewers mention rooms on higher floors having views of Park Avenue, the Chrysler Building, and St. Bartholomew's Church; some rooms, however, overlook rooftops or have obstructed views. A corner room on the 12th floor had great city views and suites in the Towers also offer great views."
usa_new york city_the_westin_new_york_at_times_square,The Westin New York Times Square offers rooms on the upper floors with city and Hudson River views; corner rooms have windows on two walls and views in multiple directions. Many rooms offer views of the Empire State Building and Times Square.
usa_new york city_thirty_thirty_hotel,The hotel has some rooms with views of the Empire State Building. Some higher floor rooms facing south and east have great light and views.
usa_new york city_thompson_les,"The Thompson LES offers rooms with floor-to-ceiling windows providing great views of the Lower East Side and Manhattan skyline, including the Empire State Building, Chrysler Building, and Brooklyn Bridge. Some rooms have balconies offering city views."
usa_new york city_travel_inn_hotel_new_york,Some rooms at the Travel Inn have views of the Empire State Building or overlook the pool area. Rooms on higher floors may be quieter.
usa_new york city_tribeca_grand_hotel,"*   Rooms have nice views of the streets below so you can people watch.
*   Some rooms at the SoHo Grand have great views, other rooms have almost no view at all."
usa_new york city_trump_international_hotel_and_tower,"Many reviewers mention the hotel's views of Central Park and Columbus Circle, especially from higher floors and corner rooms. Some rooms have floor-to-ceiling windows to enhance the view."
usa_new york city_tudor_hotel_at_the_united_nations,"Some rooms, especially those on higher floors and corners in the North Tower, offer views of the East River, the United Nations, and the Chrysler Building. Junior suites with terraces are available."
usa_new york city_vincci_avalon,"Some rooms at the Avalon Vincci offer views of the Empire State Building, and top-floor rooms may provide additional city views. However, some rooms have views of adjacent buildings or fire escapes."
usa_new york city_w_new_york_the_court,"Rooms on the 11th floor had wonderful views of the Chrysler building, and rooms on the 16th floor had views of the Empire State Building. Corner rooms had three windows, offering great city views."
usa_new york city_w_new_york_the_tuscany,The W Tuscany has some rooms with views of the Chrysler Building and the Empire State Building. Higher floors and corner rooms may have better views.
usa_new york city_w_new_york_times_square,"Many reviewers mention amazing views from rooms as high as the 56th floor, with corner rooms offering views of Times Square, the Hudson River, and Central Park. Some rooms have full-length windows for better viewing."
usa_new york city_w_new_york_union_square,"The W Union Square's high floors offer fantastic views of NYC, with upgraded rooms and corner rooms providing great views looking south and east. Rooms facing out towards Filene's Basement, DSW, Whole Foods and Union Square Park also provide nice views."
usa_new york city_waldorf_towers,"The Waldorf Towers offers suites on high floors with spectacular views of Park Avenue, the Chrysler Building, and the East River. Some rooms have multiple large windows providing views in different directions."
usa_new york city_wall_street_inn,"Some rooms on the higher floors may have a peek of sunlight, but there is scaffolding in front of the hotel. The hotel is near the Staten Island Ferry, which offers great views of Manhattan."
usa_new york city_warwick_new_york_hotel,"The Warwick has rooms with great views of 6th Avenue and Central Park, with some corner rooms on higher floors offering spacious layouts and multiple windows. Many rooms, however, have views of a brick wall or air shaft."
usa_new york city_washington_jefferson_hotel,The hotel has rooms facing 51st street with a view of the quaint street below and rooms overlooking an interior courtyard. There are also rooms with a view of a brick wall.
usa_new york city_washington_square_hotel,"Some rooms have views of Washington Square, the Empire State Building, or look out onto side streets. Deluxe rooms are recommended to avoid brick wall views."
usa_new york city_wellington_hotel,"The Wellington Hotel is in a great location and some rooms on the 22nd, 25th, 26th, or 27th floors offer great views of Central Park or Times Square. Some rooms have balconies and views of 57th and 6th avenue."
usa_new york city_west_57th_street_by_hilton_club,"The hotel has rooms with views of the Upper East and West Sides and all of Central Park. Not all rooms face north toward 57th street, but rooms on the 25th floor have an outside terrace with night light views."
usa_new york city_wingate_by_wyndham_manhattan_midtown,"This hotel is located in midtown Manhattan. Some rooms have views overlooking the street, while others have views of nearby buildings."
usa_new york city_wolcott_hotel,"Many rooms have views of the Empire State Building, and front rooms have nice views. View is not great from all rooms and back rooms can be dark."
usa_new york city_woogo_central_park,Some rooms on the 6th and 17th floor offer views of the building across the street or a beautiful skyline. The penthouse on the 17th floor has a huge rooftop terrace.
usa_new york city_wyndham_garden_hotel_times_square_south,Some rooms have skyline views towards the river and neighboring buildings; rooms on higher floors may offer a glimpse of the Hudson River. Some rooms have a decent view of neighboring buildings and a glimpse of the Hudson River.
