Hotel,Summary
usa_new york city_hilton_new_york,"This Hilton is a large, busy hotel with nearly 2000 rooms, centrally located near major attractions and subway stations but offering impersonal service and crowded conditions. Reviews suggest exploring smaller, more intimate hotels for a quieter, more personalized experience."
usa_new york city_hilton_times_square,"The Hilton Times Square is described as having a boutique feel and being smaller than other brand-name hotels, creating a pleasant stay. It features an intimate bar off the lobby and rooms starting on the 23rd or 24th floor."
usa_new york city_holiday_inn_express_new_york_city_fifth_ave,"This Holiday Inn Express is a small, modern hotel with clean rooms. The hotel is located just off 5th Avenue in midtown Manhattan."
usa_new york city_holiday_inn_express_new_york_city_times_square,"There is no mention of the hotel being a ""boutique hotel"". It is a Holiday Inn Express located a few blocks from Times Square. Rooms are small but clean, and the hotel offers free breakfast and internet."
usa_new york city_holiday_inn_express_nyc_madison_square_garden,There is no information about boutique hotels in the reviews. The Holiday Inn Express is a modern hotel in a central location with small but clean rooms and a free breakfast.
usa_new york city_holiday_inn_manhattan_downtown_soho,"This hotel is not considered a boutique hotel. It is a Holiday Inn located on the edge of Chinatown, near Little Italy and Soho."
usa_new york city_holiday_inn_midtown_57th_st,"I am sorry, I cannot answer the question because the hotel reviews do not contain information about boutique hotels. This hotel is a Holiday Inn."
usa_new york city_holiday_inn_nyc_manhattan_6th_avenue,"This Holiday Inn is a newer, modern hotel with small rooms and a small lobby located in the Chelsea/Garment district, close to subway stations and Penn Station. There is a bar and restaurant, a small gym and a business center with free internet."
usa_new york city_hotel_17,"Hotel 17 is a budget-friendly, European-style hotel with a ""shabby chic"" or ""funky"" decor, small rooms, and shared bathrooms. The hotel has a ""vintage"" elevator and is often described as ""clean"" and located near Union Square in the Gramercy Park neighborhood."
usa_new york city_hotel_31,"Hotel 31 is a budget hotel with small, clean rooms and shared bathrooms, though private bathrooms are available for an additional charge. It has an old-fashioned style with an old elevator, and is conveniently located near the Empire State Building and subway lines."
usa_new york city_hotel_373,"Hotel 373 is a small, modern boutique hotel located on 5th Avenue, close to the Empire State Building, with clean rooms and a Starbucks connected to the lobby. Rooms are small and lack storage space and amenities such as a gym, bar, or restaurant."
usa_new york city_hotel_41_at_times_square,"Hotel 41 is a small, trendy boutique hotel located near Times Square that features clean rooms with Aveda products, a reliable wi-fi service, and a complimentary continental breakfast. The rooms are small, but well-laid-out, and there is a bar that is popular during happy hour."
usa_new york city_hotel_99,"Hotel 99 is a new hotel located on the Upper West Side that was still under construction during the time of these reviews. Some rooms were completed and featured modern decor, LCD TVs, and private bathrooms, with promotional rates offered due to ongoing renovations."
usa_new york city_hotel_beacon,"The Beacon Hotel is described as a hotel with boutique flavor and clean, spacious rooms, offering an alternative to larger chain hotels. Some reviewers note its newly renovated rooms and older-style charm, as well as a cozy atmosphere, but not top-of-the-line elegance."
usa_new york city_hotel_chandler,"Hotel Chandler is a smaller, modern boutique hotel in Midtown Manhattan near the Empire State Building, with clean, but small rooms, Aveda toiletries, and comfortable beds. The hotel offers amenities like free Wi-Fi, a gym, a computer in the library, and complimentary tea and coffee in the lobby."
usa_new york city_hotel_deauville,"Hotel Deauville is described as a small, European-style hotel with an ""Old World"" feel, reminiscent of inexpensive hotels in London or Paris, featuring eclectic rooms and purple bathrooms. The hotel has a vintage, manually operated elevator."
usa_new york city_hotel_east_houston,"The East Houston Hotel is a small, modern boutique hotel with Asian minimalist decor, cherry wood floors, and Bulgari toiletries. It features a rooftop terrace with city views, free breakfast, and internet access, but rooms are tiny with limited storage."
usa_new york city_hotel_elysee,"Hotel Elysee is a small, elegant, and European-style boutique hotel with a Monkey Bar that is conveniently located in Midtown Manhattan, close to attractions and transportation. The hotel has uniquely decorated rooms, a club room with free breakfast and wine, and offers a comfortable, intimate atmosphere."
usa_new york city_hotel_gansevoort,"The Gansevoort Hotel is a trendy, modern boutique hotel located in the Meatpacking District of NYC. It has a rooftop pool and bar, a Japanese fusion restaurant, and a spa/lounge."
usa_new york city_hotel_giraffe,"Hotel Giraffe is a small, elegant, European-style boutique hotel in a convenient midtown Manhattan location, near subway lines and many restaurants. It offers modern, well-appointed rooms, some with balconies, and amenities like free Wi-Fi, continental breakfast, and an evening wine and cheese reception."
usa_new york city_hotel_grand_union,"The Grand Union Hotel is not a boutique hotel, but rather a budget-friendly option in Midtown Manhattan with small, basic rooms that are generally clean and comfortable. It has a convenient location near the Empire State Building and subway lines."
usa_new york city_hotel_indigo_new_york_city_chelsea,"Hotel Indigo is a modern, minimalist hotel with small rooms, Aveda toiletries, and HD TVs. It is located close to Times Square and the subway."
usa_new york city_hotel_mela,"Hotel Mela is a modern boutique hotel with small but clean, well-appointed rooms; it is located right off Times Square and has a friendly staff. It is known for its stylish decor and H2O bath products, but lacks some amenities found in larger hotels."
usa_new york city_hotel_metro,"The Hotel Metro is an art deco hotel with rooms that are basic, clean, and small. It has a rooftop bar with views of the Empire State Building and a gym."
usa_new york city_hotel_newton,"Hotel Newton is not a luxury or boutique hotel, but it is a clean and well-maintained budget hotel in the Upper West Side, near a subway station for convenient access to Manhattan. Rooms are small, but some include a fridge and microwave, and the hotel is near shops, restaurants, and Central Park."
usa_new york city_hotel_on_rivington,"The Hotel on Rivington is a trendy, modern, and sleek boutique hotel in the Lower East Side with spacious rooms, floor-to-ceiling windows with great views, and well-equipped bathrooms with features like Japanese soaking tubs. Though showing some wear, it offers comfortable Tempurpedic beds and a cool vibe, appealing to younger, hip travelers seeking a different NYC experience away from touristy areas."
usa_new york city_hotel_reserve,"Hotel Reserve is a small, modern boutique hotel located in New York's Financial District, near Wall Street and several subway lines. It offers clean, updated rooms with comfortable beds, flat-screen TVs, and free Wi-Fi, though some guests found the rooms small and the gym basic."
usa_new york city_hotel_st_james,"The St. James Hotel is a budget-friendly option located near Times Square, with guests often mentioning the clean rooms and amicable staff; however, it is undergoing renovations, has small rooms and limited amenities. Many guests note its proximity to delis, Broadway, and other attractions add to its value."
usa_new york city_hotel_stanford,"The Stanford Hotel is located in Koreatown, close to Penn Station, Macy's, and the Empire State Building, and near a subway stop. Rooms are often small, and some have outdated furniture, but some rooms have been renovated with new bathrooms."
usa_new york city_hotel_wales,"Hotel Wales is a small, older hotel located on the Upper East Side of NYC, close to Central Park and museums. Reviews mention its European charm, quaint decor, and availability of suites, but also note that standard rooms can be small and noisy."
usa_new york city_hudson_hotel,"The Hudson Hotel is a trendy, modern hotel designed by Phillip Stark with small, European-style rooms, a lively bar scene, and a rooftop terrace.
The hotel has design features such as dark wood panelling, low lighting, and exposed brick in common areas."
usa_new york city_ink48_a_kimpton_hotel,"Ink48 is a modern, stylish boutique hotel with spacious rooms, large bathrooms, and city or river views, located on the west side of Manhattan in Hell's Kitchen. It features a funky lobby, a rooftop lounge (under construction in 2009), and offers complimentary breakfast and evening wine service."
usa_new york city_inn_new_york_city,"Inn New York City is a small, luxurious, and uniquely decorated inn located in a converted brownstone on the Upper West Side, near Central Park and the 72nd street subway stop. Each suite has a full kitchen and guests receive fresh pastries, fruit and other treats daily."
usa_new york city_intercontinental_the_barclay_new_york,"Some reviewers describe the Intercontinental Barclay as having an old-fashioned ambience and style with antique furniture; others describe it as a traditional top-end hotel for those who can't stand ""boutique"", ""no frill"" and ""minimalist"". One review notes that the Intercontinental makes them think of the Biltmore in Los Angeles, ""a piece of history but feeling old""."
usa_new york city_jumeirah_essex_house,"I am sorry, I cannot provide information about boutique hotels, but the Essex House is in an excellent location, with a comfortable bed and is known for good service. The hotel also has a bar, 24-hour deli, spa, and fitness center."
usa_new york city_kitano_new_york,"The Kitano is a smaller, boutique-style hotel with a Japanese theme, located in the Murray Hill area close to Grand Central Station. It features soundproof rooms, jazz in the bar, and a Japanese restaurant."
usa_new york city_la_quinta_manhattan,"I am sorry, I cannot provide information about boutique hotels as the provided hotel reviews do not mention whether the La Quinta Inn is a boutique hotel. The reviews focus on the hotel's location, cleanliness, value, and service."
usa_new york city_lafayette_house,Lafayette House is a 15-room boutique hotel in a townhouse setting with individually furnished rooms featuring antiques. Some rooms include sitting areas with fireplaces and kitchenettes.
usa_new york city_le_parker_meridien,"The Le Parker Meridien is a modern hotel with stylish decor that some reviewers found sterile, and the rooms are considered small by some, but large for NYC standards. The hotel has a unique burger bar and a great gym but charges extra for gym use to hotel guests and also rooftop pool with great views."
usa_new york city_library_hotel,"The Library Hotel is a 60-room, literary-themed boutique hotel located near Grand Central Terminal, featuring a rooftop bar, bistro, free Wi-Fi, and a 24-hour reading room with complimentary pastries, wine, and cheese. Rooms are decorated based on the Dewey Decimal System."
usa_new york city_loews_regency_hotel,"The hotel is described as ""old school"" with a pleasant and cozy lobby and nicely preserved historical touches in the public spaces. It has a relatively small size which gives it a more convivial feel than larger and more impersonal luxury hotels."
usa_new york city_lowell_hotel,"The Lowell is a small, intimate, and luxurious boutique hotel located on the Upper East Side. It is known for its European style, spacious rooms, kitchenettes, fireplaces, and attentive service."
usa_new york city_mandarin_oriental_new_york,"The Mandarin Oriental is not a boutique hotel, but a luxury hotel located in the Time Warner Center, offering views of Central Park and the Hudson River. It features modern rooms, a spa, and dining options."
usa_new york city_milford_plaza_hotel,"I am sorry, but the provided text does not contain information about boutique hotels. Instead, it contains reviews for the Milford Plaza Hotel. Therefore, I am unable to summarize this hotel in relation to the query."
usa_new york city_millenium_hilton,"I am sorry, I cannot provide information on the top boutique hotels. However, some reviewers describe the Millenium Hilton as a high tower hotel with clean and modern rooms. It has amenities for business travelers and nice common areas."
usa_new york city_millennium_hotel_broadway,"I am sorry, I cannot locate information about the hotel being a boutique hotel, nor the top boutique hotels in the surrounding area. However, The Millenium Broadway Hotel is close to Time Square with clean rooms. Some reviewers said the it is a three and half star hotel with a fantastic location, and it has an ok restaurant."
usa_new york city_millennium_un_plaza_hotel,"The Millennium UN Plaza is not a boutique hotel but a large, high-rise hotel with spacious rooms and great views of NYC, especially from higher floors and corner rooms. It is located near the UN and Grand Central Station, but some past guests have mentioned that the decor and amenities are outdated in some rooms."
usa_new york city_moderne_hotel,"The Moderne is a small, 34-37 room boutique hotel with a retro, Andy Warhol-themed decor, LCD TVs, and comfortable beds. It offers a library with free coffee/tea and internet access and is located close to Times Square and Central Park."
usa_new york city_morgans_hotel,"Morgans is a stylish, modern boutique hotel with a black and white theme, known for its friendly staff and convenient Midtown Manhattan location near Grand Central Station and the Empire State Building. It offers a ""Living Room"" with free tea and coffee, a gym, and complimentary continental breakfast at Asia de Cuba."
usa_new york city_murray_hill_east_suites,"I am sorry, but the provided hotel reviews do not mention if this is a boutique hotel. The reviews mention the Murray Hill East Suites is in a convenient location with spacious rooms and kitchenettes, but the decor is dated. Some reviews note the absence of certain amenities and the varying quality of service."
usa_new york city_murray_hill_inn,"The Murray Hill Inn is described as a European-style inn, clean, and simple, but not luxurious, with small rooms; some rooms have been recently remodeled. It is located in midtown Manhattan, near the Empire State Building and Grand Central Station, and near subway lines."
usa_new york city_new_york_marriott_downtown,"I am sorry, I cannot provide information about boutique hotels from the context provided. The reviews focus on the Marriott Downtown, highlighting its location near Ground Zero and subway lines, room comfort, and service quality."
usa_new york city_new_york_marriott_east_side,"I'm sorry, but there is no indication of this hotel being a boutique hotel in the data provided. The hotel is described as an older, historic hotel, with recent renovations."
usa_new york city_new_york_marriott_marquis,"The hotel is large and impersonal, not well-suited for those seeking a more intimate experience. The hotel has friendly staff and offers amenities such as a fitness center, bars, and restaurants."
usa_new york city_new_york_palace_hotel,"This hotel is a 5-star hotel but is not a boutique hotel. Instead, it is a large hotel near midtown with large and clean rooms, and a bar."
usa_new york city_night_hotel,"The Night Hotel is a small, trendy boutique hotel near Times Square with a black and white decor, small rooms, and a lively bar scene. Reviews mention the rooms being well-equipped with modern amenities."
usa_new york city_novotel_new_york_times_square,"I am sorry, but the reviews provided do not contain information about boutique hotels. Therefore, I cannot provide a relevant summary."
usa_new york city_off_soho_suites,"Off Soho Suites is an apartment-style hotel with suites including a bedroom, living room with sofa bed, kitchenette, and bathroom, with some suites offering shared bathrooms. It is located in Lower Manhattan, within walking distance of Soho, Little Italy, and Chinatown, and close to several subway lines."
usa_new york city_omni_berkshire_place,"The Omni Berkshire Place is described as having a boutique feel despite being a fairly large hotel, with a smaller, understated lobby. The staff are noted as friendly and the hotel is well-maintained."
usa_new york city_on_the_ave_hotel,"On the Ave is a modern, stylish boutique hotel with small rooms but comfortable beds, located on the Upper West Side near the subway and Central Park; suites offer balconies and good views. It offers a roof terrace, but no bar or restaurant."
usa_new york city_park_79_hotel,"Park 79 is a small, older building with clean but tiny rooms, some with shared bathrooms and thin walls. It is located in the Upper West Side, near Central Park and the subway."
usa_new york city_park_central,"I am sorry, but the provided text does not contain the requested information. The reviews do not mention whether the hotel is a boutique hotel."
usa_new york city_park_south_hotel,"The Park South Hotel is described as a small, clean, and well-maintained boutique hotel with a convenient location near the subway, offering a complimentary breakfast and a restaurant/bar. Some reviewers note the rooms can be small, and some experience noise issues related to the street or AC units."
usa_new york city_peninsula_new_york,"The Peninsula is described as feeling like a boutique hotel and being more intimate than other large hotels. It is not a cutting-edge designer or boutique hotel, but a classy, quiet and elegant hotel that focuses on customer comfort."
usa_new york city_phillips_club,"The Phillips Club offers stylish studios, one, and two-bedroom apartments with kitchens for daily, weekly, or monthly rentals. It is located near Lincoln Center and Columbus Circle with access to subway lines, and features amenities like a gym, and access to Balducci's gourmet shop."
usa_new york city_plaza_athenee_hotel,"The Plaza Athenee is described as an intimate, European-style boutique hotel with a residential feel, located on a quiet, tree-lined street on the Upper East Side, close to Central Park and Madison Avenue. Some found it to be a quiet oasis, while others noted ongoing renovations and occasional noise issues."
usa_new york city_radisson_martinique_on_broadway,"This hotel is not a boutique hotel. It is a large older property with mixed reviews on service, cleanliness, and room size."
usa_new york city_ramada_eastside,"The Ramada Eastside Inn is not a boutique hotel. It is a budget hotel with small, clean, recently remodeled rooms, and a convenient location near the subway, Empire State Building, and various restaurants."
usa_new york city_red_roof_inn_manhattan,"The Red Roof Inn is described as a clean, recently renovated and modern hotel with beautifully decorated rooms, some offering views of the Empire State Building. Although rooms can be small, it is considered a gem due to its convenient central location near shops, restaurants, and subway lines, and its reasonable price."
usa_new york city_renaissance_new_york_hotel_57,"Hotel 57, a Renaissance Hotel, is a newly renovated boutique hotel in Midtown East Manhattan with a sleek, modern, European-style decor, compact rooms, and a hopping bar/restaurant. Some reviewers found it inconsistent with Marriott standards due to small rooms and slow service."
usa_new york city_renaissance_new_york_hotel_times_square,"The Renaissance Times Square is described as a ""boutique"" hotel that is smaller and more intimate than other Times Square hotels. It has modern decor and comfortable beds, and perfect service and a great location for broadway."
usa_new york city_residence_inn_by_marriott_times_square_new_york,"The Residence Inn Times Square has smaller, modern, well-decorated rooms with granite kitchens including a full-size refrigerator, microwave, dishwasher, and dining table. The hotel is described as not luxurious but excelling at the basics with comfortable, quiet rooms, and exemplary staff, all for a good value."
usa_new york city_ritz_carlton_battery_park,"I apologize, but there was no mention of the term ""boutique"" in the given reviews. Therefore, I am unable to fulfill that request."
usa_new york city_rockefeller_center_hotel,"The Rockefeller Center Hotel is described as a smaller, intimate, modern, and efficient ""boutique hotel"" with only 6-8 rooms on each floor and a discreet entrance. It has a small lobby with self-service check-in kiosks, but offers a Terrace Club on the 7th floor with a spacious sitting area, restaurant, and free computers."
usa_new york city_roger_smith_hotel,"The Roger Smith Hotel is a boutique hotel with unique, spacious rooms, each decorated differently and featuring art, books, and comfortable beds. It has a restaurant, Lily's, and is centrally located near Grand Central Terminal."
usa_new york city_roger_williams_hotel,"The Roger Williams is a trendy boutique hotel with a modern and colorful decor, known for its friendly staff and convenient Midtown location near the Empire State Building. The hotel has small but well-equipped rooms, a gym, and a mezzanine lounge."
usa_new york city_room_mate_grace,"The Room Mate Grace is a trendy boutique hotel near Times Square with a European vibe, clean modern rooms, and amenities like a pool, sauna, steam room, and free breakfast. Some rooms are small and have unique layouts, such as platform beds and open bathrooms."
usa_new york city_royalton_hotel_new_york_city,"The Royalton is a hip, trendy boutique hotel with a Philippe Stark design, known for its dark and moody atmosphere. It is located in Midtown Manhattan, close to Times Square and Fifth Avenue."
usa_new york city_salisbury_hotel,"There is no information about boutique hotels in the reviews. The Salisbury is a reasonably priced, older hotel in midtown Manhattan with spacious rooms that are clean and comfortable, but not luxurious, and is conveniently located near Central Park and other attractions."
usa_new york city_san_carlos_hotel,"The San Carlos Hotel is a small, quiet boutique hotel with spacious rooms, a fitness center, and a business lounge with free internet; the staff is friendly and helpful, and the location is convenient to many attractions. Select rooms have a kitchenette, microwave, and minifridge."
usa_new york city_seafarers_international_house,"The Seafarers International House is a budget-friendly accommodation option located near Union Square in Manhattan. It offers basic, clean rooms with options for private or shared bathrooms, and amenities include free internet access, coffee/tea in the lobby, and laundry facilities."
usa_new york city_sheraton_new_york_hotel_towers,"There is no mention of ""boutique hotels"" in the provided text, nor is there information about whether this hotel is a boutique hotel. The hotel is a large, busy hotel situated a few blocks from Times Square, with clean rooms."
usa_new york city_skyline_hotel,"The Skyline Hotel offers clean and spacious rooms, a rarity for Manhattan, and is conveniently located near Times Square, Broadway, and various shops and restaurants, with parking available for $10 per day. It features an indoor pool with city views and is considered a great value for the price, though some found the staff rude and the neighborhood less desirable."
usa_new york city_smyth_hotel_a_thompson_hotel,"The Smyth Tribeca is a new boutique hotel with modern design, spacious rooms relative to NYC standards, and Kiehl's bath products. It is located in Tribeca, close to subway lines and various restaurants and shops."
usa_new york city_sofitel_new_york,"The Sofitel New York has a ""boutique"" feel and does not feel extremely large. The rooms are spacious and well-appointed, with comfortable beds and luxurious bathrooms."
usa_new york city_soho_grand_hotel,"The Soho Grand is a stylish hotel known for its hip atmosphere and excellent location in the SoHo area, featuring unique decor, a popular bar/lounge, and offerings like loaner iPods and goldfish. Some reviewers note that rooms can be small and that service can be inconsistent."
usa_new york city_soho_house_new_york,"Soho House is a trendy hotel with stylish decor, spacious rooms, and a rooftop pool and bar, located in the Meatpacking District. The hotel offers Cowshed spa products and access to Soho House events, and has a club-like atmosphere."
usa_new york city_stay,"Stay Hotel is a modern boutique hotel located close to Times Square, with a chic lobby featuring aquariums and a trendy bar/restaurant called Aspen Social Club. The rooms are small, but clean and stylishly decorated."
usa_new york city_the_alex_hotel,"The Alex Hotel is a modern, boutique hotel located in midtown Manhattan, near Grand Central Station and the UN. Rooms range from small to spacious suites with kitchens, Frette linens, and Frederic Fekkai toiletries, some offering views of the Chrysler Building."
usa_new york city_the_belvedere,"The Belvedere is a boutique hotel near Times Square and Broadway. Some rooms include kitchenettes with microwaves, refrigerators, and coffee makers."
usa_new york city_the_benjamin,"The Benjamin is described as a small, elegant, and stylish boutique hotel with a Beaux Arts lobby, offering spacious rooms (especially suites) with kitchenettes and a pillow menu. It is located in midtown Manhattan, close to transportation and attractions."
