Hotel,Summary
usa_new york city_the_blakely_new_york,"The Blakely Hotel is a smaller, boutique hotel with well-appointed rooms, some featuring kitchenettes, and is centrally located near Central Park and Times Square. Reviews mention the hotel's cozy atmosphere and personalized service."
usa_new york city_the_bowery_hotel,"The Bowery Hotel is a small, boutique hotel with a vintage design, aiming for an old New York atmosphere, but with modern amenities. It is located downtown, near SoHo and the East Village, and has a bar/lounge area, and an Italian restaurant."
usa_new york city_the_bryant_park,"The Bryant Park Hotel is a trendy boutique hotel with modern, minimalist decor, often attracting models and fashion executives. It features spacious rooms, large bathrooms, and a Cellar Bar known for attracting a young, hip crowd."
usa_new york city_the_carlton,"The Carlton is described as a classy boutique hotel with nicely decorated rooms but small rooms. Some reviewers mention the hotel's stylish design, luxurious bath products, and that it is recently renovated."
usa_new york city_the_carlyle_a_rosewood_hotel,"The Carlyle is described as an old-school, classy, and classic luxury hotel with a unique and sophisticated atmosphere. It's a residential building with hotel rooms, offering personalized service and a throwback to another era with art deco décor."
usa_new york city_the_franklin,"The Franklin Hotel is a small, European-style boutique hotel on the Upper East Side, near the 86th Street subway stop, Museum Mile, and Central Park. It offers amenities such as complimentary continental breakfast, evening wine and cheese, and free Wi-Fi."
usa_new york city_the_french_quarters_guest_apartments,"The French Quarters Guest Apartments is a small, Irish-owned boutique hotel with New Orleans-style decor, located on Restaurant Row near Times Square and Broadway theaters. It offers cozy, clean rooms with kitchenettes, comfortable beds, and modern bathrooms, with a continental breakfast and friendly staff."
usa_new york city_the_gem_hotel_chelsea,"The Gem Hotel Chelsea is a modern, clean, and stylish boutique hotel with small, European-style rooms, iHome systems, and Gilchrist and Soames toiletries. The hotel is located in Chelsea, close to the subway, restaurants, and art galleries."
usa_new york city_the_gem_hotel_midtown_west,"The GEM Hotel is a small, modern boutique hotel with minimalist decor, located a few blocks from Times Square, Penn Station, and Madison Square Garden. Rooms include amenities such as flatscreen TVs, iPod docks, and bathrobes, with vending machines and ice available in the basement."
usa_new york city_the_gem_hotel_soho,"The Gem Hotel SoHo is described as a boutique hotel with chic rooms, a B&B feel, and modern, comfortable decor, though small rooms are typical for NYC. It is located in the Lower East Side, near SoHo, Little Italy, and Chinatown."
usa_new york city_the_grant_hotel,"The Grant Hotel is a budget hotel located on the Upper West Side, close to the subway and Central Park, with small, clean rooms that have been updated, though some have no view. Bathrooms are shared and are cleaned regularly, and internet access is available for a fee."
usa_new york city_the_hampton_inn_times_square_north,"I am sorry, but this document does not mention information to create a summary of the top boutique hotels. This document contains reviews for a Hampton Inn, not boutique hotels."
usa_new york city_the_helmsley_carlton_house,"The Helmsley Carlton House is located on the upper east side of Manhattan, one block from Central Park. It offers spacious rooms, junior suites, and one-bedroom apartments, some with kitchenettes or balconies, but some rooms may be old feeling."
usa_new york city_the_helmsley_park_lane,"The Helmsley Park Lane is described as a boutique-styled hotel, praised for its manageable size, palatial elegance, and old-fashioned glamour. The hotel's decor is described as stylish, palatial, and chic."
usa_new york city_the_herald_square_hotel,"Herald Square Hotel is a budget hotel with clean rooms, comfortable beds, and a central location near the Empire State Building and subway stations; renovated rooms have flat-screen TVs and updated bathrooms. Some rooms are small with limited natural light, and the lobby is basic, but guests appreciate the free coffee, tea, and reliable free Wi-Fi."
usa_new york city_the_hotel_91,"Hotel 91 is a modern, minimalist hotel located in the heart of Chinatown, close to the Manhattan Bridge; rooms are clean, but can be small and noisy depending on their location. There is free DSL internet, a lounge with free coffee and tea, and friendly staff, but no restaurant, bar, or room service."
usa_new york city_the_hotel_at_times_square,"The Hotel at Times Square is described as quaint, European-style, and newly renovated with modern rooms; it is not consistently described as a boutique hotel. The hotel has been updated with amenities like flat-screen TVs, iPod docks, and coffee makers."
usa_new york city_the_inn_at_irving_place,"The Inn at Irving Place is a small, old-fashioned 1834 townhouse with 19th-century decor, antiques, and themed rooms. Some reviewers describe it as a quiet oasis, while others mention noise from a downstairs bar and holiday parties."
usa_new york city_the_iroquois,"The Iroquois is a small, elegant boutique hotel in midtown Manhattan with comfortable, clean rooms and attentive staff. Many reviewers praise its cozy, European ambiance and central location near Times Square and other attractions."
usa_new york city_the_jane,"The Jane Hotel is a retro/quirky, stylish, and charming microhotel with cabin-like rooms reminiscent of early 20th-century ship cabins, featuring wood-paneled rooms and old-school decor. It offers small but well-designed rooms with space-saving touches, shared bathrooms, and a cool bar."
usa_new york city_the_kimberly_hotel,"The Kimberly is a smaller, cozy suite hotel located in midtown with spacious rooms, kitchens, and comfortable beds. It is often mentioned as a great boutique hotel with excellent service and a convenient location near major attractions and transportation."
usa_new york city_the_lombardy,"The Lombardy is a small boutique hotel on 56th St between Park and Lex with individually owned studios or one-bedroom apartments, each decorated differently. The hotel is known for its spacious rooms, quiet atmosphere, and professional staff."
usa_new york city_the_london_nyc,"The London NYC is described as a chic, modern, and stylish boutique hotel with spacious, clean rooms, and double showers. It is known for its attentive staff and is located near Central Park, Times Square, and 5th Avenue."
usa_new york city_the_lucerne_hotel,"The Lucerne is described as a small, clean, and elegant boutique hotel with traditionally decorated rooms, a French bistro, and proximity to Central Park. It is located on the Upper West Side, near the subway and restaurants."
usa_new york city_the_manhattan_club,"I am sorry, but the provided hotel reviews do not offer enough information to determine if the hotel is a boutique hotel. The reviews focus on location, room size, cleanliness, and some service issues, but do not provide details about style, design, or personalized service that would classify it as a boutique hotel."
usa_new york city_the_mansfield,"The Mansfield is a small, older boutique hotel with stylish decor, marble staircases, and a library with free coffee; it is centrally located near Times Square. Rooms range from tiny to spacious suites and may have street noise, with small bathrooms, Aveda toiletries, and limited closet space."
usa_new york city_the_marcel_at_gramercy,"The Marcel at Gramercy is a modern, trendy, and stylish boutique hotel with small but clean rooms, and a rooftop terrace. It is located in the Gramercy Park area, near the subway, restaurants and bars."
usa_new york city_the_maritime_hotel,"The Maritime Hotel is a boutique hotel with a nautical theme, small rooms designed like ship cabins, porthole windows, and a hip atmosphere. It features a Japanese restaurant, Italian restaurant, and a lively bar scene."
usa_new york city_the_mark,"The Mark is located on the Upper East Side, close to museums, art galleries, Central Park, and upscale shopping. It was recently renovated in 2009, with large, modern rooms and marble bathrooms."
usa_new york city_the_marmara_manhattan_luxury_hotel_residence,"The Marmara Manhattan is an extended stay facility with spacious suites, full kitchens, and modern decor, located on the Upper East Side. Some suites have balconies and city views, and amenities include free WiFi, a fitness room, and laundry facilities."
usa_new york city_the_mave,"The MAve is a new, modern, and stylish boutique hotel located in midtown Manhattan, close to subway stops, Madison Square Park, and Union Square. The hotel offers small, clean rooms with H2O bathroom products, and a grab-and-go breakfast."
usa_new york city_the_mercer_hotel,"The Mercer is a trendy, understated boutique hotel with a chic, minimalist style, located in the heart of SoHo. It offers spacious rooms, luxurious bathrooms, and a comfortable lobby for hotel guests only."
usa_new york city_the_michelangelo_hotel,"The Michelangelo is a smaller, luxury, boutique hotel with spacious rooms for NYC that are sumptuously decorated in several styles. It is located close to Times Square, Broadway, 5th Avenue shops and Central Park."
usa_new york city_the_milburn_hotel,"The Milburn Hotel is not a luxury or ""classy"" hotel but gives itself the image of a European boutique hotel. It's described as a small and quiet hotel, with service exceeding expectations and a delightful refurbished lobby."
usa_new york city_the_muse_hotel_new_york_a_kimpton_hotel,"The Muse Hotel is a trendy, modern boutique hotel near Times Square, known for its comfortable beds and proximity to the Theater District. It features modern decor, Kimpton amenities, and a wine hour."
usa_new york city_the_new_york_helmsley,"I am sorry, I cannot provide an answer to your query using the provided reviews. The reviews do not contain information about the New York Helmsley being a boutique hotel. The reviews do mention that the hotel feels like a small hotel, but this statement is subjective and doesn't confirm the hotel is a boutique hotel."
usa_new york city_the_new_yorker_hotel,"This is a large Art Deco style hotel with older, small rooms, though many have been recently renovated. The hotel is conveniently located close to Penn Station, subway lines, and popular attractions like Macy's and the Empire State Building."
usa_new york city_the_pierre,"The Pierre is described as an old-world style boutique hotel with traditional decor, located on Fifth Avenue, across from Central Park. It is known for its personalized service, elevator operators, and a classic New York atmosphere."
usa_new york city_the_plaza,The reviews do not contain information about boutique hotels. The hotel has spacious rooms with butler service and is in a central location. Some rooms have views of the inner courtyard.
usa_new york city_the_pod_hotel,"The Pod Hotel is a funky and modern budget hotel with small, but well-designed rooms and shared or private bathrooms, located in Midtown East, close to subway stations and various attractions. It features a rooftop terrace, free Wi-Fi, and a lobby cafe, attracting a younger crowd."
usa_new york city_the_premier,"The Premier is a boutique hotel within the Millennium Broadway, offering concierge service, decent-sized rooms, and complimentary evening receptions and breakfast. Some rooms have views of the Chrysler Building and Times Square."
usa_new york city_the_ritz_carlton_new_york_central_park,"I am sorry, but the information provided does not contain a comparison to other boutique hotels in the area. The hotel offers a central location near Central Park, luxurious rooms, and high level service."
usa_new york city_the_roosevelt_hotel,"I am sorry, I cannot provide information to answer the query. The hotel reviews do not contain specific mentions about the hotel being a boutique hotel."
usa_new york city_the_sherry_netherland_hotel,"The Sherry-Netherland is a small, luxurious hotel with approximately 50 individually owned and furnished rooms/suites, offering a more intimate and personal experience than larger hotels. It is located on 5th Avenue, across from Central Park, and has an old New York feel."
usa_new york city_the_shoreham,"The Shoreham is a modern, trendy boutique hotel located in midtown Manhattan, close to shopping, Central Park, and museums. Rooms are noted as small, but clean, with comfortable beds, and a free coffee/espresso machine is available."
usa_new york city_the_st_regis_hotel_new_york,"This is a classically elegant and luxurious hotel with spacious rooms, marble bathrooms, and butler service; rooms feature high ceilings and antique furnishings. It is located in midtown Manhattan on 5th Avenue, close to Central Park and high-end shopping."
usa_new york city_the_standard_new_york,"The Standard Hotel in NYC is a trendy, modern, and stylish boutique hotel with floor-to-ceiling windows offering great views and unique video displays in the elevators. It is located in the Meatpacking District, near shops, restaurants, and the High Line, but some guests find the rooms small and the service inconsistent."
usa_new york city_the_surrey,"The Surrey is a smallish boutique hotel on the Upper East Side with large suites and a location one block from Central Park. It is known for its elegant decor, personalized service, and a restaurant, Cafe Boulud."
usa_new york city_the_sylvan_guest_house,"The Sylvan Guest House is located in Harlem, near a grocery store and multiple subway lines, including an express train to Manhattan. It is situated in a historical townhouse on Sylvan Terrace and offers apartments with equipped kitchens, living rooms, and African art decorations."
usa_new york city_the_time,"The Time is a modern boutique hotel located near Times Square with clean, but small rooms, and unique design; some rooms feature flat screen TVs and Bose stereos. The hotel has a trendy but loud bar, though rooms on higher floors are generally quiet."
usa_new york city_the_waldorf_astoria,"The reviews do not mention any boutique hotels. They describe the Waldorf Astoria as a large, historic hotel with old-world charm, traditional decor, and a grand lobby, but note that some rooms are dated and in need of updating."
usa_new york city_the_westin_new_york_at_times_square,"I am sorry, I cannot answer the query. This document contains reviews for the Westin New York at Times Square, not information about boutique hotels."
usa_new york city_thirty_thirty_hotel,"Hotel Thirty Thirty is a small boutique hotel with sleek accommodations and minimalist design. Some reviewers found it clean, comfortable, and modern, while others found the rooms small, cramped, and in need of renovation."
usa_new york city_thompson_les,"The Thompson LES is a modern, trendy boutique hotel with spacious rooms and floor-to-ceiling windows offering great views; it is located in the Lower East Side, close to restaurants, bars, and shopping in SOHO. The hotel features a bar and restaurant, though some reviews mention these were not always open, and amenities include Kiehl's toiletries and rain showers."
usa_new york city_travel_inn_hotel_new_york,"I am sorry, but the provided hotel reviews do not contain information about boutique hotels. Therefore, I cannot fulfill your request."
usa_new york city_tribeca_grand_hotel,"The Tribeca Grand is a trendy, modern boutique hotel located in downtown Manhattan, near Soho, Chinatown, and Little Italy, offering amenities like a lounge, gym, and movie screening area. Some guests mention noise from the bar, while others praise the friendly staff and convenient location near subway lines."
usa_new york city_trump_international_hotel_and_tower,"There is no mention of the hotel being a ""boutique hotel"" in the reviews. The hotel has 173 rooms."
usa_new york city_tudor_hotel_at_the_united_nations,"The Tudor Hotel, listed in the National Register of Historic Hotels, is described as charming and quaint with a small lobby. Some reviewers expected a boutique style hotel but found it plain, although recent renovations have been noted."
usa_new york city_vincci_avalon,"The Vincci Avalon is a smaller, European-style hotel with large, clean rooms for New York standards, with strong European character in decoration and service. It has a 1940s traditional style, and offers suites with marble bathrooms and separate showers."
usa_new york city_w_new_york_the_court,"W New York - The Court is described as a smaller, trendy boutique hotel with a dark and hip interior, a cool bar, and a residential feel. It is noted for its personalized service and proximity to Grand Central Station."
usa_new york city_w_new_york_the_tuscany,"W Tuscany is a smaller, boutique-style hotel with trendy decor, a small lobby, and rooms that are spacious for New York City standards. The hotel has a convenient location near Grand Central Station."
usa_new york city_w_new_york_times_square,"The W Times Square is a trendy, modern hotel with a hip atmosphere, sleek lobbies, and chic decor; however, some found the dark hallways and small rooms to be drawbacks. It is located in the heart of Times Square."
usa_new york city_w_new_york_union_square,"The W Union Square is described as having a boutique hotel feel, with a small lobby and trendy atmosphere. Its location in the Union Square neighborhood is noted for being in a more quiet and authentic part of Manhattan."
usa_new york city_waldorf_towers,"The Waldorf Towers is located in Midtown Manhattan and offers suites with a living room, office area, marble bathroom, and views of Park Avenue. Some reviewers describe it as having an old-world charm and elegant, spacious rooms, while others note that the hotel is showing its age with peeling wallpaper and outdated bathroom fittings."
usa_new york city_wall_street_inn,"The Wall Street Inn is a small, quiet boutique hotel located in the heart of the Financial District and near subway stations. It features a European-style decor, clean rooms, and a complimentary continental breakfast."
usa_new york city_warwick_new_york_hotel,"The Warwick is a historic Midtown Manhattan hotel with spacious rooms, some featuring balconies or terraces. It is located near Central Park, Times Square, and Fifth Avenue shopping."
usa_new york city_washington_jefferson_hotel,"The Washington Jefferson is described as a small, compact, and clean boutique hotel with a modern decor, and a marble lobby. It is located on a quiet side street in the Theater District, close to Times Square and other attractions."
usa_new york city_washington_square_hotel,"The Washington Square Hotel is a charming, older boutique hotel with a good location in Greenwich Village. It has small but clean rooms, an Art Deco-style lobby, and a restaurant serving complimentary continental breakfast."
usa_new york city_wellington_hotel,"The Wellington Hotel is described as old-fashioned and outdated, with some rooms recently renovated. It has clean rooms with small bathrooms, is located near Times Square and Central Park, and offers a restaurant and a gift shop."
usa_new york city_west_57th_street_by_hilton_club,"The West 57th Street by Hilton Club is a new, modern property with a studio apartment feel, featuring hardwood floors and marble showers. Rooms have a 37-inch LG high-def TV with digital cable, and the hotel has an Owners Lounge with continental breakfast and evening cocktails."
usa_new york city_wingate_by_wyndham_manhattan_midtown,"The Wingate by Wyndham Manhattan Midtown is described as a smaller hotel with attentive service, elegant yet unpretentious interior design, and newly renovated rooms. It has 6 rooms per floor."
usa_new york city_wolcott_hotel,"The Wolcott Hotel is an old-school budget hotel with large, clean rooms, though some bathrooms are small. It is centrally located near the Empire State Building, Macy's, and Times Square, and offers complimentary coffee and muffins."
usa_new york city_woogo_central_park,"Woogo Central Park Apartments is located on the Upper West Side, close to the subway and Central Park, offering apartment-style accommodations with kitchenettes. The building is old and rooms vary widely in cleanliness and repair, with some reports of pests, but the location is convenient."
usa_new york city_wyndham_garden_hotel_times_square_south,"The Wyndham Garden Hotel - Times Square South is described as a new, modern, and chic hotel with a ""Boutique-y"" feel, located in midtown Manhattan. Some reviews mention that it's a smaller hotel but well-designed and clean, with a warm and inviting atmosphere."
