Hotel,Summary
usa_new york city_helmsley_middletowne_hotel,"The Helmsley Middletowne has a convenient midtown location near Grand Central Station and multiple subway lines, with friendly and helpful staff. Rooms include amenities such as refrigerators, and in-room safes, and some have kitchenettes and multiple closets."
usa_new york city_hilton_club_new_york,"The Hilton Club offers a private check-in desk and dedicated elevators to suites located on the 37th and 38th floors. Complimentary breakfast, wireless access, a cocktail reception, gym, and business center are available, and the hotel is within walking distance of Rockefeller Plaza, Radio City Hall, Broadway, and Times Square."
usa_new york city_hilton_garden_inn_chelsea,"The Hilton Garden Inn Chelsea has friendly, helpful staff, is conveniently located near subway stations, and offers amenities like free Wi-Fi, a business center, and comfortable beds. The hotel's smaller size and focus on customer service create a welcoming atmosphere for solo travelers."
usa_new york city_hilton_garden_inn_new_york_west_35th,"The Hilton Garden Inn on 35th Street is centrally located with a subway stop right outside, close to Penn Station, and within walking distance of major attractions like Times Square and the Empire State Building. It's a newer hotel with clean rooms, free Wi-Fi, and helpful staff."
usa_new york city_hilton_garden_inn_times_square,"The Hilton Garden Inn Times Square is conveniently located near Times Square and subway lines, with many positive reviews mentioning helpful staff and a sense of security due to key checks at the elevators. The hotel offers amenities such as free internet, in-room fridges, and microwaves, which could make solo travel easier."
usa_new york city_hilton_garden_inn_tribeca,"The Hilton Garden Inn Tribeca is located above the A and C subway stop and two blocks from 1 and 9 lines, with the blue line right outside the front doors. The hotel offers free internet, a business center, and a gym."
usa_new york city_hilton_new_york,"The Hilton New York is in a great location and is a great base for touring New York from with 24/7 taxi service outside the front door. Staff is friendly, and the hotel is generally considered safe and secure."
usa_new york city_hilton_times_square,"The Hilton Times Square is in a great central location, has friendly, helpful, and courteous staff, and offers clean, quiet, and spacious rooms with comfortable beds. The hotel has entrances on 41st and 42nd streets, and requires guests to use their room key for elevator access."
usa_new york city_holiday_inn_express_new_york_city_fifth_ave,"The Holiday Inn Express 5th Avenue has a great central location that is within walking distance to many major attractions. There is also easy access to public transportation, with a nearby subway."
usa_new york city_holiday_inn_express_new_york_city_times_square,"The Holiday Inn Express Times Square is a new, clean hotel with small but comfortable rooms, free breakfast, and internet access. It is conveniently located near Times Square, Penn Station, and the Port Authority bus terminal."
usa_new york city_holiday_inn_express_nyc_madison_square_garden,"The hotel is conveniently located near Penn Station and several subway lines, making it easy to get around the city; the neighborhood is generally considered safe for walking alone at night. There are 3 computers in the lobby for free internet use and the staff can assist with taxis and directions."
usa_new york city_holiday_inn_manhattan_downtown_soho,"The Holiday Inn is in a convenient location with staff who are helpful with directions and the subway is close by. The hotel is clean, quiet, and safe."
usa_new york city_holiday_inn_midtown_57th_st,"The Holiday Inn Midtown has a rooftop pool and a gym, and is near the subway, Central Park, and 9th Avenue restaurants. Some reviewers noted feeling safe walking in the neighborhood and found it easy to get a cab."
usa_new york city_holiday_inn_nyc_manhattan_6th_avenue,"The hotel is in a central location, close to subway stations, and is easily walkable to many attractions like Times Square and Penn Station. The rooms are small, but clean and modern, with comfortable beds and free internet."
usa_new york city_hotel_17,"Hotel 17 offers small, clean, and quiet single rooms in a safe neighborhood near Union Square, with shared bathrooms that are regularly cleaned. The hotel is known for its helpful staff, European-style charm, and proximity to public transportation, making it a good value for budget-conscious solo travelers."
usa_new york city_hotel_31,"Hotel 31 is a clean, quiet, and safe budget hotel in midtown Manhattan, near the subway and many attractions. The rooms are small, but the shared bathrooms are clean and usually available, which is useful for solo travelers."
usa_new york city_hotel_373,"Hotel 373 is a small, clean, and modern hotel with friendly staff that is centrally located near many attractions and subway stations, making it easy to get around. The hotel offers a safe environment, and solo female travelers report feeling secure during their stays."
usa_new york city_hotel_41_at_times_square,"Hotel 41 is a small, clean, and secure hotel in Times Square with a friendly and helpful staff, offering free magazines, DVD rentals, and breakfast, making it a convenient and comfortable choice for solo travelers. The hotel has a great location close to public transport, is clean, and the staff offers assistance with directions and printing boarding passes."
usa_new york city_hotel_99,Hotel 99 is located on the Upper West Side and is close to the subway station. Some reviews mention that the staff were helpful and courteous.
usa_new york city_hotel_beacon,"The Hotel Beacon is located in the Upper West Side, near a subway stop, making it easy to get around the city, and has rooms with kitchenettes and a large grocery store across the street. Some reviewers found the hotel quiet and safe, with friendly staff, making it a good choice for solo travelers."
usa_new york city_hotel_chandler,"The Hotel Chandler has friendly, helpful, and attentive staff and is quiet, clean, and safe, with a good location near Penn Station and the subway. It offers free tea/coffee, computer use, and newspapers, with small but well-equipped rooms."
usa_new york city_hotel_deauville,"The Hotel Deauville is in an excellent location near the subway and within walking distance of many attractions, and the staff is friendly and helpful. The hotel is clean and safe, providing a comfortable place to sleep."
usa_new york city_hotel_east_houston,"The hotel offers helpful 24-hour front desk staff, a 24-hour rooftop terrace, and 24-hour use of computers in the basement, with a location that is an easy walk to subway stations. It is also close to many restaurants and shops."
usa_new york city_hotel_elysee,"Hotel Elysee is a smaller boutique hotel with a friendly and helpful staff, making guests feel welcome and secure. It offers amenities such as complimentary breakfast, afternoon snacks, evening wine, and free internet, providing a comfortable and convenient experience for solo travelers."
usa_new york city_hotel_gansevoort,"The Gansevoort Hotel has amenities like a rooftop pool, a gym, and a business center, and offers services like baggage handling and a concierge. The hotel is located in the Meatpacking District."
usa_new york city_hotel_giraffe,"Hotel Giraffe is praised for its friendly and helpful staff, convenient location near subway and restaurants, and amenities like complimentary breakfast, wine and cheese evenings, and free internet access. It offers a relaxed and welcoming atmosphere, with comfortable rooms and personal service."
usa_new york city_hotel_grand_union,"The Hotel Grand Union is centrally located with subway access, close to the Empire State Building, and offers clean, basic rooms, with friendly and helpful staff. The hotel has a free safety deposit box, luggage storage, and a cafe that adjoins it for breakfast."
usa_new york city_hotel_indigo_new_york_city_chelsea,"Hotel Indigo has a modern, minimalist design with spacious rooms, comfortable beds, and Aveda toiletries. It is located near Times Square, Herald Square, and multiple subway lines, but lacks amenities like a coffee maker and luggage stand."
usa_new york city_hotel_mela,"Hotel Mela has a great location off Times Square, a helpful staff, a gym, free wifi, and clean, well-appointed modern rooms, making it a good value for business travelers. It also offers H2O toiletries, and the staff will provide umbrellas on rainy days."
usa_new york city_hotel_metro,"The Hotel Metro has a safe for laptops and valuables and free Wifi, plus helpful reception staff that can give directions. The location is central, a few blocks from Penn Station, close to the subway, and within walking distance to many tourist spots."
usa_new york city_hotel_newton,"The Hotel Newton has safety deposit boxes, a luggage storage room, and is near a subway station. Many reviewers found the staff to be friendly and helpful."
usa_new york city_hotel_on_rivington,"The hotel is located in the Lower East Side, near multiple subway stops, and has a 24-hour front desk.  The neighborhood around the hotel has many shops and restaurants within walking distance."
usa_new york city_hotel_reserve,"Hotel Reserve is located in the Financial District, near several subway lines, and offers free Wi-Fi and a free computer for guest use. The staff is friendly and helpful, and the area is generally safe to walk around in, even late at night."
usa_new york city_hotel_st_james,"The St. James Hotel has a friendly and helpful staff, a 24/7 front desk, and a locker in which you can store your luggage. The hotel uses a physical key that guests must drop off at the front desk every time they leave the building."
usa_new york city_hotel_stanford,"The Hotel Stanford is located in midtown Manhattan, close to Penn Station, subways, and major attractions, and has 24-hour desk service and security. Room amenities include a safe, a refrigerator, and helpful staff that can provide directions and arrange transportation."
usa_new york city_hotel_wales,"Hotel Wales is described as quaint and friendly, with a helpful staff, and is located in a safe, upscale area close to museums and Central Park. The hotel offers amenities such as complimentary breakfast, a rooftop terrace, and a lounge with free internet access."
usa_new york city_hudson_hotel,"The Hudson Hotel has a hip, central location near Central Park and Columbus Circle subway station and efficient staff. The rooms are small and the lobby is dark, but amenities include a library bar, sky terrace, and unique design features."
usa_new york city_ink48_a_kimpton_hotel,"The Ink48 has a friendly and helpful staff, with some reviewers highlighting specific employees by name; the hotel also offers complimentary breakfast and evening wine receptions. The hotel is located a little out of the way, about a 10-15 minute walk to Times Square."
usa_new york city_inn_new_york_city,"The Inn provides a quiet, private, home-like atmosphere with personal touches and a fully stocked kitchen, allowing guests to feel like they have their own apartment in the city. The Inn has no sign and the staff is available but unobtrusive, allowing for a private experience."
usa_new york city_intercontinental_the_barclay_new_york,"The Barclay Intercontinental is noted for professional, discreet service, easy check-in/check-out, and convenient access to transportation and nearby amenities, contributing to a smooth and hassle-free experience. Many reviewers note the hotel's safe and central location for sightseeing and accessing various parts of Manhattan."
usa_new york city_jumeirah_essex_house,"The hotel is in a great location, across from Central Park, close to many attractions, and near subway stations. Security is emphasized through elevator greeters, and the hotel offers services such as a car within a 10-block radius."
usa_new york city_kitano_new_york,"The Kitano is a quiet and clean hotel located near Grand Central Station, with soundproof rooms and helpful staff. It has a Japanese theme with amenities like green tea, and is in a safe neighborhood."
usa_new york city_la_quinta_manhattan,"The La Quinta Manhattan is in a great central location near Penn Station and subway lines, making it easy to get around. Features like in-room safes, free internet, and a business center offer convenience for solo travelers."
usa_new york city_lafayette_house,"Lafayette House is a small, 15-room boutique hotel in the East Village decorated in an antique, Victorian style that offers a private, low-key experience, and is near many restaurants. The staff is responsive, but not always visible, and there is no 24/7 concierge service."
usa_new york city_le_parker_meridien,"Le Parker Meridien is well-situated near transportation, making it easy to get around, and the staff is generally helpful, with some reports of outstanding concierge service. A solo traveler may also appreciate the cozy lobby bar, late-night dining options, and comfortable rooms."
usa_new york city_library_hotel,"The Library Hotel provides a relaxing atmosphere and helpful service, with a central location near Grand Central Terminal and complimentary amenities like breakfast, snacks, and wine and cheese receptions. It is also noted to have a warm and welcoming atmosphere for solo travelers."
usa_new york city_loews_regency_hotel,"The Regency is known for its friendly staff who greet guests by name, as well as its central location near shops, museums, and transportation. The hotel is considered safe and secure, and the concierge is helpful with entertainment recommendations."
usa_new york city_lowell_hotel,"The Lowell is a small, intimate hotel on the Upper East Side, known for its personable service and quiet atmosphere, some rooms have kitchenettes. It is located in a residential neighborhood near Central Park and close to shopping."
usa_new york city_mandarin_oriental_new_york,"The Mandarin Oriental in New York offers a helpful staff, with concierges that can arrange transportation including hotel car service, and attentive room service, with many amenities to make a guest feel at home. The hotel also includes a business center that is open at all hours."
usa_new york city_milford_plaza_hotel,"The Milford Plaza is located in midtown Manhattan, close to Times Square, subway stations, and Broadway shows, and has good security with staff monitoring elevator access. Some reviewers noted the rooms are small and dated, but adequate for sleeping."
usa_new york city_millenium_hilton,"The Millenium Hilton is conveniently located near several subway lines, making it easy to access all parts of the city, and the staff is polite and discrete, catering primarily to business travelers. For solo travelers who prefer quiet, the hotel is located in the Financial District, which is less busy than Midtown."
usa_new york city_millennium_hotel_broadway,"The Millennium Broadway is conveniently located, with easy access to major attractions and transportation, contributing to a seamless travel experience. Helpful staff are available, and doormen provide assistance with taxis, making solo navigation easier."
usa_new york city_millennium_un_plaza_hotel,"The Millennium UN Plaza Hotel has taxis readily available, is located in a quiet area with easy access to the subway at Grand Central Station, and offers comfortable, clean, and large rooms with panoramic city views. The hotel is also near restaurants and shops, with friendly staff who provide helpful service."
usa_new york city_moderne_hotel,"The Moderne Hotel is a small, centrally located hotel with friendly and helpful staff, making it a safe and convenient base for exploring the city. It offers a cozy, quiet atmosphere, and a 24/7 coffee and tea lounge."
usa_new york city_morgans_hotel,"Morgans offers a convenient location near attractions and transportation, with friendly and helpful staff and a comfortable ""living room"" area for relaxation. The hotel provides amenities that make travel easier, such as a gym pass, complimentary breakfast, and assistance with directions or recommendations."
usa_new york city_murray_hill_east_suites,"Murray Hill East Suites is in a convenient and safe neighborhood with easy access to Grand Central Station, grocery stores, restaurants, and bars. The suites are spacious, clean, and equipped with a full kitchen, making it suitable for long stays and families."
usa_new york city_murray_hill_inn,"The Murray Hill Inn provides a secure environment for solo female travelers, with staff present at reception at all times and key access controlled. It's located in a safe, quiet neighborhood with easy access to transportation, and staff are helpful with directions."
usa_new york city_new_york_marriott_downtown,"The hotel is near major subway lines for easy access to all parts of Manhattan and is located in a safe, quiet part of downtown. The staff is professional, courteous, and helpful, providing a secure and welcoming environment."
usa_new york city_new_york_marriott_east_side,"The Marriott East Side is in a convenient location close to the subway, Grand Central Station, and other midtown locations. The hotel offers amenities such as a business center, concierge lounge, and fitness center."
usa_new york city_new_york_marriott_marquis,"The Marriott Marquis has simple and efficient elevators, helpful staff, and is centrally located to subway lines, Broadway shows, restaurants, and shops. There is also a tour/ticket agency, two Starbucks, and a business center in the hotel."
usa_new york city_new_york_palace_hotel,"The hotel provides bellhops, door service, concierge, efficient check-in, and luggage handling services. It offers a complimentary shuttle to the theater district, and is located close to transportation and major attractions."
usa_new york city_night_hotel,"The Night Hotel has friendly and helpful staff, offers a good location close to Times Square, and provides a safe and cozy atmosphere. There are also small storage spaces and cozy rooms that are well-equipped with comfortable beds."
usa_new york city_novotel_new_york_times_square,"The Novotel Times Square is in a great location for easy access to many attractions, and offers clean and comfortable rooms. The hotel has a friendly staff and a secure environment."
usa_new york city_off_soho_suites,"Off Soho Suites offers apartment-like suites with kitchens, catering to budget-conscious travelers with multiple subway lines nearby. The hotel provides a safe environment with staff present at the front desk and key access required at night."
usa_new york city_omni_berkshire_place,"The Omni Berkshire Place is known for its helpful and friendly staff, a convenient midtown location near shops and transportation, and clean, well-maintained rooms. Some reviewers note the hotel's small size gives it a boutique feel, while others appreciate the free beverage service for Select Guest members."
usa_new york city_on_the_ave_hotel,"The hotel has a convenient location near the subway and a safe neighborhood; TV, coffee, and blackout drapes are available in the room. The reviewer mentioned feeling safe and secure at the hotel while traveling alone."
usa_new york city_park_79_hotel,"The hotel's location is near the subway, Central Park, museums, shops and restaurants on the Upper West Side making it easy to get around. Some reviewers noted the friendly staff and that the neighborhood felt safe for walking alone at night."
usa_new york city_park_central,"The Park Central Hotel is conveniently located near a subway station, Central Park, Times Square, and various shops and restaurants, making it easy to get around and find necessities. The hotel also offers helpful concierge services and luggage storage."
usa_new york city_park_south_hotel,"The Park South Hotel is in a convenient location, close to a subway station, and offers amenities such as free internet, a business center, and a complimentary breakfast. The hotel is also known for being clean, quiet, and secure."
usa_new york city_peninsula_new_york,"The Peninsula New York offers bedside phone console to control lights and temperature, and technology in the rooms to view photos on a large screen. Rooms are noted for being quiet and comfortable for those traveling alone."
usa_new york city_phillips_club,"The Phillips Club offers studios, one, and two-bedroom suites with kitchens, catering to both short and long-term stays. The staff is known for providing top-notch service and can arrange various services like car service, in-room massage, and show tickets."
usa_new york city_plaza_athenee_hotel,"The Plaza Athenee is a smaller, intimate hotel with an almost residential feel, located on a quiet, tree-lined street on the Upper East Side, close to Central Park and Madison Avenue. Staff are attentive, courteous, and focused on the well-being of guests."
usa_new york city_radisson_martinique_on_broadway,"The hotel is centrally located near Penn Station, Times Square, and the Empire State Building, with subway access and airport transportation options; the doormen are friendly and helpful. Some reviewers mention feeling safe and well-assisted by staff."
usa_new york city_ramada_eastside,"The hotel is in a safe, quiet, residential neighborhood with good access to public transportation, and offers free amenities such as internet and breakfast. The hotel also has a helpful staff who can provide directions and arrange transportation."
usa_new york city_red_roof_inn_manhattan,"The Red Roof Inn Manhattan is conveniently located near Penn Station and subway lines, making it easy to get around, and many reviewers mention feeling safe in the area, even late at night, due to the bustling atmosphere of Korea Town. Some reviewers note the small room size, but that it is equipped with essential amenities like free WiFi, and a helpful concierge."
usa_new york city_renaissance_new_york_hotel_57,"The hotel is in a great midtown location near shops, Central Park, and subway stations. Concierge and door staff are helpful, and the hotel has a restaurant, bar, and new lounge."
usa_new york city_renaissance_new_york_hotel_times_square,"The Renaissance New York Times Square provides a secure environment with warm downlights near the entrance and friendly, helpful staff. Some reviewers noted feeling safe and comfortable alone at this centrally-located hotel, with easy access to transportation and attractions."
usa_new york city_residence_inn_by_marriott_times_square_new_york,"The hotel has a security presence and staff is helpful, with a concierge desk available for advice and recommendations; there are also 3 computers in the 3rd-floor lounge, all of which have printing capabilities. It is conveniently located near transportation and many attractions, and has blackout curtains, soundproofing, and in-room safes."
usa_new york city_ritz_carlton_battery_park,"The Ritz-Carlton Battery Park offers a quiet location away from midtown with large rooms and comfortable beds, with easy access to the subway. The hotel staff is known for being helpful and attentive."
usa_new york city_rockefeller_center_hotel,"The Rockefeller Center Hotel offers easy check-in/check-out via computer kiosks and keycard elevator access for security, with staff noted to be helpful and efficient. It also has free filtered water and internet access available."
usa_new york city_roger_smith_hotel,"The Roger Smith Hotel has a friendly and helpful staff, a lively bar and restaurant, and offers free internet and local calls. The hotel aims to make guests feel welcomed, comfortable, and at home."
usa_new york city_roger_williams_hotel,"The Roger Williams Hotel has friendly and helpful staff, and keycard access to the elevator. Also, the hotel is in a safe area that is not too busy, but close enough to everything."
usa_new york city_room_mate_grace,"Room Mate Grace is a smaller European style hotel that has a popular bar, nightly DJs, and pool parties; the staff is friendly, and the hotel has clean, well-organized rooms, free wifi, and a convenient Times Square location. Solo travelers can enjoy the pool bar and Brazillian night, and there is a 24-hour kiosk for drinks and snacks."
usa_new york city_royalton_hotel_new_york_city,"The Royalton is known for its attentive staff, who sometimes address guests by name, creating a personal touch. Concierges are available to provide recommendations."
usa_new york city_salisbury_hotel,"The Salisbury Hotel has friendly and helpful staff, is located near subway stations, and offers easy access to many restaurants and diners. It is described as a good, clean, safe spot to stay, and is in an area that feels safer late at night."
usa_new york city_san_carlos_hotel,"The San Carlos Hotel is known for its friendly and helpful staff, convenient location near attractions and subway lines, and clean, spacious rooms with amenities like microwaves and refrigerators. It also has a business center with free internet and printing, and is located in a safe neighborhood."
usa_new york city_seafarers_international_house,"Seafarers International House is a budget-friendly option in Manhattan, located near Union Square and major subway lines. It offers clean, basic rooms, some with private bathrooms, and provides amenities like free internet, laundry facilities, and luggage storage."
usa_new york city_sheraton_new_york_hotel_towers,"The Sheraton New York Hotel & Towers is in a central location close to subway lines and transportation. The hotel is also busy, which may appeal to solo travelers."
