Hotel,Summary
usa_new york city_the_mave,The Mave is in the midtown area of Manhattan and within walking distance of Madison Square Park and Union Square; it is also equidistant from uptown and downtown. The hotel is conveniently located near subway lines for easy access to other attractions.
usa_new york city_the_mercer_hotel,"The Mercer is located in SoHo, within walking distance of Greenwich Village, NoLita, and NoHo, and close to subway connections. It has a library in the lobby and is near many boutique-style shops."
usa_new york city_the_michelangelo_hotel,"The Michelangelo Hotel is centrally located near MOMA, Rockefeller Center, and within walking distance of Times Square and Broadway. The hotel has large, clean rooms, and is known for its helpful concierge service."
usa_new york city_the_milburn_hotel,"The Milburn Hotel is located on the Upper West Side, a few blocks from Central Park, and a 15-minute walk to the Metropolitan Museum of Art. Museum Mile is also accessible via crosstown bus."
usa_new york city_the_muse_hotel_new_york_a_kimpton_hotel,"The Muse Hotel is centrally located a short walk from Times Square, and convenient to Rockefeller Center, Central Park and 5th Ave. The hotel features trendy, recently renovated rooms, comfortable beds, and a wine hour."
usa_new york city_the_new_york_helmsley,"The New York Helmsley is located in midtown Manhattan, close to Grand Central Station, Times Square, and the Chrysler Building. Some reviews mention a view of the Empire State Building."
usa_new york city_the_new_yorker_hotel,The New Yorker Hotel is centrally located near Penn Station and Madison Square Garden. Some rooms have views of the Empire State Building or the Hudson River.
usa_new york city_the_pierre,"The Pierre is located on Fifth Avenue, across from Central Park, and within walking distance of Museum Mile. A cheap cab ride from the hotel can take you to just about anywhere in the city."
usa_new york city_the_plaza,"The Plaza Hotel is located at the south end of Central Park on 5th Ave, equidistant between the Guggenheim, the Metropolitan Museum, MoMA, and Broadway theaters. It is also a stone's throw from the high-end 5th Avenue stores."
usa_new york city_the_pod_hotel,"The Pod Hotel is located in Midtown East and is within walking distance of MOMA. It is a few blocks from the E and 6 subway lines, allowing easy access to any part of Manhattan."
usa_new york city_the_premier,"The Premier is located half a block from Times Square on 44th street, within walking distance of The Empire State Building, Central Park, and Grand Central Station. The hotel is connected to the Millenium Broadway."
usa_new york city_the_ritz_carlton_new_york_central_park,The Ritz-Carlton Central Park is located within walking distance of MOMA. Guests can walk to the shopping area near 5th avenue.
usa_new york city_the_roosevelt_hotel,"The Roosevelt Hotel is located in midtown Manhattan near Grand Central Station, Times Square, and 5th Avenue. Some reviewers mention walking to many attractions and cultural venues from the hotel."
usa_new york city_the_sherry_netherland_hotel,"The Sherry-Netherland is located across from Central Park and close to MOMA. It is within walking distance of museums, Broadway theaters, and Rockefeller Center."
usa_new york city_the_shoreham,"The Shoreham Hotel is centrally located in midtown, near MOMA and within walking distance of other museums, as well as Central Park and 5th Avenue. Some reviewers mention the hotel's modern, stylish decor, while others note that rooms can be small."
usa_new york city_the_st_regis_hotel_new_york,"The St. Regis is located on 5th Avenue and 55th Street, within walking distance of art galleries and museums like MoMA. The hotel sometimes offers packages that include breakfast."
usa_new york city_the_standard_new_york,"The Standard Hotel is in the Meatpacking District, near Chelsea art galleries. The High Line Park is nearby and gives a great chance to explore the area."
usa_new york city_the_surrey,"The Surrey is located on the Upper East Side, a few blocks from the Metropolitan Museum, and within walking distance of the Met and Whitney. It is also a block away from Central Park."
usa_new york city_the_sylvan_guest_house,"Sylvan Guest House is located in Harlem, close to the Jumel Mansion, the oldest house in Manhattan. It is accessible to downtown Manhattan via the 163rd street Metro and express train."
usa_new york city_the_time,The Time Hotel is located near Times Square and within walking distance of Rockefeller Center. Some reviewers mention that it is a short subway ride to the Museum Mile.
usa_new york city_the_waldorf_astoria,"The Waldorf Astoria is located within walking distance of MOMA and is near a subway station for easy access to other parts of the city. It is a historical landmark hotel with some mentions of ""old world glamour"" and specific praise for its lobby."
usa_new york city_the_westin_new_york_at_times_square,The Westin New York at Times Square is within walking distance to museums such as the Metropolitan and Hayden. It is also near the subway for easy access to other locations.
usa_new york city_thirty_thirty_hotel,Hotel Thirty Thirty is located near the museum district via the subway and within walking distance to many attractions. The hotel is described as a good base for sightseeing.
usa_new york city_thompson_les,"The Thompson LES is located within walking distance of the East Village and Soho. It is near a subway stop, which can take you to various parts of the city."
usa_new york city_travel_inn_hotel_new_york,"The Travel Inn is located within walking distance of Times Square, and subway stations facilitate access to uptown areas, where some art museums can be found. One reviewer mentioned easy access to the Met Museum of Art, and another mentioned walking to some museums."
usa_new york city_tribeca_grand_hotel,"The hotel is in a convenient location in walking distance to Soho, Chinatown, and Little Italy, and close to all the cool neighborhoods. It is located near subway lines and is within walking distance of Greenwich Village."
usa_new york city_trump_international_hotel_and_tower,"The hotel is located near Central Park, Lincoln Center, and Columbus Circle, providing access to cultural attractions and is within walking distance of Times Square and Fifth Avenue. Some suites feature views of Central Park, and the hotel offers a car service for transportation."
usa_new york city_tudor_hotel_at_the_united_nations,"The Tudor Hotel is located on the east side of midtown Manhattan, near Grand Central Station and a few blocks from the subway; some reviewers mention walking to museums. This location is described as central but quiet, with easy access to transportation and walkable access to Midtown sites."
usa_new york city_vincci_avalon,"The Vincci Avalon is centrally located in Manhattan, close to the Empire State Building and a short walk from the NY Library; Some reviewers mention the hotel's proximity to museums in general, while others mention The Native American Museum. The location is convenient to subway lines for accessing Central Park and other parts of Manhattan."
usa_new york city_w_new_york_the_court,"W New York - The Court is located in midtown Manhattan, close to Grand Central Station and within walking distance of Park Avenue. It is also near the Chrysler Building and a few blocks from the subway."
usa_new york city_w_new_york_the_tuscany,"The W Tuscany is located near Grand Central Station, putting it within walking distance or a short subway ride to many places in Manhattan. The hotel is close to Midtown, and some reviewers found it walkable to museums."
usa_new york city_w_new_york_times_square,"The W Times Square is centrally located and within walking distance to a variety of museums. Some reviewers recommend it for business and solo travelers due to its chic, trendy atmosphere, upstairs lobby bar, and modern amenities."
usa_new york city_w_new_york_union_square,"The W Union Square is near a subway, allowing easy access to downtown or uptown, and is within walking distance of the Village, Soho, East Village, Tribeca, and the Meat Packing district. It is not especially close to museums, but convenient subway access makes them relatively accessible."
usa_new york city_waldorf_towers,"The Waldorf Towers is centrally located in Midtown Manhattan, within walking distance of many city highlights. It is also in easy reach of the Broadway Theatres, Empire State Building, Times Square, and Central Park."
usa_new york city_wall_street_inn,"The Wall Street Inn is located in downtown Manhattan, near the Wall Street subway station, which provides access to the subway system for reaching destinations such as the Metropolitan Museum of Art on 72nd street. It is about 15 minutes by train to Times Square."
usa_new york city_warwick_new_york_hotel,"The Warwick Hotel is located across the street from the Museum of Modern Art (MOMA) and near the American Folk Art Museum, and offers easy access to museums along 5th Avenue. The hotel has a history related to the arts, including murals in the restaurant."
usa_new york city_washington_jefferson_hotel,The Washington Jefferson Hotel is within walking distance of MOMA and close to the subway for access to other museums. Some reviewers mentioned art vendors in the Greenwich/Soho/West Village area accessible from the hotel.
usa_new york city_washington_square_hotel,"Washington Square Hotel is located in Greenwich Village, near NYU and a subway station, with easy access to downtown Manhattan. Reviews mention that MOMA is a taxi ride away and the hotel displays art deco touches with black and white photos of movie stars."
usa_new york city_wellington_hotel,"The Wellington Hotel is near MoMA, and a couple of blocks from the Broadway Theater area. Some reviewers mention seeing the hotel's sign on the cover of Buenavista Social Club's CD ""BSC at Carnegie Hall""."
usa_new york city_west_57th_street_by_hilton_club,"The hotel is centrally located in Manhattan, within walking distance of the Museum of Art & Design and the Museum of American Folk Art. It is also a few minutes' walk from Columbus Circle and Lincoln Center."
usa_new york city_wingate_by_wyndham_manhattan_midtown,"I am sorry, but the provided hotel reviews do not contain any information about proximity to art museums."
usa_new york city_wolcott_hotel,"I am sorry, but this document does not contain information about the proximity of this hotel to the best art museums."
usa_new york city_woogo_central_park,"Woogo Central Park Apartments is located on the Upper West Side, within walking distance of Central Park and a short subway ride to Times Square. It is located near the Dakota building and a few blocks from Lincoln Center."
usa_new york city_wyndham_garden_hotel_times_square_south,"The Wyndham Garden Hotel - Times Square South is located in Midtown Manhattan, within walking distance of Times Square, Penn Station, and the Theater District. It is near subway lines and is convenient to transportation."
