Hotel,Summary
usa_new york city_3_west_club,"I am sorry, but the reviews do not mention any art museums near the hotel. The hotel is near St. Patrick's Cathedral, Rockefeller Center, and Radio City Music Hall."
usa_new york city_414_hotel,"I am sorry, but none of the reviews mention the art museums, so I cannot fulfill your request."
usa_new york city_60_thompson,"60 Thompson is located in SoHo, within walking distance of galleries and lower Manhattan. The hotel is near a subway station, providing access to other areas of the city."
usa_new york city_6_columbus,"6 Columbus is in a great location for Lincoln Center, the theater district, and Central Park, all within walking distance. The hotel is located near a subway station, making it easy to visit museums throughout the city."
usa_new york city_70_park_avenue_hotel_a_kimpton_hotel,"70 Park Avenue is conveniently located in midtown Manhattan, near Grand Central Station, and within walking distance of several sights, shops, and restaurants. Some reviewers mention it's a short walk to the Empire State Building, and a comfortable walk to Times Square and 5th Avenue."
usa_new york city_ace_hotel_nyc,"The hotel is within walking distance of Chelsea and a quick subway trip to other Manhattan sights. The hotel is also near the Herald Square subway station, which has connections to the four main boroughs."
usa_new york city_affinia_50,The Affinia 50 is located within walking distance of MOMA and other major attractions. There are two subway stations within a block or two.
usa_new york city_affinia_dumont,"The Affinia Dumont is located near the 6 train, which provides easy access to uptown museums, and is within walking distance of the Chrysler Building. The hotel offers spacious rooms with kitchenettes."
usa_new york city_affinia_gardens,The Affinia Gardens is located on the Upper East Side and is within walking distance of museums and art galleries. The hotel is also close to Central Park and the subway.
usa_new york city_affinia_manhattan,"The Affinia Manhattan is located in Midtown, within walking distance of Chelsea and 10-20 minutes from Chelsea. It is close to Penn Station, subway lines, Times Square, and the Empire State Building."
usa_new york city_affinia_shelburne,"The hotel is located in midtown, within walking distance of Grand Central station, and a ""leisurely 10-15 minute walk away"" from attractions. It is in a residential area, away from the craziness of Times Square."
usa_new york city_aka_united_nations,"The AKA United Nations is located within walking distance of the UN and a short walk from Grand Central Terminal. The hotel is near a corner store and a supermarket, and provides complimentary breakfast on weekdays."
usa_new york city_algonquin_hotel,"The Algonquin Hotel is located near Times Square and 5th Avenue, within walking distance of various attractions. It is also close to subways for getting around."
usa_new york city_americana_inn,"I'm sorry, but none of the hotel reviews mention art museums. Therefore, I cannot provide a summary that includes details about proximity to the best art museums."
usa_new york city_amsterdam_court_hotel,The Amsterdam Court Hotel is within walking distance of MoMA (10 minutes) and the Met and Guggenheim (less than an hour). The hotel is located near subway lines that provide access to museums and other attractions throughout the city.
usa_new york city_astor_on_the_park,"The Astor on the Park is located across from Central Park and near the 103rd and 110th street subway stations, with some rooms offering a view of Central Park. Some reviews mention that it is a short walk across the park to the Guggenheim Museum."
usa_new york city_bedford_hotel,"The Bedford Hotel is centrally located in midtown Manhattan, near Grand Central Station. It is within walking distance of the Empire State Building and Times Square."
usa_new york city_beekman_tower_hotel,"The Beekman Tower is located in midtown Manhattan, about a 20-minute walk to major attractions and a 10-minute walk to the nearest subway; some reviewers found the location convenient to the UN. The hotel has a restaurant/bar on the top floor with city views, and it is near bus lines that stop across the street."
usa_new york city_belleclaire_hotel,"The Belleclaire Hotel is located on the Upper West Side, within walking distance of the Metropolitan Museum of Art, Natural History Museum and the Guggenheim, and near the 72nd and 79th street subway stops. Some reviewers mention that the hotel is close to Central Park, where the Metropolitan Museum of Art is located."
usa_new york city_bentley_hotel,"The Bentley Hotel is located on the upper east side, a 15-minute walk to the Museum Mile; some rooms have East River views. The hotel is a few blocks from the bus and subway with convenient access to museums."
usa_new york city_best_western_bowery_hanbee_hotel,"The Best Western Bowery Hanbee is located near the SOHO area, and within walking distance of Tribeca, Soho, Greenwich, and the Financial District. It is also a short walk to subway stations with connections to uptown and downtown."
usa_new york city_best_western_convention_center_hotel,This hotel is located in an industrial area about a 15-minute walk to Times Square. The hotel is also near Penn Station and a short walk from the subway.
usa_new york city_best_western_hospitality_house,The hotel is located in Midtown East and within walking distance of museums. Some reviews mention the Museum of Modern Art.
usa_new york city_best_western_seaport_inn_downtown,"This hotel is located in the extreme south of Manhattan, near the Brooklyn Bridge and the Seaport. It is a 15-minute subway ride to the heart of Manhattan."
usa_new york city_blue_moon_hotel,"The Blue Moon Hotel has artsy paintings and is located in the Lower East Side, near historic Orchard Street. The hotel has art and memorabilia related to 1930s and 1940s celebrities."
usa_new york city_broadway_plaza_hotel,"I'm sorry, but the provided hotel reviews do not mention proximity to art museums."
usa_new york city_buckingham_hotel,"The Buckingham Hotel is located in midtown Manhattan, within walking distance of MOMA and other attractions. Some rooms have a music theme and apartment-style layouts with kitchens, while others are smaller and more dated."
usa_new york city_candlewood_suites_new_york_city_times_square,"The Candlewood Suites Times Square is located a 5-10 minute walk from Times Square and close to the Port Authority bus terminal and Penn Station. It is near restaurants in Hell's Kitchen and Restaurant Row, and about a 5-7 minute walk from Madison Square Garden."
usa_new york city_carlton_arms,"The Carlton Arms is an artsy, budget-friendly hotel where each room is uniquely decorated by a different New York artist. Located in midtown Manhattan, it's within walking distance of several subway stops."
usa_new york city_carvi_hotel_new_york,"The hotel is located in midtown, on E 55th, and is convenient to subway lines. Some reviewers mentioned being closer to the East Village, West Village, and lower Manhattan."
usa_new york city_casablanca_hotel,"This hotel is near the heart of Times Square and many different subway lines. It is within walking distance of Broadway theaters, Grand Central Station, Penn Station, and many major attractions in NYC."
usa_new york city_chambers_hotel,The Chambers Hotel is near Fifth Avenue shops and sights. The hotel has interesting art pieces on the walls in the hallway.
usa_new york city_chelsea_lodge,"Chelsea Lodge is located in the Chelsea neighborhood, near the Chelsea art galleries. It is also located within walking distance of the subway and a short subway ride to museums."
usa_new york city_chelsea_pines_inn,Chelsea Pines Inn is located in the Chelsea/Meatpacking district and is within walking distance of art galleries. The Inn provides a daily newsletter on what is going on in the City.
usa_new york city_chelsea_savoy_hotel,"The Chelsea Savoy is located in the Chelsea neighborhood, near the 1, 2, 3, 9, A, C, E, V, and F subway lines, within walking distance of art galleries. Some reviewers mention that it is also walkable to Times Square, Greenwich Village and the Meatpacking district."
usa_new york city_city_club_hotel,"I am sorry, but the provided hotel information does not mention any art museums."
usa_new york city_clarion_collection_the_solita_soho_hotel,"The Solita Soho is located near Soho, Greenwich Village, and the East Village. It is within walking distance of many restaurants, shops, and Chinatown."
usa_new york city_club_quarters_downtown,"This hotel is located in the Financial District, far from the main tourist attractions, but near several subway lines that provide access to other parts of Manhattan. It is a short subway ride to Broadway and other attractions."
usa_new york city_club_quarters_midtown,"The hotel is located in Midtown Manhattan, within walking distance of Times Square, 5th Avenue, Grand Central Station and Rockefeller Center. There is free wireless internet, a lounge with computers, and a small gym."
usa_new york city_club_quarters_rockefeller_center,"Club Quarters Rockefeller Center is located a block away from MoMA. The hotel is also within walking distance of other attractions like Times Square, 5th Avenue, and Central Park."
usa_new york city_comfort_inn_chelsea,"The Comfort Inn Chelsea is in Chelsea, near the Flatiron Building, and within walking distance of Lower Manhattan, the Village, Union Square, Times Square, Herald Square, and many shops. The hotel is near the subway with access to uptown and downtown."
usa_new york city_comfort_inn_manhattan,"The Comfort Inn Manhattan is centrally located near the Empire State Building and Macy's, and is within walking distance to Times Square. Some museums, such as The Frick, are accessible by bus."
usa_new york city_comfort_inn_manhattan_bridge,"The hotel is located in Chinatown, near the Financial District, SoHo, and Little Italy. It's also close to several subway lines, providing easy access to Midtown."
usa_new york city_comfort_inn_midtown,"The Comfort Inn Midtown is conveniently located near the Metropolitan Museum of Art. It is also within walking distance of other attractions, including Rockefeller Center and NBC studios."
usa_new york city_comfort_inn_midtown_manhattan,"This hotel is located in the heart of the theater district, right off Times Square. It is within walking distance of many restaurants, and subway and bus stops are within one block."
usa_new york city_comfort_inn_midtown_west_convention_center,This hotel is located within walking distance of Times Square. Subway and bus stops are also nearby.
usa_new york city_comfort_inn_times_square,"This hotel is located a 10-20 minute walk from Times Square, and near the subway; multiple reviewers noted its central location provides convenient access to the city. One review mentions a 20 minute walk to 5th Avenue."
usa_new york city_cooper_square_hotel,"The Cooper Square Hotel is located in the Bowery/East Village area, close to Greenwich Village and within walking distance of Soho. It is also conveniently located near several subway lines."
usa_new york city_cosmopolitan_hotel_tribeca,"The Cosmopolitan Hotel is located in the Tribeca area, within walking distance of Soho and Greenwich Village.  It is a short subway ride from Midtown, with easy access to many subway lines, allowing access to museums."
usa_new york city_courtyard_by_marriott_new_york_manhattan_times_square_south,"This Courtyard is located near Bryant Park, Times Square, and Fifth Avenue, and within walking distance of Midtown sights. The hotel is within walking distance of many activities/places."
usa_new york city_courtyard_by_marriott_new_york_manhattan_upper_east_side,"The Courtyard Upper East Side is near Museum Mile and within walking distance of the Metropolitan Museum of Art, the Guggenheim, and the Cooper-Hewitt. The hotel is located on the Upper East Side and is convenient to museums by foot or bus."
usa_new york city_courtyard_new_york_manhattan_fifth_avenue,The Courtyard Marriott is located near the New York Public Library off of 5th avenue and is within walking distance to the MOMA. It is also near Grand Central station which allows easy access to subway lines.
usa_new york city_courtyard_new_york_manhattan_midtown_east,"The Courtyard Midtown East is within walking distance of MOMA and other museums, as well as shopping on 5th Avenue, Central Park, and other attractions. Subway access is nearby for access to other areas of Manhattan."
usa_new york city_crosby_street_hotel,The Crosby Street Hotel is located in the heart of Soho. The hotel's decor is described as being like a museum.
usa_new york city_crowne_plaza_times_square_manhattan,"This hotel is located in the heart of Times Square, close to several subway stations and within walking distance of many attractions. A stay at this location allows access to many shops, restaurants and Broadway shows."
usa_new york city_da_vinci_hotel,The Da Vinci Hotel is located near Central Park and Columbus Circle. It is within walking distance of Times Square and the theater district.
usa_new york city_doubletree_guest_suites_times_square,"I am sorry, but there is no information about art museums in the reviews, so I cannot provide a response."
usa_new york city_doubletree_hotel_chelsea_new_york_city,"The Doubletree Hotel Chelsea is within walking distance of Chelsea galleries, and a short taxi ride to other locations. Some rooms have views of the Empire State Building."
usa_new york city_doubletree_metropolitan_hotel,The Doubletree Metropolitan is within walking distance of Central Park and a 10 minute walk to Rockefeller Center. The Metropolitan also has easy access to the subway.
usa_new york city_dream,The Dream Hotel is centrally located near Central Park and uptown museums. It's a few blocks from Times Square and has a subway station nearby.
usa_new york city_duane_street_hotel,"I am sorry, there is no information about nearby art museums in the reviews. However, this hotel is located in Tribeca and is within walking distance of SoHo and the Village."
usa_new york city_dylan_hotel,"The Dylan Hotel is located near the New York Public Library, and within walking distance of many tourist attractions. It is also close to Grand Central Station."
usa_new york city_eastgate_tower,"The Eastgate Tower is located in midtown Manhattan, within walking distance of Grand Central Station. Some rooms have views of the Chrysler building and the UN."
usa_new york city_econo_lodge_times_square,"I am sorry, but none of the reviews mention any art museums. They do mention Times Square, Broadway Theatres and Restaurant Row."
usa_new york city_embassy_suites_hotel_new_york_city,"This hotel is located at the end of Manhattan, a 25 dollar taxi fare to mid-town, and not conveniently located to the subway. Subway stop a few blocks away makes it easy to visit the rest of Manhatten."
usa_new york city_empire_hotel,The Empire Hotel is across the street from Lincoln Center and near Columbus Circle and Central Park. It is within walking distance of museums and other attractions.
usa_new york city_envoy_club,"Envoy Club is located in midtown Manhattan, near the Empire State Building, and within walking distance of some shops. The closest subway is about a 10-15 minute walk from the hotel."
usa_new york city_eurostars_wall_street,"The hotel is located in the Financial District, near Wall Street and close to the South Street Seaport. Subway access for uptown is located two blocks away."
usa_new york city_excelsior_hotel,"The Excelsior Hotel is located in the Upper West Side, across the street from the Museum of Natural History and a short walk across Central Park to the Metropolitan Museum of Art and the Guggenheim. The hotel is also near a subway station for easy access to other parts of the city."
usa_new york city_fairfield_inn_new_york_manhattan_times_square_south,"This hotel is located in midtown Manhattan, a few blocks from Times Square, and a short (5 cab) ride to 5th Ave and Central Park. The subway is close to the hotel."
usa_new york city_fitzpatrick_grand_central_hotel,"The Fitzpatrick Grand Central is located near Grand Central Station, within walking distance of Times Square and Bryant Park. It is also a short walk to the United Nations."
usa_new york city_fitzpatrick_manhattan,"The Fitzpatrick Manhattan is in a great location for walking or public transport, and within walking distance to museums. The hotel is located between the Museums, Central Park, and the madness of Times Square and Broadway."
usa_new york city_flatotel,"The Flatotel is located near the MOMA (Museum of Modern Art), and within walking distance of Times Square, 5th Avenue, and Central Park. It offers spacious rooms with amenities like kitchenettes, and access to a gym with city views."
usa_new york city_four_points_by_sheraton_manhattan_chelsea,"The Four Points Sheraton Chelsea is in the Chelsea neighborhood, near Chelsea art galleries and the West Village. It is within walking distance of some places, and has easy access to the subway."
usa_new york city_four_points_by_sheraton_manhattan_soho_village,"The Four Points SoHo is located near the SoHo and Greenwich Village neighborhoods, a short walk from the Spring St subway station. It is also within walking distance of art galleries, shops, and restaurants."
usa_new york city_four_points_by_sheraton_midtown_times_square,"This hotel is near Times Square, Hells Kitchen, and the Bus Terminal. It is within walking distance of Times Square and all Broadway theaters."
usa_new york city_four_seasons_hotel_new_york,The hotel is located on 57th Street between Madison and Park Avenue. It is within walking distance of Central Park.
usa_new york city_gild_hall,"This hotel is located in the Financial District, a bit out of the way from areas like SoHo, the Lower East Side, the East Village, or Chelsea. However, the hotel is close to the subway, with the Fulton Station providing access to other parts of the city."
usa_new york city_gramercy_park_hotel,"The Gramercy Park Hotel displays original art in the lobby, bars, and rooms, including pieces by Schnabel, Basquiat, Hirst, and Warhol. The hotel is located in the Gramercy Park neighborhood."
usa_new york city_grand_hyatt_new_york,"The Grand Hyatt is located in midtown, next to Grand Central Station, near many subway lines and within walking distance of the Chrysler Building. One reviewer mentioned the hotel is within walking distance of 5th Avenue, Times Square, and the Rockefeller Center, as well as a short walk to Bryant Park."
usa_new york city_greenwich_hotel,"The Greenwich Hotel is located in Tribeca, a few minutes walk from Soho, and a couple of blocks from the Hudson River. The hotel is decorated in a European style, with a courtyard and lounge for guests."
usa_new york city_hampton_inn_35th_st_empire_state_building,"The Hampton Inn is near the Empire State Building and Macy's, and a short subway ride from Times Square and the theater district. It is also within walking distance of Rockefeller Center."
usa_new york city_hampton_inn_madison_square_garden,"This hotel is located within walking distance of the Empire State Building, Rockefeller Center, and Times Square. The hotel is near subway stations providing access to downtown and uptown."
usa_new york city_hampton_inn_manhattan_chelsea,"The Hampton Inn Chelsea is within walking distance of the galleries in Chelsea and Greenwich Village, and a reasonable walk or short subway ride to the Metropolitan Museum of Art. The hotel is near subway lines that provide access to museums in other parts of Manhattan."
usa_new york city_hampton_inn_manhattan_soho,"The Hampton Inn SoHo is located near art galleries and is a short walk from SoHo, Greenwich Village, and the West Village. It is also near the trendy neighborhood of Tribeca."
usa_new york city_hampton_inn_manhattan_times_square_south,This hotel is within walking distance of mid-town attractions such as Rockefeller Center. A subway entrance is one block away.
usa_new york city_hampton_inn_new_york_seaport_financial_district,"This hotel is located in the Financial District/Seaport area, a short subway ride or taxi to other parts of Manhattan. Subway access allows travel to areas with museums, though not within immediate walking distance."
usa_new york city_helmsley_middletowne_hotel,"The Helmsley Middletowne is within walking distance of MoMa, and near a subway station for access to the museum district. The hotel is located in midtown Manhattan."
usa_new york city_hilton_club_new_york,The hotel is located within a 5-minute walk to Times Square and Central Park.
usa_new york city_hilton_garden_inn_chelsea,"The Hilton Garden Inn Chelsea is located in the Flower District and is described as a short subway ride or 25-minute walk to Greenwich, with easy access to subway lines. It is located near Chelsea, Soho, and the Village."
usa_new york city_hilton_garden_inn_new_york_west_35th,"This Hilton Garden Inn is near the Museum of Natural History, and is halfway between Central Park/Upper East Side/Museum Mile and the south of the island. The hotel is located within walking distance of Times Square, the Empire State Building, Penn Station, and a subway station."
usa_new york city_hilton_garden_inn_times_square,The Hilton Garden Inn Times Square is within walking distance of MoMA and has subway access one block away. The hotel is near a Grayline tour pick-up point and is close to many restaurants.
usa_new york city_hilton_garden_inn_tribeca,The Hilton Garden Inn Tribeca is located near the Soho area and within walking distance of the West Village. The hotel is located above the A and C subway stop and two blocks from the 1 and 9 lines.
usa_new york city_hilton_new_york,"The Hilton New York is centrally located and a short walk from MoMA, Radio City Music Hall, and Rockefeller Center. It is close to Central Park, Times Square, and Fifth Avenue."
usa_new york city_hilton_times_square,"The Hilton Times Square is centrally located on 42nd Street near Times Square, with subway access and close proximity to Broadway theaters. Rooms start above the 20th floor, providing quiet and city views, and some rooms offer Empire State Building views."
usa_new york city_holiday_inn_express_new_york_city_fifth_ave,The Holiday Inn Express 5th Avenue is within walking distance of MOMA. The hotel is also a short subway or taxi ride away from other attractions.
usa_new york city_holiday_inn_express_new_york_city_times_square,"I am sorry, but the reviews do not mention proximity to art museums. However, the hotel is located in midtown Manhattan near Times Square, Penn Station, and Port Authority bus terminal."
usa_new york city_holiday_inn_express_nyc_madison_square_garden,The hotel is one block from the Fashion Institute of Technology. Chelsea is within realistic walking distance.
usa_new york city_holiday_inn_manhattan_downtown_soho,The Holiday Inn is located near Soho and within walking distance of Little Italy. It is a few blocks away from Broadway.
usa_new york city_holiday_inn_midtown_57th_st,The Holiday Inn Midtown is within walking distance of MoMA and near Columbus Circle. There are breakfast options available.
usa_new york city_holiday_inn_nyc_manhattan_6th_avenue,"The hotel is near Chelsea which is close to galleries, and it's a short subway ride to Times Square and the West Village. It is located between 6th and 7th Ave on 26th street."
usa_new york city_hotel_17,"Hotel 17 is in a good location for exploring Manhattan, with easy access to the subway at Union Square. The hotel is near parks like Gramercy, Stuyvesant & Union Square, and in walkable distance to Madison, Tompkins & Washington squares."
usa_new york city_hotel_31,"Hotel 31 is centrally located in midtown Manhattan with easy access to the subway. Several reviewers mention its proximity to attractions such as the Empire State Building, Times Square, and Grand Central Station."
usa_new york city_hotel_373,"Hotel 373 is centrally located in midtown Manhattan on 5th Avenue, close to the Empire State Building and within walking distance of Times Square. The hotel is also near subway stations, providing access to other parts of the city."
usa_new york city_hotel_41_at_times_square,"Hotel 41 is located near Times Square and close to attractions like Bryant Park; it is also a short walk to MOMA. The hotel provides access to the subway and is described as central for exploring Midtown, Chelsea, and Hell's Kitchen."
usa_new york city_hotel_99,"Hotel 99 is located on the Upper West Side of Manhattan, with easy subway access to Times Square. The hotel was still under construction during the time of these reviews, and some guests reported issues with safety and being relocated."
usa_new york city_hotel_beacon,The Hotel Beacon is located on the Upper West Side near Central Park and within walking distance of the Natural History Museum. Some rooms have views of Central Park.
usa_new york city_hotel_chandler,"The Hotel Chandler is within walking distance of museums; reviewers mention walking to the Metropolitan Museum of Art, and Museum Mile. It is also close to the subway for easy access to uptown."
usa_new york city_hotel_deauville,"Hotel Deauville is located in midtown Manhattan, within walking distance of many attractions and a few minutes from the nearest subway station (6 line). Some rooms have views of the Empire State Building."
usa_new york city_hotel_east_houston,"The hotel is in a great location with easy access to Soho, Noho & Greenwich village on foot, and close to museums and galleries. The hotel is within walking distance to the subway, shopping, and restaurants."
