Hotel,Summary
usa_new york city_skyline_hotel,"The hotel is in a quiet location, a reasonable distance from New York, and has a bell captain that is especially helpful finding taxis when needed. The hotel is also within easy walking distance of Time Square and all the shops."
usa_new york city_smyth_hotel_a_thompson_hotel,"The hotel is conveniently located near the subway, making it easy to travel around Manhattan, and the staff is helpful and friendly. Some reviewers appreciated the quietness and calming atmosphere."
usa_new york city_sofitel_new_york,"The Sofitel New York is praised for its helpful and friendly staff, with many reviews highlighting the concierge service. Features like clean, quiet, and well-equipped rooms, a gym, and a central location near attractions and transportation options can contribute to a stress-free stay."
usa_new york city_soho_grand_hotel,"The Soho Grand Hotel has friendly staff, a business center, and is well-located near shops and restaurants in the Soho area, with the subway nearby for convenient access to the rest of the city. As a grand guest, travelers can get free beverages and snacks, and the hotel has a business center for work needs."
usa_new york city_soho_house_new_york,"The hotel has helpful front desk staff who are always happy to chat and book things, and the concierge has more clout than a standard hotel concierge. There are always taxis parked outside and there is free wi-fi everywhere."
usa_new york city_stay,"The Stay Hotel is located near Times Square and many subway lines, but only has two small elevators which can be slow. The rooms are small and can be noisy, but the hotel offers a business center with free internet."
usa_new york city_the_alex_hotel,"The Alex Hotel has a friendly staff, offers suites with full kitchens, and is centrally located near Grand Central Station, making it easy to access various parts of Manhattan. The hotel also has amenities like a business center and a gym."
usa_new york city_the_belvedere,"The Belvedere Hotel is centrally located, near Times Square, subway stations, and attractions, with generally friendly and helpful staff and doormen. The hotel offers clean rooms and amenities like a gift shop and luggage storage."
usa_new york city_the_benjamin,"The Benjamin is located near the subway and various activities; the staff is very helpful, remembers names, and aims to meet needs immediately. Each room comes equipped with business amenities like a fax machine, workspace, and a pillow menu to provide comfort."
usa_new york city_the_blakely_new_york,"The Blakely is a smaller boutique hotel with an attentive staff, offering a ""home away from home"" atmosphere, and is centrally located. Rooms include kitchenettes and comfortable beds."
usa_new york city_the_bowery_hotel,"The Bowery Hotel provides a safe atmosphere for solo travelers, with its convenient location to many neighborhoods, well-stocked minibars including essentials, and friendly staff that are helpful and attentive. The hotel also uses a classic key system where guests can drop off keys at the front desk."
usa_new york city_the_bryant_park,"The Bryant Park Hotel offers a central Manhattan location near transportation and Bryant Park, with staff noted to be helpful, courteous, and attentive to detail, ensuring a safe and comfortable stay. Rooms are spacious, well-equipped, and cleaned regularly, with amenities like sound machines and blackout options, though solo travelers may find limited communal areas."
usa_new york city_the_carlton,"The hotel offers clean, comfortable and quiet rooms, and is centrally located with easy access to subway lines; it's near Grand Central, Empire State Building and delis. Some reviewers noted the staff was courteous, and the concierge was helpful with directions."
usa_new york city_the_carlyle_a_rosewood_hotel,"The Carlyle has a personal, caring staff composed of career hotel professionals who aim to make your stay pleasant, and offer prompt service. They also offer discrete service, catering to celebrities who want to be left alone."
usa_new york city_the_franklin,"The Franklin Hotel offers a comfortable and clean stay with a friendly and helpful staff, complimentary breakfast, a 24/7 coffee and tea bar, and evening wine and cheese. Its Upper East Side location is near the subway, Central Park, and museums, although rooms tend to be small."
usa_new york city_the_french_quarters_guest_apartments,"The French Quarters Guest Apartments is a small, friendly hotel with a warm and welcoming atmosphere, located close to Times Square and subways. The staff is helpful and accommodating, offering personalized service, remembering guests' names, and providing information and directions."
usa_new york city_the_gem_hotel_chelsea,"The Gem Hotel Chelsea has small, clean, modern rooms with comfortable beds, good showers, and amenities like free Wi-Fi, bottled water, and coffee makers. The hotel's location in Chelsea is convenient to public transportation, restaurants, and attractions, with friendly and helpful staff."
usa_new york city_the_gem_hotel_midtown_west,"The hotel is located a few blocks from Penn Station, but some reviewers mention that the surrounding streets can feel unsafe to walk alone at night. Some guests also mentioned the staff was helpful in giving directions and advice."
usa_new york city_the_gem_hotel_soho,"The Gem Hotel SoHo is located near multiple subway lines and downtown neighborhoods, including the Lower East Side, Little Italy, and Chinatown, with a Whole Foods across the street. The staff is friendly and helpful, offering recommendations and directions, and the hotel provides amenities like free Wi-Fi, coffee, and the option to have food delivered."
usa_new york city_the_grant_hotel,"The Grant Hotel is a budget-friendly option near the subway, with small rooms and shared bathrooms; some rooms have been renovated. It is located in a safe neighborhood with nearby grocery stores and restaurants."
usa_new york city_the_hampton_inn_times_square_north,"The Hampton Inn Times Square North has helpful staff, great location, and key-secured elevators, and the front desk is staffed 24/7. Guests also appreciate the safety of the location."
usa_new york city_the_helmsley_carlton_house,"The Helmsley Carlton House is located on the upper east side of Manhattan, one block from Central Park, and offers spacious rooms, including suites with kitchenettes. The hotel has elevator operators and has contracted a minibus service for guests."
usa_new york city_the_helmsley_park_lane,"The Helmsley Park Lane is favorably located near Central Park, subway stations, and various attractions like Times Square and 5th Avenue, with some rooms offering views of Central Park and the city. The hotel provides services such as helpful concierge, responsive reception, room service, and easy access to transportation."
usa_new york city_the_herald_square_hotel,The Herald Square Hotel has lockers available for luggage storage and offers a free coffee/tea machine in the lobby. Some reviewers mention feeling safe at the hotel and that the staff is helpful.
usa_new york city_the_hotel_91,"Hotel 91 is located in the heart of Chinatown, close to the subway and within walking distance of Little Italy, with staff that are helpful in providing directions. The hotel has a 24/7 lounge with complimentary tea and coffee, and a night clerk that can help with the thermostat."
usa_new york city_the_hotel_at_times_square,"The Hotel at Times Square is in a safe tourist area with easy access to Times Square, Rockefeller Center, and 5th Avenue shopping. The hotel has a helpful staff, iPod docking stations, and free computers, and the rooms have two locks and are quiet."
usa_new york city_the_inn_at_irving_place,The Inn at Irving Place is located in a quiet area of Manhattan and has attentive staff. Some reviewers describe it as feeling like a home rather than a hotel.
usa_new york city_the_iroquois,"The Iroquois is a smaller, intimate hotel with a friendly staff that offers personal service and remembers guests by name, with a library for internet access. The hotel is described as having a great location and is a good value, offers free wi-fi, and provides a cozy atmosphere."
usa_new york city_the_jane,"The Jane Hotel offers small, cabin-like rooms with shared bathrooms, suitable for solo travelers looking for a clean and safe place to stay in a convenient West Village location near subway and bus lines. It provides amenities like free WiFi, flatscreen TVs, and helpful staff, with some long-term residents adding to the hotel's unique atmosphere."
usa_new york city_the_kimberly_hotel,"The Kimberly is known for its friendly staff, with reports of employees remembering guests' names, providing excellent service, and creating a welcoming atmosphere. The hotel offers spacious suites, including options with kitchens, which can make guests feel more at home."
usa_new york city_the_lombardy,"The Lombardy is a small, quiet boutique hotel with spacious studio or one-bedroom apartments, each individually decorated and equipped with a kitchen. It is centrally located on 56th St, near restaurants, shops, and the subway, making it easy to access various parts of Manhattan."
usa_new york city_the_london_nyc,"The London NYC's rooms have soundproofing and blackout curtains, is near Times Square and Central Park, and offers a free car service to locations between 34th and 74th streets. The rooms also have iPod docking stations and free WiFi."
usa_new york city_the_lucerne_hotel,"The Lucerne is known for its helpful and attentive staff, convenient access to transportation (subway and buses), and a safe, quiet Upper West Side location. Past guests appreciated the hotel for being clean, comfortable, and providing great value."
usa_new york city_the_manhattan_club,"The Manhattan Club is centrally located near Times Square, Central Park, and subway entrances, making it easy to get around Manhattan. The hotel offers spacious one-bedroom suites with kitchenettes, providing convenience for meals and leftovers."
usa_new york city_the_mansfield,"The Mansfield Hotel is a small, clean boutique hotel with a central location, praised for its helpful staff and complimentary amenities like coffee, tea, and breakfast. Many reviews mention the hotel's comfortable common areas, including a library/lounge and bar."
usa_new york city_the_marcel_at_gramercy,"The Marcel is a small, modern hotel with a friendly and helpful staff, making it a good option for solo travelers. There is also a business lounge and rooftop terrace where guests can relax."
usa_new york city_the_maritime_hotel,"The Maritime Hotel has small, well-designed rooms with comfortable beds and high-quality toiletries, and offers free wifi and a business center. It's located in Chelsea, near subway stations and attractions, with a helpful staff and several restaurants, making it convenient for solo travelers."
usa_new york city_the_mark,"The Mark offers services such as on-call doctors, car service, and concierge assistance for booking reservations and show tickets. Some reviewers highlight the helpfulness and attentiveness of the staff."
usa_new york city_the_marmara_manhattan_luxury_hotel_residence,"The Marmara Manhattan offers apartment-style rooms with full kitchens, providing a home-like environment with amenities like free Wi-Fi and helpful staff and is located in a residential area on the Upper East Side, near subway stations for easy access to the city. Some reviewers noted feeling like a ""native New Yorker"" due to the location and apartment-style accommodations."
usa_new york city_the_mave,"The Mave hotel is centrally located in Manhattan with easy access to subway lines and various attractions. The staff is known to be friendly, helpful, and provide personalized recommendations."
usa_new york city_the_mercer_hotel,"The Mercer has a friendly and helpful staff, with a comfortable lobby area where only hotel residents can eat or drink, creating a tranquil environment. The hotel also offers assistance with restaurant reservations and directions, as well as providing amenities such as complimentary passes to a nearby gym."
usa_new york city_the_michelangelo_hotel,"The Michelangelo Hotel is a smaller, luxury boutique hotel that is well-located, clean, and offers a calm respite from the city. The staff is helpful and friendly, and they remember guests by name."
usa_new york city_the_milburn_hotel,"The Milburn Hotel on the Upper West Side offers a safe neighborhood, proximity to subway stops, and a helpful staff, creating a comfortable environment for independent travelers. Additionally, there are small kitchenettes in the rooms."
usa_new york city_the_muse_hotel_new_york_a_kimpton_hotel,"The Muse Hotel is a smaller, more intimate boutique hotel located close to Times Square, with clean and modern rooms. The hotel staff is friendly and aims to provide outstanding customer service."
usa_new york city_the_new_york_helmsley,"The Helmsley is in a great central location, near Grand Central Station with many major attractions within walking distance. The hotel is very clean and has helpful staff, providing a safe and secure environment for solo travelers."
usa_new york city_the_new_yorker_hotel,"The New Yorker Hotel is located near Penn Station, has friendly staff, and provides clear directions; there is 24/7 security and it is easy to get to the subway. There are multiple facilities within the hotel, including a diner, restaurant, gift shop, gym, and business center."
usa_new york city_the_pierre,"The Pierre is known for its professional and attentive staff, elevator operators, and white glove service. The hotel provides a courtesy car and is located in a safe area with staffed elevators and high floors that have few rooms and no long corridors."
usa_new york city_the_plaza,"The hotel offers butler service, a concierge, and a car service that will take guests within 25 blocks of the Plaza. The staff is attentive and can assist with transportation needs."
usa_new york city_the_pod_hotel,"The Pod Hotel offers a convenient location near subway lines and major attractions, with small but well-designed rooms including amenities like a sink and iPod docking station. It is often praised as clean and safe, particularly for solo travelers, and has a friendly and helpful staff."
usa_new york city_the_premier,"The Premier is a boutique hotel within the Millenium Broadway that offers concierge service, free breakfast, and a complimentary evening reception. Rooms are modern, comfortable, and well-laid out with amenities like flat-screen TVs."
usa_new york city_the_ritz_carlton_new_york_central_park,"The Ritz Carlton Central Park has impeccable service and staff that know your name and are helpful with any requests, making it a great location for shopping and close to the subway. The hotel also has a concierge and complimentary Bentley for transportation."
usa_new york city_the_roosevelt_hotel,"The Roosevelt Hotel is conveniently located near Grand Central Station, providing easy access to transportation and making it a safe and friendly option for solo female travelers. The hotel offers services such as luggage storage and helpful staff, making it a manageable experience for those traveling alone."
usa_new york city_the_sherry_netherland_hotel,"The Sherry-Netherland has a small, intimate atmosphere with staff that greet guests by name and provide highly personal service. It is primarily a residential building with individually owned and decorated rooms, offering a ""luxury apartment"" feel with amenities like fresh flowers, chocolates, and complimentary beverages."
usa_new york city_the_shoreham,"The Shoreham Hotel is located in midtown Manhattan, close to many attractions and subway stations, and offers amenities such as free internet access, a gym, and a 24-hour cappuccino/espresso machine, and generally helpful front desk staff. Some reviewers found the hotel provided a safe, convenient and comfortable experience, with small but stylish rooms."
usa_new york city_the_st_regis_hotel_new_york,"The St. Regis provides butler service, which includes complimentary coffee/tea, garment pressing, and shoe shining. The hotel has a central location near shopping and Central Park with staff that anticipate your needs."
usa_new york city_the_standard_new_york,"The hotel has compact but functional rooms with comfortable beds, as well as a sexy, chic, and trendy style. It is located in the Meatpacking District close to shops, restaurants, and transportation, and provides nice views of the Hudson."
usa_new york city_the_surrey,"The Surrey is located on the Upper East Side in a relatively quiet neighborhood, with friendly and helpful staff and doormen who assist with groceries and cabs. It has spacious suites with kitchenettes and is close to Central Park, museums, and grocery stores."
usa_new york city_the_sylvan_guest_house,"The Sylvan Guest House is located in Harlem, near a grocery store and multiple subway lines, including an express train to Manhattan. Some reviewers mention feeling safe and comfortable in the neighborhood, and the guesthouse itself is described as clean and comfortable, making it feel like home."
usa_new york city_the_time,"The Time Hotel is in a great location with Times Square literally around the corner; door staff are helpful, and guests have felt safe entering and leaving the hotel alone at night. The rooms are modern, clean, and well-equipped, though some guests found them small."
usa_new york city_the_waldorf_astoria,"The doormen are helpful in hailing cabs, the concierge is knowledgeable, and the hotel provides luggage assistance. The hotel is centrally located and offers easy access to transportation."
usa_new york city_the_westin_new_york_at_times_square,"The Westin Times Square is praised for being safe and well-located, as well as having upscale amenities; some reviews noted that the location is convenient for solo travelers who want to be close to Times Square and Broadway. Reviews also highlighted that the hotel is located near many transportation options, making it easy to get around the city."
usa_new york city_thirty_thirty_hotel,"The Thirty Thirty Hotel offers a convenient midtown Manhattan location near the subway, Grand Central Station, and the Empire State Building. Some reviewers note the hotel's small rooms and friendly staff."
usa_new york city_thompson_les,"The Thompson LES is in a convenient location near subway lines and within walking distance of multiple neighborhoods like SOHO, Chinatown, and the East Village. Staff are generally helpful, with doormen who can assist with transportation."
usa_new york city_travel_inn_hotel_new_york,"The Travel Inn is located in Manhattan on 42nd street, close to Times Square and public transportation, and offers clean rooms. The hotel has security measures such as a garage, a security guard, and a location across from a police station."
usa_new york city_tribeca_grand_hotel,"The Tribeca Grand is known for its friendly and helpful staff, convenient location near subway lines, and overall excellent service. It is near popular destinations such as SoHo, Chinatown, and Little Italy."
usa_new york city_trump_international_hotel_and_tower,"The Trump International Hotel is known for its impeccable service, with staff often anticipating needs and offering personalized attention. The hotel provides amenities such as complimentary drinks upon arrival, free local calls, and personalized stationery."
usa_new york city_tudor_hotel_at_the_united_nations,"The Tudor Hotel is located in a quiet area of the city, a few blocks from Grand Central station, with easy access to subways and buses; the rooms have amenities such as in-room safe, coffee maker, iron, and trouser press and some reviewers mention the staff being helpful. The hotel is located near the UN, close to the East River and requires either a cab or a bus trip to Grand Central to access the subway."
usa_new york city_vincci_avalon,"The Vincci Avalon has been recommended for solo travelers due to its central location, proximity to subway stations (making it easy to access all parts of Manhattan), and its reputation for safety in the neighborhood. Amenities like in-room safes, helpful bellhops, and free internet in the lobby may be useful for solo travelers."
usa_new york city_w_new_york_the_court,"The W New York - The Court is located in midtown Manhattan, close to Grand Central Station and transportation, making it easy to get around the city; the staff is friendly and can provide assistance. The hotel provides car service and a concierge to help with guest needs."
usa_new york city_w_new_york_the_tuscany,"The W Tuscany is near Midtown Tunnel, Grand Central Station, and various subway lines, which makes getting in, out, and around town effortless. Check-in/out is fast and friendly, and the hotel offers a free Acura car service within Manhattan."
usa_new york city_w_new_york_times_square,"The W Times Square is a cool, modern hotel with attentive staff who greet guests as individuals and try to accommodate requests; it is also work-friendly, offering plenty of outlets and workspace. As a solo traveler, one reviewer reported consistently positive experiences at this hotel."
usa_new york city_w_new_york_union_square,"The W Union Square is in a central location with many nearby shops and subway access, and a smaller, more intimate atmosphere than larger chain hotels. The staff is friendly and accommodating, and the hotel can arrange anything, with convenient services like quick room service, concierge, and bellhops."
usa_new york city_waldorf_towers,"The Waldorf Towers offers a private entrance and check-in for a more exclusive experience, with staff known to be attentive and helpful. Suites are spacious, providing a comfortable and quiet retreat from the busy city."
usa_new york city_wall_street_inn,"The Wall Street Inn is described as a small, quiet, and clean hotel in the Financial District. It is located near subway stations, making it convenient to access other parts of the city."
usa_new york city_warwick_new_york_hotel,"The Warwick is a historic hotel centrally located near many attractions and public transportation, and some reviewers felt safe and secure as a single female traveler. The hotel offers amenities like a bar, good restaurant and helpful staff."
usa_new york city_washington_jefferson_hotel,"The hotel is in a great location with easy access to Times Square, the subway, and many restaurants, and the staff is friendly and helpful. Some rooms are small, but clean and well-equipped with comfortable beds, a safe, and helpful staff."
usa_new york city_washington_square_hotel,The Washington Square Hotel is in Greenwich Village near a subway station with friendly staff and is located in a safe neighborhood with a security guard in the lobby. Rooms include a safe and the staff can help with booking tours.
usa_new york city_wellington_hotel,"The Wellington Hotel is in a central location with a subway station outside, and offers friendly staff, along with safety deposit boxes. While some rooms are small and noisy, the hotel provides a convenient base with helpful services like arranging transportation."
usa_new york city_west_57th_street_by_hilton_club,The hotel staff learns guests' names and helps with tasks such as hailing a taxi and making reservations. The hotel offers room service with large portions and an owner's lounge for coffee and snacks.
usa_new york city_wingate_by_wyndham_manhattan_midtown,"The Wingate offers a convenient location near Penn Station and multiple subway lines, making it easy to get around Manhattan. The hotel is also praised for its friendly staff and included amenities such as free Wi-Fi and breakfast."
usa_new york city_wolcott_hotel,"The Wolcott Hotel is in a central location with friendly staff, and rooms include a safe; lockers are available for storing luggage and the hotel offers an airport booking-in computer. The location is near many attractions and subway stations, and the hotel provides coffee and muffins in the morning."
usa_new york city_woogo_central_park,"Woogo Central Park provides 24/7 security and a doorman, but no overall service. Note that the front desk is only staffed from 8 am-10 pm."
usa_new york city_wyndham_garden_hotel_times_square_south,"The Wyndham Garden Hotel has a friendly and helpful staff, as well as free internet and workspace in the lobby, which could make traveling alone easier. Additionally, the hotel is located close to Penn Station, making transportation convenient."
