Hotel,Summary
usa_new york city_3_west_club,"The 3 West Club is favorably located near Rockefeller Center and St. Patrick's Cathedral. The hotel has a helpful and friendly staff, and clean rooms."
usa_new york city_414_hotel,"The 414 Hotel is a small, quiet hotel with friendly staff who are ready to help, and offers a breakfast to start the day. The hotel is in a central location near Times Square, and several reviewers mention feeling safe in the neighborhood, which could be a plus for solo travelers."
usa_new york city_60_thompson,"60 Thompson is a stylish, modern hotel in SoHo with friendly and helpful staff. The hotel is located in a quiet area close to shops, restaurants, and transportation, and offers amenities such as a rooftop bar and comfortable rooms."
usa_new york city_6_columbus,"6 Columbus is a small, modern, and stylish hotel with a convenient location near Central Park and the Columbus Circle subway stop. The staff is friendly, helpful, and known to address guests by name, and the hotel provides amenities like umbrellas and Dean & Deluca snacks."
usa_new york city_70_park_avenue_hotel_a_kimpton_hotel,"70 Park Avenue Hotel has a friendly and helpful staff, is well-situated near Grand Central, and offers iPod docking stations. It also has a wine reception in the lobby every evening where guests can meet each other."
usa_new york city_ace_hotel_nyc,"The Ace Hotel has small standard rooms and larger suites and is located near Penn Station and several subway lines. The hotel offers free Wi-Fi, and the staff are friendly and helpful."
usa_new york city_affinia_50,"The hotel is praised for its friendly and helpful staff, with doormen greeting guests by name and offering a ""welcome home,"" which may contribute to a sense of comfort while traveling alone. Additionally, the hotel's location provides easy access to transportation, restaurants, and attractions, which can streamline the experience of solo travel."
usa_new york city_affinia_dumont,"The hotel is noted for being clean, quiet, and secure, with friendly and helpful staff that make guests feel at home. The hotel is conveniently located near transportation, shops, and restaurants, making it easy to explore the city."
usa_new york city_affinia_gardens,"The hotel is configured more like a residential building than a hotel, with a small, intimate reception area that puts you directly onto 64th Street as you leave. Rooms include a fully equipped kitchenette which allows you to eat in the room."
usa_new york city_affinia_manhattan,"The Affinia Manhattan is located across from Penn Station, making travel effortless, and many reviewers found the staff to be helpful, polite, and knowledgeable. The studio rooms have kitchenettes, which can make solo trips easier."
usa_new york city_affinia_shelburne,"The hotel offers comfortable, quiet rooms with options for single travelers, and the helpful staff is often commended for providing excellent directions and recommendations; it's located in Murray Hill, near Grand Central station and other Midtown attractions. Some reviewers mentioned feeling safe in the neighborhood while walking alone at night."
usa_new york city_aka_united_nations,"AKA United Nations offers spacious, modern apartments with full kitchens, comfortable beds, and friendly staff. The location is convenient to Grand Central Terminus and the UN, with services and amenities like complimentary breakfast and a 24-hour gym."
usa_new york city_algonquin_hotel,"The Algonquin Hotel has a friendly and helpful staff, as well as small but comfortable rooms, making it a good fit for solo travelers. The doormen are welcoming, and the hotel's intimate and comfortable atmosphere provides a sense of safety."
usa_new york city_americana_inn,"The Americana Inn has secure entry, friendly staff, and is in a central location near major attractions and public transportation, making it a great choice for lone travelers. Rooms are cleaned daily, and luggage storage is available for late departures."
usa_new york city_amsterdam_court_hotel,"The Amsterdam Court Hotel is centrally located near Times Square and subway lines, making it easy to get around the city, though some rooms are small, dark, and may have noise issues. The hotel offers helpful staff, free coffee, and luggage storage, but lacks some amenities like easily accessible outlets, good lighting, and consistent hot water."
usa_new york city_astor_on_the_park,"The Astor on the Park is located near the subway, has a helpful staff, and offers clean and comfortable rooms, making it a good base for exploring the city. It is also frequented by European guests."
usa_new york city_bedford_hotel,"The Bedford Hotel is near Grand Central Station, offering easy subway access to the city. The hotel is in a safe and quiet area, has friendly staff, and offers a luggage storage service after checkout."
usa_new york city_beekman_tower_hotel,"The Beekman Tower Hotel has friendly staff, is located in a safe area, and rooms include a kitchenette for convenient meals. Rooms are spacious, offer privacy and quiet, with apartment-like suites that make long stays comfortable for solo travelers."
usa_new york city_belleclaire_hotel,"The Belleclaire Hotel is impeccably clean, offers modern decor, a friendly staff, and shared bathrooms are accessible only to the three rooms sharing it, providing a sense of security. There is also a helpful bellboy and a 24-hour diner across the street for convenient meals."
usa_new york city_bentley_hotel,"The Bentley is a smaller hotel with a boutique-like feeling with pleasant and friendly staff, creating a special feeling and upgraded rooms if available. The area is a nice quiet area where people always felt safe."
usa_new york city_best_western_bowery_hanbee_hotel,"The Best Western Bowery Hanbee is located in Chinatown/Little Italy, close to subway stations, making it easy to get around Manhattan. The hotel staff is friendly and helpful with directions and information, and the area is considered safe to walk around at any hour."
usa_new york city_best_western_convention_center_hotel,"The hotel is located in an industrial area with a 24-hour auto repair shop across the street and train tracks nearby, but is within walking distance of Times Square and the Javits Convention Center; some reviewers mention feeling safe walking alone at night, but others advise caution. The hotel offers basic amenities like free WiFi and continental breakfast, and some rooms have in-room safes."
usa_new york city_best_western_hospitality_house,"Best Western Hospitality House offers spacious apartment-style rooms with full kitchens, providing a comfortable and independent stay. The hotel's central location allows for easy access to many attractions, and the friendly staff can assist with directions and recommendations."
usa_new york city_best_western_seaport_inn_downtown,"The Seaport Inn offers a quiet, clean, and comfortable stay in lower Manhattan, with easy access to transportation, the Financial District, and local attractions. It includes free amenities like breakfast and internet, and is staffed with friendly personnel."
usa_new york city_blue_moon_hotel,"The Blue Moon Hotel is a small, renovated tenement building with a friendly staff, 24-hour front desk, and a lobby where guests can use a laptop. It is located in the Lower East Side, near the Tenement Museum, with subway access nearby."
usa_new york city_broadway_plaza_hotel,"The Broadway Plaza Hotel is centrally located with easy access to the subway, and the staff is friendly and helpful. The area is safe and quiet after working hours."
usa_new york city_buckingham_hotel,"The Buckingham Hotel is known for its friendly and helpful staff, making guests feel welcome and supported. The hotel's location near Central Park, Carnegie Hall, and subway lines also makes it easy to get around the city."
usa_new york city_candlewood_suites_new_york_city_times_square,"The Candlewood Suites Times Square offers suites with full kitchens including a full-size refrigerator, and provides free in-room wireless internet and a free laundry room. It is located a 5-10 minute walk from Times Square and close to public transportation at Port Authority and Penn Station."
usa_new york city_carlton_arms,"The Carlton Arms is near a college, making the neighborhood safe, and is close to subway stops, restaurants, and shopping. The staff is friendly and helpful, and the hotel has a cat."
usa_new york city_carvi_hotel_new_york,"The Carvi Hotel offers a clean, quiet, and comfortable stay with amenities like a coffee maker, free HBO, and marble bathrooms. It's conveniently located near subway lines and essential stores like Starbucks and CVS."
usa_new york city_casablanca_hotel,"The Casablanca Hotel is a small, quiet, and clean hotel just steps from Times Square with friendly and helpful staff available to provide information. It has amenities such as free breakfast, wine and cheese in the evening, and 24/7 access to coffee, tea, and snacks, which can make solo travel easier."
usa_new york city_chambers_hotel,"Chambers Hotel is a stylish boutique hotel located just off 5th Avenue, with small but well-designed rooms that feature modern decor, sketch pads, and Bumble & Bumble bath products; it has a helpful staff and is near shops, restaurants, and attractions. Some reviewers mention excellent service and a quiet atmosphere."
usa_new york city_chelsea_lodge,"Chelsea Lodge is known for its cleanliness, safety, and reasonable prices, offering a cozy and homely atmosphere, making it a great option for solo female travelers in New York. The staff is helpful, and the hotel is located in a safe neighborhood, close to subway stations and local amenities."
usa_new york city_chelsea_pines_inn,"Chelsea Pines Inn has friendly and helpful staff, and the hotel provides a daily newsletter on local events; it is conveniently located near the subway. The Inn has a warm, welcoming, and charming atmosphere, with a garden in the back for coffee."
usa_new york city_chelsea_savoy_hotel,"The Chelsea Savoy Hotel is in a convenient location close to subway lines, making it easy to get around the city, and offers basic amenities like complimentary coffee and pastries. It is also near restaurants, delis, and stores."
usa_new york city_city_club_hotel,"City Club Hotel is a small, intimate hotel with a central Midtown location, offering a quiet and upscale environment, though some reviewers note the rooms can be dark and small. The hotel provides services such as turn-down with cookies and a DVD library, and staff members have been described as helpful and friendly."
usa_new york city_clarion_collection_the_solita_soho_hotel,"The Solita SoHo is a small, modern hotel in a convenient downtown location near Chinatown, Little Italy, and SoHo, with friendly and helpful staff. Rooms include amenities like free internet, flat-screen TVs, and comfortable beds."
usa_new york city_club_quarters_downtown,"Club Quarters Downtown is a clean, modern, and secure hotel in the Financial District, near several subway lines and provides easy check-in/check-out via kiosks with free internet access. The hotel has guest closets with self-serve extra amenities, offers delivery from nearby restaurants, and is generally quiet, especially on weekends."
usa_new york city_club_quarters_midtown,"Club Quarters Midtown offers a convenient location near Times Square and Grand Central, with automated check-in/check-out and free WiFi. Rooms are noted as small, clean, and secure, catering primarily to business travelers seeking a no-frills experience."
usa_new york city_club_quarters_rockefeller_center,"Club Quarters Rockefeller Center is geared toward business or solo travelers with efficient, clean, and modern rooms. They have convenient business services like free WiFi, a desk, and a printer, and the location is ideal for midtown."
usa_new york city_comfort_inn_chelsea,"The hotel is centrally located with easy access to subway lines and various attractions, and generally provides a safe environment. Some reviewers noted that the staff was helpful, providing directions and assistance."
usa_new york city_comfort_inn_manhattan,"The Comfort Inn Manhattan is in a central location, close to the subway, with friendly, helpful, and multilingual staff. Free coffee and tea are available in the lobby."
usa_new york city_comfort_inn_manhattan_bridge,"The hotel is near multiple subway stops providing easy access to various parts of Manhattan, and offers free computers in the lobby for internet access. The hotel's location in Chinatown, while busy, is considered safe, and the hotel provides a good starting point to explore Manhattan."
usa_new york city_comfort_inn_midtown,"The Comfort Inn Midtown is known for its central location near Times Square and its friendly staff who are helpful with directions and providing tourist information. The hotel is also noted for cleanliness, a convenient business center, and being safe."
usa_new york city_comfort_inn_midtown_manhattan,"The Comfort Inn on 44th St. offers free Wi-Fi, a computer with internet and printer access, and a complimentary continental breakfast that includes coffee and tea available all day, making it convenient for solo travelers. Its location near Times Square and subway stations also provides easy access to transportation and attractions."
usa_new york city_comfort_inn_midtown_west_convention_center,"The hotel is located in a quiet area, with subway and bus stops nearby and taxis readily available, though some reviewers mention the immediate street can feel deserted at night. The staff is frequently described as helpful, offering directions and advice."
usa_new york city_comfort_inn_times_square,"The hotel is conveniently located near the Port Authority bus and subway stations, making travel to and from the airport and around the city easy. Staff are helpful, and the hotel is clean and modern."
usa_new york city_cooper_square_hotel,"The Cooper Square Hotel offers a modern, intimate experience with a library-like lobby, no traditional front desk, and friendly staff, creating a welcoming atmosphere. Rooms feature amenities like iPod docks and comfortable beds."
usa_new york city_cosmopolitan_hotel_tribeca,"The Cosmopolitan Hotel is noted for being very clean, and having staff that are helpful, and a convenient downtown location close to subway lines. It is also mentioned to be safe, though rooms can be small."
usa_new york city_courtyard_by_marriott_new_york_manhattan_times_square_south,"The hotel is located in a safe area with security measures in place, such as needing a key card to operate the elevators, and the staff is friendly and helpful. There is also a luggage storage service, free coffee in the lobby, and internet access."
usa_new york city_courtyard_by_marriott_new_york_manhattan_upper_east_side,The Courtyard Upper East Side is in a residential area that is quiet and safe. It is near public transportation with bus stops right outside the front door.
usa_new york city_courtyard_new_york_manhattan_fifth_avenue,"The hotel is centrally located near attractions like Times Square and Grand Central Station, with a deli next door and a helpful staff that can arrange transportation. There are also free computers with internet access and printers available for guests to use."
usa_new york city_courtyard_new_york_manhattan_midtown_east,The hotel has a security person that accompanies single women to their rooms and the front desk staff and concierge are friendly and helpful. Staff can provide directions and advice and are helpful in booking transportation.
usa_new york city_crosby_street_hotel,"The Crosby Street Hotel is located in the heart of Soho and offers a high level of service, spacious rooms, and attention to detail. The staff is known for being friendly and accommodating."
usa_new york city_crowne_plaza_times_square_manhattan,"The Crowne Plaza Times Square has a great location near Times Square and subway stations, with secure access requiring key cards at night. Rooms are spacious, have comfortable beds, and the hotel has helpful staff, which may make travel more effortless."
usa_new york city_da_vinci_hotel,"The Da Vinci Hotel is in a great location, close to many attractions like Central Park and Times Square. It's a smaller, European-style hotel with friendly staff and free internet access in the lobby."
usa_new york city_doubletree_guest_suites_times_square,"The Doubletree Guest Suites Times Square is in the heart of Times Square and has a subway station next door, which allows for easy transportation. Reviews mention security, and helpful staff."
usa_new york city_doubletree_hotel_chelsea_new_york_city,"The Doubletree Chelsea is a modern, clean hotel conveniently located near Penn Station, Times Square, and other attractions. Staff are helpful and friendly, though the hotel has small rooms and can have slow elevators."
usa_new york city_doubletree_metropolitan_hotel,"The Doubletree Metropolitan in NYC has a great location near a subway for easy access to attractions and has a helpful, friendly staff. The hotel rooms include a safe and blackout curtains to ensure comfort and privacy for solo travelers."
usa_new york city_dream,"The hotel has a convenient location near Times Square and Central Park, with friendly and helpful staff, although some found the front desk to be rude. There is free wireless internet in the lobby, and staff is able to accommodate early check-in."
usa_new york city_duane_street_hotel,"The Duane Street Hotel is a small, modern, and clean hotel in the Tribeca area with a friendly and helpful staff. It is located close to major subway lines, providing easy access to various parts of the city."
usa_new york city_dylan_hotel,"The Dylan Hotel is a small, quiet, and clean hotel located near Grand Central Terminal, making transportation easy; staff is generally helpful and accommodating, especially to single female travelers. Some found the location safe for walking at night, and the hotel's atmosphere conducive to a comfortable and quiet stay."
usa_new york city_eastgate_tower,"The Eastgate Tower provides a safe and secure environment, helpful and friendly staff, and is located in a quiet and residential-feeling area which is still in walking distance to Grand Central station. The rooms are large, clean, and come with kitchenettes that include a coffee maker; nearby are a 24-hour pharmacy, a supermarket, and many places to eat."
usa_new york city_econo_lodge_times_square,"The Econo Lodge Times Square offers a central location and a helpful staff, with amenities such as free coffee and tea available 24/7, making it convenient for solo travelers exploring the city. Rooms are small, but clean and well-maintained, with security features like in-room safes."
usa_new york city_embassy_suites_hotel_new_york_city,"This hotel has staff that are friendly, efficient and professional, which makes it feel like a home away from home. Located in a safe, quiet area, the hotel is a short walk from ground zero and has subway access."
usa_new york city_empire_hotel,"The Empire Hotel is in a great location, close to Central Park, Lincoln Center, and subway stops, with staff that are generally friendly and helpful. The hotel offers small but clean rooms with comfortable beds and provides amenities like a safe, and free wi-fi."
usa_new york city_envoy_club,"The Envoy Club offers spacious studio and apartment-style accommodations with full kitchens, providing a more private and independent stay. It is located in the Murray Hill neighborhood, a quieter area of Manhattan, with front desk service available during the day."
usa_new york city_eurostars_wall_street,"The hotel is located in the Financial District and close to Wall Street, with subway access nearby. Rooms are large for NYC standards, and some include a fridge, microwave, and free internet access."
usa_new york city_excelsior_hotel,"The Excelsior Hotel is located in a safe, quiet, residential Upper West Side neighborhood, near a subway station, Central Park, and museums. Some rooms have park views and the hotel provides a luggage storage service."
usa_new york city_fairfield_inn_new_york_manhattan_times_square_south,"The Fairfield Inn is conveniently located near the subway and Times Square, making it easy to get around. Some reviewers mention feeling safe walking alone at all hours despite the less-than-lovely surroundings."
usa_new york city_fitzpatrick_grand_central_hotel,"The Fitzpatrick Grand Central is in an excellent location near Grand Central Station, making it easy to get around the city. Many reviewers found the staff to be friendly and helpful."
usa_new york city_fitzpatrick_manhattan,"The Fitzpatrick Manhattan is known for its friendly and helpful staff, with many reviewers highlighting the welcoming atmosphere and personalized service. The hotel's smaller size contributes to a more intimate and home-like feel, and it's located in a safe, walkable area close to shops and public transportation."
usa_new york city_flatotel,"Flatotel rooms include a safe, and the hotel is in a central location close to many attractions and subway stations. The staff is helpful and attentive, offering services such as luggage storage, taxi organization, and free internet access."
usa_new york city_four_points_by_sheraton_manhattan_chelsea,"The Sheraton Chelsea is conveniently located near subway lines, allowing easy access to various parts of the city, and past guests have noted feeling safe in this location. The staff is friendly and helpful, and the hotel offers amenities such as free internet access in the lobby, making it suitable for solo travelers."
usa_new york city_four_points_by_sheraton_manhattan_soho_village,The hotel is located near multiple subway lines and is within walking distance of SoHo and Greenwich Village. The staff is friendly and helpful with directions and accommodating to requests.
usa_new york city_four_points_by_sheraton_midtown_times_square,"The Four Points Times Square is conveniently located near the Port Authority bus station, making transportation to and from airports easy, and is close to many subway lines. The hotel is modern, clean, and has comfortable beds, with amenities like free Wi-Fi and in-room safes."
usa_new york city_four_seasons_hotel_new_york,"The Four Seasons New York is known for its impeccable service, with staff often addressing guests by name and going out of their way to assist with requests such as restaurant reservations and transportation. The hotel offers amenities such as a house car service and a comprehensive concierge team to assist with various needs."
usa_new york city_gild_hall,"Gild Hall is recommended for single travelers due to its safe location, friendly staff, and proximity to Wall Street and the Financial District. The hotel is conveniently located near multiple subway lines for easy access to other parts of the city."
usa_new york city_gramercy_park_hotel,"The Gramercy Park Hotel provides guests access to the private Gramercy Park and offers various amenities, including a gym and spa, as well as a lobby, bars, and unique decor. Staff are generally helpful and provide room service."
usa_new york city_grand_hyatt_new_york,"The Grand Hyatt is connected to Grand Central Station, providing easy access to subways and transportation, which is mentioned as being helpful for solo travelers. It also has a helpful staff and a lobby bar open late for people traveling alone."
usa_new york city_greenwich_hotel,"The Greenwich Hotel offers a calm atmosphere, a courtyard and lounge for guests only, and a Japanese-style pool; rooms feature complimentary snacks and non-alcoholic beverages, and some have balconies overlooking the courtyard. Staff are attentive, professional, casual, and friendly."
usa_new york city_hampton_inn_35th_st_empire_state_building,"The Hampton Inn offers complimentary breakfast, free Wi-Fi, and a business center, and is centrally located near a subway station, Times Square, and Penn Station. Some reviewers noted that the staff was helpful with directions and arranging transportation."
usa_new york city_hampton_inn_madison_square_garden,"The Hampton Inn Madison Square Garden offers a convenient location near Penn Station and major subway lines, making transportation easy. The staff is consistently mentioned as friendly and helpful, offering assistance with directions and transportation."
usa_new york city_hampton_inn_manhattan_chelsea,"The Hampton Inn Chelsea has friendly, helpful staff and provides amenities like free coffee and tea 24/7; the location is convenient to subway lines, making it easy to get around Manhattan. Some reviewers noted the hotel's quiet atmosphere and safe neighborhood."
usa_new york city_hampton_inn_manhattan_soho,The Hampton Inn Soho has friendly and helpful staff and offers free coffee and tea in the lobby area 24 hours a day. Some reviewers mention feeling safe at this hotel and the hotel is near subway lines for getting around the city.
usa_new york city_hampton_inn_manhattan_times_square_south,"The Hampton Inn Times Square South has a helpful and friendly staff, offers a free breakfast, and has a business center. It is conveniently located near Times Square, Broadway, and Penn Station, with subway access nearby."
usa_new york city_hampton_inn_new_york_seaport_financial_district,"The Hampton Inn Seaport/Financial District has a friendly and helpful staff, convenient location near subways and attractions, and offers clean, comfortable rooms, free breakfast, and free internet. The hotel is also located in a safe area, making it ideal for solo travelers."
