Hotel,Summary
usa_new york city_hotel_elysee,"Hotel Elysee is centrally located in midtown Manhattan, within walking distance of MOMA and close to the subway for accessing other museums. The hotel offers a continental breakfast, evening wine and cheese, and a comfortable lounge area."
usa_new york city_hotel_gansevoort,"The Gansevoort Hotel is located in the Meatpacking District, near Greenwich Village, Soho, and Chelsea, with easy access to subway lines. From this hotel, museums are about an hour walk, or 5-10 minutes via subway."
usa_new york city_hotel_giraffe,"The Giraffe is located in the Gramercy Park area, which is near shopping, Gramercy Tavern, Union Square, and multiple subway stops. The hotel is a short walk or cab ride to museums."
usa_new york city_hotel_grand_union,"Hotel Grand Union is in midtown Manhatten, near public transit, and within walking distance of Times Square and Grand Central station. Some reviewers mentioned being close to museums, being close to subway lines that went to museum areas, or near Grand Central Station for Brooklyn Bridge, Staten Island Ferry, Statue of Liberty views, and WTC memorial."
usa_new york city_hotel_indigo_new_york_city_chelsea,The Hotel Indigo is located in close proximity to the Meatpacking District. The hotel is also near galleries.
usa_new york city_hotel_mela,"Hotel Mela is located in midtown Manhattan, steps from Times Square, and close to the subway and Rockefeller complex. It is also within walking distance of MOMA, Bryant Park, and the Public Library."
usa_new york city_hotel_metro,"The Hotel Metro is located in midtown Manhattan within walking distance of Times Square, Grand Central, Penn Station, and the shops of 5th Avenue. It is a short subway ride to Central Park and the Upper East Side."
usa_new york city_hotel_newton,"Hotel Newton is located on the Upper West Side of Manhattan, within walking distance or a short subway ride to museums on Museum Mile. The hotel is near the 96th Street subway station, providing easy access to the rest of the city."
usa_new york city_hotel_on_rivington,"The Hotel on Rivington is close to the Michali Fine Art Gallery, and is within walking distance of the Village, Soho, and Tribeca. However, it is not centrally located for tourist hotspots and museums."
usa_new york city_hotel_reserve,"I am sorry, but the reviews do not mention the proximity of this hotel to any art museums. However, the hotel is conveniently located near several subway stations, providing easy access to various parts of the city."
usa_new york city_hotel_st_james,"The St. James Hotel is located near Times Square, Broadway, and Rockefeller Center, but no specific art museums are mentioned in the reviews. Some reviewers note that the hotel is undergoing renovations, is a budget property, and is close to subway lines."
usa_new york city_hotel_stanford,"I am sorry, but nothing in the hotel reviews relates to art museums. The location of the hotel is convenient to shopping, subway stations, Penn Station, Times Square, and the Empire State Building."
usa_new york city_hotel_wales,"Hotel Wales is located on the Upper East Side, close to Central Park and the Museum Mile. The hotel is within walking distance of museums and has a rooftop terrace with views of Central Park."
usa_new york city_hudson_hotel,"The Hudson Hotel is located near the Natural History Museum, Columbus Circle, Central Park, and Lincoln Center. It has exposed brick in the lobby, and is close to subway lines."
usa_new york city_ink48_a_kimpton_hotel,"Ink48 is located on 11th Avenue between 48th and 49th, a 10-15 minute walk to Times Square and a short cab ride to downtown. Some reviewers noted the hotel's proximity to the theater district."
usa_new york city_inn_new_york_city,"The Inn New York City is located on the Upper West Side and is within walking distance of the Metropolitan Museum of Art and the Museum of Natural History. It is also located one block from the subway, providing easy access to other parts of the city."
usa_new york city_intercontinental_the_barclay_new_york,"The Barclay Intercontinental is within walking distance of MoMa, Rockerfeller Center, and other mid-town attractions, and is near the subway for accessing other areas of the city. Reviewers mention that getting around to see art is easy due to the central location."
usa_new york city_jumeirah_essex_house,"Essex House is in an excellent location near Museum Mile and within easy walking distance of the Museum of Modern Art. Some rooms have a park view, and it is close to Columbus Circle."
usa_new york city_kitano_new_york,"The Kitano is located in midtown Manhattan, within walking distance of Grand Central Station and the Empire State Building. Some rooms have views of the Empire State Building and Chrysler Building."
usa_new york city_la_quinta_manhattan,"The La Quinta Manhattan is in midtown, near the Empire State Building, Macy's, and Penn Station, with subway access; the hotel may require the AAA card upon check-in to receive discounts. Some guests recommend this hotel for its central location, access to subway lines, and proximity to many sights and locations."
usa_new york city_lafayette_house,"The Lafayette House is located in the East Village, a stroll from Soho, Nolita, and the LES. It is close to the Children's Museum of Art."
usa_new york city_le_parker_meridien,The Le Parker Meridien is located near Carnegie Hall and within walking distance of major museums. Some rooms have views of Central Park.
usa_new york city_library_hotel,"The Library Hotel is centrally located in midtown Manhattan and within walking distance of Fifth Avenue shopping, the Empire State Building, Times Square, Grand Central Terminal and the New York Public Library. The hotel's location provides easy access to transportation and major NYC sites, making it a great home base."
usa_new york city_loews_regency_hotel,"The Loews Regency is located on the Upper East Side, within walking distance of museums and a short cab ride from other attractions. The hotel is located near the subway for easy transportation."
usa_new york city_lowell_hotel,"The Lowell is located on the Upper East Side, a bit of a walk to the museums and a long cab ride downtown. It is steps from the best shopping on Madison Avenue and two blocks from Central Park."
usa_new york city_mandarin_oriental_new_york,The Mandarin Oriental is near museums and within walking distance of Columbus Circle. It's also located close to Lincoln Center.
usa_new york city_milford_plaza_hotel,"The Milford Plaza is centrally located near the theatre district, a short walk from Times Square. It's close to the ACE subway lines, 9th Ave food in Hell's Kitchen, and a short walk to Central Park."
usa_new york city_millenium_hilton,"The Millenium Hilton is located in downtown Manhattan near the subway, and is a quick ride to Times Square, Central Park, and theaters. The hotel is within walking distance of Tribeca, Soho, the Village, Little Italy, and Chinatown."
usa_new york city_millennium_hotel_broadway,"The Millennium Broadway is located half a block from Times Square and within walking distance of Rockefeller Center. Some reviewers noted that the hotel is near the subway, providing easy access to other parts of the city."
usa_new york city_millennium_un_plaza_hotel,"The Millennium UN Plaza Hotel is a 5-10 minute walk to Grand Central station where you can catch the subway to travel south, or you can walk to Theater Land/Central Park. It is located on the far east side (between 1st and 2nd ave on 44th)."
usa_new york city_moderne_hotel,"The Moderne Hotel is within walking distance of MOMA. Rooms feature Andy Warhol-themed decor, including Marilyn Monroe pictures."
usa_new york city_morgans_hotel,The hotel is within walking distance of MOMA (30 minutes). It is also close to Grand Central station.
usa_new york city_murray_hill_east_suites,"Murray Hill East Suites is within walking distance to MoMA, but guests need to take the subway to get to anywhere else in the city. It is located close to Grand Central station and is near the Chrysler building."
usa_new york city_murray_hill_inn,"This hotel is located in Midtown Manhattan, within walking distance of the Empire State Building. Subway access is nearby, allowing for easy transportation to other parts of the city."
usa_new york city_new_york_marriott_downtown,"This hotel is located in downtown Manhattan, near subway lines that provide access to midtown in 10-20 minutes. The hotel is not near many touristy sites, but a short subway ride away from Times Square, Rockefeller Center and museums."
usa_new york city_new_york_marriott_east_side,"The Marriott East Side is within walking distance of the Met and other museums. The hotel is near the 6, E, and V subway lines for easy access to other parts of Manhattan."
usa_new york city_new_york_marriott_marquis,"The Marriott Marquis is located in Times Square, and within walking distance to Central Park, Rockefeller Center, and 5th Ave shopping. The hotel is also close to many subway lines for easy access to other attractions in New York."
usa_new york city_new_york_palace_hotel,"The New York Palace is located in midtown Manhattan, within walking distance of museums and landmarks, including Rockefeller Center, Fifth Avenue, St. Patrick's Cathedral, and Central Park. Some reviewers recommend taking a quick cab or the nearby subway to visit museums in Greenwich or Soho."
usa_new york city_night_hotel,"The Night Hotel is located just off Times Square, near the Theater District. Many major attractions are within a few blocks walk."
usa_new york city_novotel_new_york_times_square,"The Novotel Times Square is within walking distance to Central Park, and many attractions. It's also located near the subway for transport to other parts of the city."
usa_new york city_off_soho_suites,"Off Soho Suites is located within walking distance of Soho, Greenwich Village, and the Lower East Side. Subway access is nearby, which is a 15-minute ride to major attractions."
usa_new york city_omni_berkshire_place,"The Omni Berkshire Place is within walking distance of the Museum of Modern Art (MoMA). It's located between 5th Avenue and Madison, close to midtown shops and several subway stations."
usa_new york city_on_the_ave_hotel,"On the Ave is located on the Upper West Side, within walking distance of Central Park and the Natural History Museum, and near the 72nd and 79th street subway stations. Some reviewers recommend it for visits to the Lincoln Center."
usa_new york city_park_79_hotel,"Park 79 is located on the Upper West Side, close to the Natural History Museum and within walking distance of museums and Central Park. Some reviewers mention the hotel's proximity to museums as a positive aspect of the location."
usa_new york city_park_central,"The Park Central Hotel is within walking distance of the Museum of Modern Art, Central Park, and Carnegie Hall. It is on 7th Avenue, near the 57th Street subway station."
usa_new york city_park_south_hotel,The Park South Hotel is near the Upper East Side museums and within walking distance of lower Fifth Ave shopping; the subway is half a block away for access to museums. The hotel provides a free newspaper each morning and offers DVDs to borrow.
usa_new york city_peninsula_new_york,"The Peninsula is located on 5th Avenue and 55th street, close to MOMA and within walking distance of shopping, Central Park, and Times Square. Some rooms have views of 5th Avenue and the Moma Sculpture Garden."
usa_new york city_phillips_club,"The Phillips Club is located near Lincoln Center, and steps away from the 1-line subway. It is also near the park."
usa_new york city_plaza_athenee_hotel,"The Plaza Athenee is located on the Upper East Side, close to the Museum of Modern Art and within walking distance of museums and Central Park. It is situated near Madison Avenue and Lexington Avenue."
usa_new york city_radisson_martinique_on_broadway,"The Radisson Martinique is located within walking distance of the Flat Iron building and Times Square. It is near a subway, so Central Park is about 10-15 minutes away."
usa_new york city_ramada_eastside,The Ramada Eastside is located near the green subway line (#6) which services a lot of museums and other tourist hotspots. It is also within walking distance of the Empire State Building.
usa_new york city_red_roof_inn_manhattan,"The Red Roof Inn is located in Midtown Manhattan, near the Empire State Building and close to subway lines, although not particularly known for glamour.
Some reviewers mention walking to Times Square, Rockefeller Center, and Radio City Music Hall."
usa_new york city_renaissance_new_york_hotel_57,"Hotel 57 is located in midtown Manhattan, close to the subway and within walking distance of major attractions like Central Park and the MOMA. Some reviewers note its proximity to 5th Avenue and other shopping areas."
usa_new york city_renaissance_new_york_hotel_times_square,"The Renaissance New York Times Square is within walking distance of MOMA, the Design Museum, and Columbus Circle. The hotel is also close to subway stations and tour buses for getting around the city."
usa_new york city_residence_inn_by_marriott_times_square_new_york,The Residence Inn Times Square is within walking distance of MOMA and a slightly longer walk to museums on the Upper West Side. The hotel is near subway lines that provide access to all of Manhattan.
usa_new york city_ritz_carlton_battery_park,"The Ritz-Carlton Battery Park is located in lower Manhattan, near subway lines that provide access to midtown, but is a $15-$25 cab ride to the Theatre District. Some reviewers note that the hotel is not within walking distance of many attractions and museums, while others appreciate the quiet location away from the busier parts of the city."
usa_new york city_rockefeller_center_hotel,"The Rockefeller Center Hotel is located near the MOMA, and is within walking distance of many attractions including Times Square, Central Park, and 5th Avenue shopping. Some rooms have kitchenettes with a fridge and microwave, and there is a restaurant on the 7th floor."
usa_new york city_roger_smith_hotel,The Roger Smith Hotel has an art gallery and displays innovative art in its rooms. The hotel is near Grand Central Station.
usa_new york city_roger_williams_hotel,"The Roger Williams Hotel is within walking distance of Central Park and a subway, providing easy access to museums, and is near the Met. The hotel is also described as trendy with an eclectic feel."
usa_new york city_room_mate_grace,Room Mate Grace is located a 15 minute walk from Central Park and within walking distance of MoMA. The hotel is near the Theater District in Times Square and some reviews mention that it is easy to see all the other parts of the city.
usa_new york city_royalton_hotel_new_york_city,"The Royalton Hotel is located in Midtown Manhattan, within walking distance of Times Square, the Theater District, and a short cab ride from Union Square. It is near attractions such as the Rockefeller Center and the Museum of Modern Art (MoMA)."
usa_new york city_salisbury_hotel,"The Salisbury Hotel is located near MoMa and the subway, making it easy to travel to the MET. Several reviewers mentioned its proximity to museums like the MoMa and its great location near the subway."
usa_new york city_san_carlos_hotel,"The San Carlos is within walking distance of Rockefeller Center, St. Patrick's Cathedral, and museums, and is near a subway station. Some rooms have kitchenettes with microwaves and refrigerators, and the hotel offers a business center with free internet."
usa_new york city_seafarers_international_house,"Seafarers International House is near Union Square, a transportation hub with subway links to the rest of NYC. It is also close to shopping, restaurants, and supermarkets."
usa_new york city_sheraton_new_york_hotel_towers,"The hotel is close to the MoMA and a short subway ride away from the Metropolitan Museum of Art, and you can walk from this location to midtown sites. The gym has clean, available equipment and easy access."
usa_new york city_skyline_hotel,"The Skyline Hotel is located a few blocks from Times Square, Broadway theaters, and the Hop-On/Off bus, within walking distance to Times Square, Columbus Circle, and Central Park. Some rooms have views of the Empire State Building."
usa_new york city_smyth_hotel_a_thompson_hotel,"The Smyth Tribeca is located near the 4-5-6 trains at City Hall, allowing for easy travel to the museums on the Upper East Side. It is also within walking distance of the contemporary art galleries in Chelsea."
usa_new york city_sofitel_new_york,"The Sofitel New York is located within walking distance to MOMA, but other art museums are accessible via a short metro ride. It is situated between 5th and 6th Avenue, near Bryant Park, Times Square, and Rockefeller Center."
usa_new york city_soho_grand_hotel,The Soho Grand is located in the Soho area near art galleries and within walking distance of the subway for access uptown. The hotel has a sophisticated ambiance and sophisticated common spaces (lounge and bar).
usa_new york city_soho_house_new_york,"The hotel is located in the Meatpacking District and is walkable to Greenwich Village and the West Village. The location is near shops, restaurants, and the High Line."
usa_new york city_stay,"I am sorry, but the hotel information provided does not mention proximity to any art museums. The hotel is located near Times Square/Broadway."
usa_new york city_the_alex_hotel,"The Alex Hotel is in Midtown Manhattan, within walking distance of Grand Central Station and the Chrysler building. Some reviewers mention it's a 15-20 minute walk to Times Square and Broadway."
usa_new york city_the_belvedere,"The Belvedere Hotel is located near Times Square and within walking distance of many Broadway shows, and it has subway access. The hotel has rooms with a kitchenette, microwave, fridge, and coffee maker."
usa_new york city_the_benjamin,"The Benjamin is located in midtown Manhattan, which reviewers say is within walking distance to museums, as well as Fifth Avenue, Rockefeller Center, and Grand Central station. The 51st street subway stop is close to the hotel, giving travelers easy access to transit."
usa_new york city_the_blakely_new_york,"The Blakely Hotel is within walking distance of MOMA, and a tolerable hike or taxi ride to the Metropolitan, Frick, and Guggenheim museums along 5th Avenue. It is described as an island of calm and comfort, with a strong desire to please."
usa_new york city_the_bowery_hotel,The Bowery Hotel is located within walking distance of SoHo and the East Village. It is also near subway stops that provide access to the rest of New York.
usa_new york city_the_bryant_park,"The Bryant Park Hotel is centrally located, within walking distance of the Museum of Modern Art and other midtown attractions. Reviews mention its close proximity to Times Square, Grand Central Station, and 5th Avenue shopping."
usa_new york city_the_carlton,"The Carlton on Madison is centrally located near the 28th St. 4,5,6 subway stop, and within walking distance of the Empire State Building, Flatiron district, and Madison Square Park. Central Park is about a 30-minute walk away, and it's easy to get around the city via subway to visit other attractions."
usa_new york city_the_carlyle_a_rosewood_hotel,"The Carlyle is located near the Met and Whitney museums, with many high-end boutiques within walking distance. Some rooms offer views of Central Park."
usa_new york city_the_franklin,"The Franklin Hotel is located on the upper east side and is within walking distance of the Guggenheim and Metropolitan Museum of Art, with the subway being around the corner. Some reviewers mentioned that it's a good location for visiting the Met Museum, Neue Galerie, and the Guggenheim Museum."
usa_new york city_the_french_quarters_guest_apartments,The French Quarters Guest Apartments are within walking distance of the Museum of Modern Art (MoMA). The hotel is also conveniently located near subway lines for easy access to downtown.
usa_new york city_the_gem_hotel_chelsea,"The Gem Hotel Chelsea is located in Chelsea, within walking distance of art galleries. The hotel is also close to public transportation for access to other areas of Manhattan."
usa_new york city_the_gem_hotel_midtown_west,"This hotel is located within walking distance of Times Square. Some reviewers mention walking to various locations in Manhattan, from Central Park to the Brooklyn Bridge."
usa_new york city_the_gem_hotel_soho,"The Gem Hotel is located on the edge of the Lower East Side, within walking distance of the New Museum. It is also close to subway lines for access to other parts of the city."
usa_new york city_the_grant_hotel,"The Grant Hotel is located on the Upper West Side, 1.5-2 blocks from the subway, and 3-4 blocks from Central Park. It is 10 minutes by cab or 15 minutes by subway to Times Square."
usa_new york city_the_hampton_inn_times_square_north,"The Hampton Inn Times Square North is within walking distance to MOMA and other museums and is close to several subway lines. The hotel is located near 5th avenue, the theater district, Times Square, and Central Park."
usa_new york city_the_helmsley_carlton_house,"The Carlton House is located on the upper east side of Manhattan, one block from Central Park and a short cab ride to Museum Mile. Some rooms have kitchenettes and sitting areas."
usa_new york city_the_helmsley_park_lane,The Helmsley Park Lane is within walking distance of the Frik Museum and Museum of Modern Art (MOMA). Its location on Central Park South is ideal for walking to major sites in Manhattan.
usa_new york city_the_herald_square_hotel,"The Herald Square Hotel is centrally located in Midtown Manhattan, within walking distance of the Empire State Building, Penn Station, Times Square, and a few subway stops for easy access to museums. The hotel offers basic, clean rooms at an affordable price, with amenities like free Wi-Fi, in-room safes, and complimentary coffee in the lobby."
usa_new york city_the_hotel_91,"Hotel 91 is located in Manhattan's Chinatown, close to the Lower East Side and within walking distance of SoHo and Little Italy. The F subway line is a 5-10 minute walk and can transport guests to various locations, including the Lower East Side."
usa_new york city_the_hotel_at_times_square,"The Hotel at Times Square is within walking distance of the Museum of Modern Art (MoMA), and a short bus ride away from museums on Central Park South, such as the Metropolitan Museum of Art and the Natural History Museum. The Frick and Whitney Museums are also nearby."
usa_new york city_the_inn_at_irving_place,The Inn at Irving Place is located in the Gramercy area of NYC. It is furnished with antiques and is designed to feel like a 19th-century mansion.
usa_new york city_the_iroquois,"The Iroquois is located in midtown Manhattan within walking distance of many attractions. A long walk or bus ride will get you to Central Park, where some of the best art museums can be found."
usa_new york city_the_jane,"The Jane is in the West Village, near the Meatpacking District and Greenwich Village. It's about 10 minutes walking distance to the 8 Ave and 14th St subway station, and the subway is about 4 blocks away."
usa_new york city_the_kimberly_hotel,"The Kimberly Hotel is located in midtown Manhattan, within walking distance of Rockefeller Center, 5th Avenue, museums, and Central Park. Subway lines are nearby for easy access to other parts of Manhattan."
usa_new york city_the_lombardy,"The Lombardy is located on 56th St between Park and Lex, within walking distance of museums, shopping, and Central Park. The subway is two blocks away at 54th and Lex."
usa_new york city_the_london_nyc,"The London NYC is within walking distance of MOMA and near other museums and attractions. The hotel is located in midtown, close to Central Park, shopping on 5th Avenue, and Times Square."
usa_new york city_the_lucerne_hotel,"The Lucerne is located on the upper west side of New York, a pleasant walk through Central Park to the 'museum mile'. It is also near the Museum of Natural History."
usa_new york city_the_manhattan_club,"The Manhattan Club is within walking distance of MOMA, Lincoln Center, and the Metropolitan Museum. Subway access is easy from this location, and buses run crosstown on 57th."
usa_new york city_the_mansfield,"The Mansfield Hotel is located in midtown Manhattan, near 5th Avenue and within walking distance of Times Square and Grand Central Station. Some reviewers describe it as a boutique hotel with small but clean and stylish rooms, while others mention noise issues and cramped spaces."
usa_new york city_the_marcel_at_gramercy,"The Marcel is within walking distance of Chelsea and the East Village and has subway access to other areas. The hotel has modern decor, and some rooms have views of the Empire State Building."
usa_new york city_the_maritime_hotel,"The Maritime Hotel is located in Chelsea, within walking distance of Greenwich Village and close to subway stations for access to other parts of the city. The Rubin Tibetan Museum and ABC carpet & Home are within walking distance."
usa_new york city_the_mark,"The Mark is located on the Upper East Side, close to museums, art galleries, and Central Park. It is also a five-minute walk from the Metropolitan Art Museum."
usa_new york city_the_marmara_manhattan_luxury_hotel_residence,"The Marmara Manhattan is located on the Upper East Side, a few blocks east of Central Park and close to the Guggenheim, Whitney, and Met museums. The hotel is accessible by subway, with the stop on 96th street."
